A1: Performance Statistics for SDSS Observing Operations
A2: Updated 6/15/06
A4: Dark Time
C5: 2001 | H5: 2002 | T5: 2003 | AG5: 2004 | AS5: 2005 | BF5: 2006
A6: Category | B6: Baseline | C6: Aug-01 | D6: Sep-01 | E6: Oct-01 | F6: Nov-01 | G6: Dec-01 | H6: Jan-02 | I6: Feb-02 | J6: Mar-02 | K6: Apr-02 | L6: May-02 | M6: Jun-02 | N6: Jul-02 | O6: Aug-02 | P6: Sep-02 | Q6: Oct-02 | R6: Nov-02 | S6: Dec-02 | T6: Jan-03 | U6: Feb-03 | V6: Mar-03 | W6: Apr-03 | X6: May-03 | Y6: Jun-03 | Z6: Jul-03 | AA6: Aug-03 | AB6: Aug-03 | AC6: Sep-03 | AD6: Oct-03 | AE6: Nov-03 | AF6: Dec-03 | AG6: Jan-04 | AH6: Feb-04 | AI6: Mar-04 | AJ6: Apr-04 | AK6: May-04 | AL6: Jun-04 | AM6: Jul-04 | AN6: Aug-04 | AO6: Sep-04 | AP6: Oct-04 | AQ6: Nov-04 | AR6: Dec-04 | AS6: Jan-05 | AT6: Feb-05 | AU6: Mar-05 | AV6: Apr-05 | AW6: May-05 | AX6: Jun-05 | AY6: Jul-05 | AZ6: Jul/Aug-05 | BA6: Aug-05 | BB6: Sep-05 | BC6: Oct-05 | BD6: Nov-05 | BE6: Dec-05 | BF6: Jan-06 | BG6: Feb-06 | BH6: Mar-06 | BI6: Apr-06 | BJ6: May-06 | BK6: Jun-06 | BL6: Jul-06 | BM6: Jul-06 | BN6: Aug-06 | BO6: Sep-06 | BP6: Oct-06 | BQ6: Nov-06 | BR6: Dec-06
A7: Total Time | C7: 4.2243055555555555 | D7: 4.8409722222222227 | E7: 4.0986111111111105 | F7: 6.1993055555555552 | G7: 6.5555555555555562 | H7: 6.7229166666666664 | I7: 6.3611111111111107 | J7: 6.0013888888888891 | K7: 5.1527777777777777 | L7: 4.1743055555555557 | M7: 3.8569444444444443 | N7: 2.55 | O7: Summer Shutdown | P7: 4.3576388888888884 | Q7: 3.6847222222222222 | R7: 5.4805555555555552 | S7: 5.9555555555555557 | T7: 5.7416666666666671 | U7: 5.843055555555555 | V7: 5.84375 | W7: 5.2743055555555554 | X7: 4.6194444444444445 | Y7: 4.1229166666666668 | Z7: 3.8534722222222224 | AA7: Summer Shutdown | AB7: 3.5722222222222224 | AC7: 4.7805555555555559 | AD7: 5.6631944444444438 | AE7: 6.0069444444444438 | AF7: 6.2847222222222223 | AG7: 6.1291666666666664 | AH7: 5.8590277777777784 | AI7: 5.3298611111111116 | AJ7: 4.7979166666666666 | AK7: 4.1395833333333334 | AL7: 4.0069444444444446 | AM7: Summer Shutdown | AN7: 4.885416666666667 | AO7: 4.5152777777777775 | AP7: 5.6923611111111114 | AQ7: 6.0291666666666659 | AR7: 6.2374999999999998 | AS7: 6.0812499999999998 | AT7: 5.7861111111111114 | AU7: 5.4861111111111107 | AV7: 4.8381944444444445 | AW7: 4.2208333333333332 | AX7: 3.9868055555555557 | AY7: 3.3993055555555554 | AZ7: Summer Shutdown | BA7: 5.459027777777778 | BB7: 5.978472222222222 | BC7: 6.2958333333333334 | BD7: 6.4194444444444443 | BE7: 6.3513888888888888 | BF7: 5.8423611111111109 | BG7: 5.395138888888888 | BH7: 4.8159722222222223 | BI7: 4.2548611111111105 | BM7: Summer Shutdown
A8: Imaging fraction | B8: 0.24 | C8: 0.21 | D8: 0.43 | E8: 0.13 | F8: 0.44 | G8: 0.38 | H8: 0.31 | I8: 0.13 | J8: 0.24 | K8: 0.02 | L8: 0.22 | M8: 0.15 | N8: 0.00 | P8: 0.12 | Q8: 0.60 | R8: 0.34 | S8: 0.26 | T8: 0.07 | U8: 0.32 | V8: 0.44 | W8: 0.43 | X8: 0.43 | Y8: 0.34 | Z8: 0.36 | AB8: 0.01 | AC8: 0.54 | AD8: 0.38 | AE8: 0.23 | AF8: 0.12 | AG8: 0.31 | AH8: 0.13 | AI8: 0.24 | AJ8: 0.38 | AK8: 0.34 | AL8: 0.35 | AN8: 0.05 | AO8: 0.48 | AP8: 0.46 | AQ8: 0.34 | AR8: 0.56 | AS8: 0.18 | AT8: 0.37 | AU8: 0.24 | AV8: 0.13 | AW8: 0.39 | AX8: 0.71 | AY8: 0.04 | BA8: 0.56 | BB8: 0.94 | BC8: 0.81 | BD8: 0.53 | BE8: 0.12 | BF8: 0.11 | BG8: 0.00 | BH8: 0.03 | BI8: 0.19
A9: Spectro fraction | B9: 0.66 | C9: 0.73 | D9: 0.48 | E9: 0.81 | F9: 0.51 | G9: 0.56 | H9: 0.58 | I9: 0.76 | J9: 0.64 | K9: 0.93 | L9: 0.74 | M9: 0.76 | N9: 0.97 | P9: 0.78 | Q9: 0.34 | R9: 0.55 | S9: 0.65 | T9: 0.77 | U9: 0.60 | V9: 0.52 | W9: 0.54 | X9: 0.54 | Y9: 0.60 | Z9: 0.54 | AB9: 0.90 | AC9: 0.30 | AD9: 0.52 | AE9: 0.46 | AF9: 0.71 | AG9: 0.25 | AH9: 0.68 | AI9: 0.69 | AJ9: 0.48 | AK9: 0.55 | AL9: 0.55 | AN9: 0.80 | AO9: 0.35 | AP9: 0.43 | AQ9: 0.60 | AR9: 0.4 | AS9: 0.74 | AT9: 0.59 | AU9: 0.68 | AV9: 0.82 | AW9: 0.54 | AX9: 0.25 | AY9: 0.61 | BA9: 0.24 | BB9: 0.03 | BC9: 0.16 | BD9: 0.39 | BE9: 0.82 | BF9: 0.82 | BG9: 0.96 | BH9: 0.90 | BI9: 0.73
A10: Weather | B10: 0.50 | C10: 0.31 | D10: 0.53 | E10: 0.88 | F10: 0.50 | G10: 0.52 | H10: 0.55 | I10: 0.46 | J10: 0.44 | K10: 0.64 | L10: 0.53 | M10: 0.52 | N10: 0.37 | P10: 0.40 | Q10: 0.47 | R10: 0.58 | S10: 0.34 | T10: 0.64 | U10: 0.63 | V10: 0.29 | W10: 0.58 | X10: 0.80 | Y10: 0.49 | Z10: 0.70 | AB10: 0.29 | AC10: 0.63 | AD10: 0.77 | AE10: 0.56 | AF10: 0.68 | AG10: 0.27 | AH10: 0.51 | AI10: 0.51 | AJ10: 0.67 | AK10: 0.62 | AL10: 0.59 | AN10: 0.40 | AO10: 0.74 | AP10: 0.51 | AQ10: 0.34 | AR10: 0.56 | AS10: 0.47 | AT10: 0.13 | AU10: 0.57 | AV10: 0.59 | AW10: 0.64 | AX10: 0.66 | AY10: 0.59 | BA10: 0.42 | BB10: 0.39 | BC10: 0.87 | BD10: 0.71 | BE10: 0.76 | BF10: 0.70 | BG10: 0.45 | BH10: 0.44 | BI10: 0.63
A11: System uptime | B11: 0.90 | C11: 0.89 | D11: 0.98 | E11: 0.93 | F11: 0.89 | G11: 0.92 | H11: 0.93 | I11: 0.99 | J11: 0.95 | K11: 0.99 | L11: 0.90 | M11: 0.98 | N11: 0.96 | P11: 0.98 | Q11: 1.00 | R11: 0.98 | S11: 0.98 | T11: 0.98 | U11: 0.91 | V11: 0.99 | W11: 1.00 | X11: 0.99 | Y11: 0.98 | Z11: 0.92 | AB11: 0.99 | AC11: 0.92 | AD11: 1.00 | AE11: 0.97 | AF11: 0.84 | AG11: 1.00 | AH11: 0.96 | AI11: 0.98 | AJ11: 0.99 | AK11: 0.94 | AL11: 0.98 | AN11: 0.98 | AO11: 0.95 | AP11: 0.89 | AQ11: 0.91 | AR11: 0.97 | AS11: 0.98 | AT11: 0.92 | AU11: 0.99 | AV11: 0.98 | AW11: 0.97 | AX11: 1.00 | AY11: 0.99 | BA11: 0.92 | BB11: 1.00 | BC11: 0.92 | BD11: 0.95 | BE11: 0.98 | BF11: 0.95 | BG11: 1.00 | BH11: 1.00 | BI11: 0.96
A12: Imaging efficiency | B12: 0.86 | C12: 0.62 | D12: 0.67 | E12: 0.63 | F12: 0.82 | G12: 0.83 | H12: 0.84 | I12: 0.74 | J12: 0.87 | K12: 0.68 | L12: 0.83 | M12: 0.84 | P12: 0.88 | Q12: 0.90 | R12: 0.90 | S12: 0.85 | T12: 0.84 | U12: 0.80 | V12: 0.84 | W12: 0.90 | X12: 0.90 | Y12: 0.79 | Z12: 0.86 | AC12: 0.80 | AD12: 0.90 | AE12: 0.82 | AF12: 0.83 | AG12: 0.85 | AH12: 0.73 | AI12: 0.72 | AJ12: 0.84 | AK12: 0.85 | AL12: 0.83 | AN12: 0.75 | AO12: 0.88 | AP12: 0.82 | AQ12: 0.91 | AR12: 0.8 | AS12: 0.89 | AT12: 0.84 | AU12: 0.94 | AV12: 0.87 | AW12: 0.83 | AX12: 0.79 | AY12: 0.60 | BA12: 0.84 | BB12: 0.84 | BC12: 0.93 | BD12: 0.91 | BE12: 0.85 | BF12: 0.82 | BH12: 0.60 | BI12: 0.74
A13: Spectro efficiency | B13: 0.65 | C13: 0.60 | D13: 0.59 | E13: 0.57 | F13: 0.60 | G13: 0.66 | H13: 0.60 | I13: 0.66 | J13: 0.58 | K13: 0.63 | L13: 0.63 | M13: 0.58 | N13: 0.65 | P13: 0.67 | Q13: 0.56 | R13: 0.64 | S13: 0.66 | T13: 0.63 | U13: 0.61 | V13: 0.57 | W13: 0.60 | X13: 0.60 | Y13: 0.55 | Z13: 0.61 | AB13: 0.60 | AC13: 0.55 | AD13: 0.70 | AE13: 0.70 | AF13: 0.7 | AG13: 0.65 | AH13: 0.69 | AI13: 0.66 | AJ13: 0.67 | AK13: 0.69 | AL13: 0.66 | AN13: 0.70 | AO13: 0.72 | AP13: 0.78 | AQ13: 0.70 | AR13: 0.69 | AS13: 0.74 | AT13: 0.68 | AU13: 0.70 | AV13: 0.71 | AW13: 0.69 | AX13: 0.63 | AY13: 0.71 | BA13: 0.53 | BB13: 0.57 | BC13: 0.65 | BD13: 0.75 | BE13: 0.77 | BF13: 0.75 | BG13: 0.74 | BH13: 0.74 | BI13: 0.69
A14: Operations efficiency | B14: 0.90 | C14: 0.93 | D14: 0.93 | E14: 0.96 | F14: 0.96 | G14: 0.94 | H14: 0.93 | I14: 0.93 | J14: 0.89 | K14: 0.95 | L14: 0.97 | M14: 0.92 | N14: 0.97 | P14: 0.96 | Q14: 0.94 | R14: 0.97 | S14: 0.97 | T14: 0.96 | U14: 0.96 | V14: 0.96 | W14: 0.96 | X14: 0.97 | Y14: 0.95 | Z14: 0.97 | AB14: 0.93 | AC14: 0.95 | AD14: 0.97 | AE14: 0.96 | AF14: 0.94 | AG14: 0.96 | AH14: 0.96 | AI14: 0.96 | AJ14: 0.97 | AK14: 0.96 | AL14: 0.96 | AN14: 0.92 | AO14: 0.97 | AP14: 0.95 | AQ14: 0.96 | AR14: 0.96 | AS14: 0.96 | AT14: 0.96 | AU14: 0.96 | AV14: 0.95 | AW14: 0.97 | AX14: 0.97 | AY14: 0.96 | BA14: 0.97 | BB14: 0.99 | BC14: 0.99 | BD14: 0.98 | BE14: 0.96 | BF14: 0.96 | BG14: 0.96 | BH14: 0.96 | BI14: 0.97
A15: Hours lost to problems | C15: 0.4513888888888889 | D15: 9.8611111111111108E-2 | E15: 0.28541666666666665 | F15: 0.69166666666666676 | G15: 0.52777777777777779 | H15: 0.46527777777777773 | I15: 8.4722222222222213E-2 | J15: 0.28541666666666665 | K15: 5.6944444444444443E-2 | L15: 0.40763888888888888 | M15: 7.9166666666666663E-2 | N15: 0.1111111111111111 | P15: 6.7361111111111108E-2 | Q15: 0 | R15: 9.0277777777777776E-2 | S15: 0.1173611111111111 | T15: 0.12430555555555556 | U15: 0.54861111111111105 | V15: 8.7499999999999994E-2 | W15: 6.9444444444444441E-3 | X15: 5.4166666666666669E-2 | Y15: 8.0555555555555561E-2 | Z15: 0.3034722222222222 | AB15: 3.1944444444444449E-2 | AC15: 0.3979166666666667 | AD15: 2.7777777777777776E-2 | AE15: 0.16458333333333333 | AF15: 1.0020833333333334 | AG15: 0 | AH15: 0.22013888888888888 | AI15: 9.930555555555555E-2 | AJ15: 2.5000000000000001E-2 | AK15: 0.2673611111111111 | AL15: 6.3194444444444442E-2 | AN15: 0.10625 | AO15: 0.20624999999999999 | AP15: 0.63263888888888886 | AQ15: 0.54652777777777783 | AR15: 0.16527777777777777 | AS15: 0.11388888888888889 | AT15: 0.4604166666666667 | AU15: 7.4999999999999997E-2 | AV15: 0.12013888888888889 | AW15: 0.13263888888888889 | AX15: 1.6666666666666666E-2 | AY15: 4.3749999999999997E-2 | BA15: 0.41597222222222219 | BB15: 1.6666666666666666E-2 | BC15: 0.48958333333333331 | BD15: 0.34513888888888888 | BE15: 0.11527777777777777 | BF15: 0.30763888888888891 | BG15: 1.2500000000000001E-2 | BH15: 1.3194444444444444E-2 | BI15: 0.15069444444444444
A16: Hours lost to weather | C16: 2.8562500000000002 | D16: 2.2951388888888888 | E16: 0.5083333333333333 | F16: 3.0513888888888889 | G16: 3.0819444444444444 | H16: 2.9034722222222222 | I16: 3.4604166666666667 | J16: 3.2583333333333333 | K16: 1.8298611111111109 | L16: 1.752777777777778 | M16: 1.8479166666666667 | N16: 1.6027777777777779 | P16: 2.6284722222222223 | Q16: 1.9395833333333332 | R16: 2.3194444444444442 | S16: 3.9541666666666671 | T16: 2.0756944444444447 | U16: 2.1347222222222224 | V16: 4.1208333333333336 | W16: 2.2013888888888888 | X16: 0.9243055555555556 | Y16: 2.0958333333333332 | Z16: 0.92847222222222225 | AB16: 2.5208333333333335 | AC16: 1.784027777777778 | AD16: 1.3284722222222223 | AE16: 2.6618055555555555 | AF16: 1.6465277777777778 | AG16: 4.4986111111111109 | AH16: 2.8680555555555554 | AI16: 2.6062500000000002 | AJ16: 1.5777777777777777 | AK16: 1.5611111111111111 | AL16: 1.6041666666666667 | AN16: 2.9097222222222219 | AO16: 1.1645833333333333 | AP16: 2.3763888888888887 | AQ16: 3.505555555555556 | AR16: 2.7305555555555556 | AS16: 3.2354166666666671 | AT16: 4.6201388888888895 | AU16: 2.3208333333333333 | AV16: 1.965972222222222 | AW16: 1.5368055555555555 | AX16: 1.3715277777777777 | AY16: 1.4048611111111111 | BA16: 2.901388888888889 | BB16: 3.6451388888888889 | BC16: 0.84305555555555556 | BD16: 1.5902777777777777 | BE16: 1.5277777777777777 | BF16: 1.7173611111111111 | BG16: 2.9569444444444444 | BH16: 2.6937500000000001 | BI16: 1.5638888888888889
A19: Dark Time Baseline Table (for plotting purposes)
C20: 2001 | H20: 2002 | T20: 2002 | AG20: 2004 | AS20: 2005 | BF20: 2005
A21: Category | B21: Baseline | C21: Aug-01 | D21: Sep | E21: Oct | F21: Nov | G21: Dec | H21: Jan | I21: Feb | J21: Mar | K21: Apr | L21: May | M21: Jun | N21: Jul | O21: Aug | P21: Sep | Q21: Oct | R21: Nov | S21: Dec | T21: Jan | U21: Feb | V21: Mar | W21: Apr | X21: May | Y21: Jun | Z21: Jul | AA21: Aug | AC21: Sep | AD21: Oct | AE21: Nov | AF21: Dec | AG21: Jan | AH21: Feb | AI21: Mar | AJ21: Apr | AK21: May | AL21: Jun | AM21: Jul | AN21: Aug | AO21: Sep | AP21: Oct | AQ21: Nov | AR21: Dec | AS21: Jan | AT21: Feb | AU21: Mar | AV21: Apr | AW21: May | AX21: Jun | AY21: Jul | AZ21: Jul/Aug-05 | BA21: Aug | BB21: Sep | BC21: Oct | BD21: Nov | BE21: Dec | BF21: Jan | BG21: Feb | BH21: Mar | BI21: Apr | BJ21: May | BK21: Jun | BL21: Jul | BM21: Jul/Aug-05 | BN21: Aug | BO21: Sep | BP21: Oct | BQ21: Nov | BR21: Dec
A22: Total Time | C22: 0 | D22: 0 | E22: 0 | F22: 0 | G22: 0 | H22: 0 | I22: 0 | J22: 0 | T22: 0 | U22: 0 | V22: 0 | AG22: 0 | AH22: 0 | AI22: 0 | AS22: 0 | AT22: 0 | AU22: 0 | BF22: 0 | BG22: 0 | BH22: 0
A23: Imaging fraction | B23: 0.24 | C23: 0.24 | D23: 0.24 | E23: 0.24 | F23: 0.24 | G23: 0.24 | H23: 0.24 | I23: 0.24 | J23: 0.24 | K23: 0.24 | L23: 0.24 | M23: 0.24 | N23: 0.24 | O23: 0.24 | P23: 0.24 | Q23: 0.24 | R23: 0.24 | S23: 0.24 | T23: 0.24 | U23: 0.24 | V23: 0.24 | W23: 0.24 | X23: 0.24 | Y23: 0.24 | Z23: 0.24 | AA23: 0.24 | AB23: 0.24 | AC23: 0.24 | AD23: 0.24 | AE23: 0.24 | AF23: 0.24 | AG23: 0.24 | AH23: 0.24 | AI23: 0.24 | AJ23: 0.24 | AK23: 0.24 | AL23: 0.24 | AM23: 0.24 | AN23: 0.24 | AO23: 0.24 | AP23: 0.24 | AQ23: 0.24 | AR23: 0.24 | AS23: 0.24 | AT23: 0.24 | AU23: 0.24 | AV23: 0.24 | AW23: 0.24 | AX23: 0.24 | AY23: 0.24 | AZ23: 0.24 | BA23: 0.24 | BB23: 0.24 | BC23: 0.24 | BD23: 0.24 | BE23: 0.24 | BF23: 0.24 | BG23: 0.24 | BH23: 0.24 | BI23: 0.24 | BJ23: 0.24 | BK23: 0.24 | BL23: 0.24 | BM23: 0.24 | BN23: 0.24 | BO23: 0.24 | BP23: 0.24 | BQ23: 0.24 | BR23: 0.24
A24: Spectro fraction | B24: 0.66 | C24: 0.66 | D24: 0.66 | E24: 0.66 | F24: 0.66 | G24: 0.66 | H24: 0.66 | I24: 0.66 | J24: 0.66 | K24: 0.66 | L24: 0.66 | M24: 0.66 | N24: 0.66 | O24: 0.66 | P24: 0.66 | Q24: 0.66 | R24: 0.66 | S24: 0.66 | T24: 0.66 | U24: 0.66 | V24: 0.66 | W24: 0.66 | X24: 0.66 | Y24: 0.66 | Z24: 0.66 | AA24: 0.66 | AB24: 0.66 | AC24: 0.66 | AD24: 0.66 | AE24: 0.66 | AF24: 0.66 | AG24: 0.66 | AH24: 0.66 | AI24: 0.66 | AJ24: 0.66 | AK24: 0.66 | AL24: 0.66 | AM24: 0.66 | AN24: 0.66 | AO24: 0.66 | AP24: 0.66 | AQ24: 0.66 | AR24: 0.66 | AS24: 0.66 | AT24: 0.66 | AU24: 0.66 | AV24: 0.66 | AW24: 0.66 | AX24: 0.66 | AY24: 0.66 | AZ24: 0.66 | BA24: 0.66 | BB24: 0.66 | BC24: 0.66 | BD24: 0.66 | BE24: 0.66 | BF24: 0.66 | BG24: 0.66 | BH24: 0.66 | BI24: 0.66 | BJ24: 0.66 | BK24: 0.66 | BL24: 0.66 | BM24: 0.66 | BN24: 0.66 | BO24: 0.66 | BP24: 0.66 | BQ24: 0.66 | BR24: 0.66
A25: Weather | B25: 0.50 | C25: 0.50 | D25: 0.50 | E25: 0.60 | F25: 0.60 | G25: 0.60 | H25: 0.60 | I25: 0.60 | J25: 0.60 | K25: 0.60 | L25: 0.60 | M25: 0.60 | N25: 0.50 | O25: 0.50 | P25: 0.50 | Q25: 0.60 | R25: 0.60 | S25: 0.60 | T25: 0.60 | U25: 0.60 | V25: 0.60 | W25: 0.60 | X25: 0.60 | Y25: 0.60 | Z25: 0.50 | AA25: 0.50 | AB25: 0.50 | AC25: 0.50 | AD25: 0.60 | AE25: 0.60 | AF25: 0.60 | AG25: 0.60 | AH25: 0.60 | AI25: 0.60 | AJ25: 0.60 | AK25: 0.60 | AL25: 0.60 | AM25: 0.50 | AN25: 0.50 | AO25: 0.50 | AP25: 0.60 | AQ25: 0.60 | AR25: 0.60 | AS25: 0.60 | AT25: 0.60 | AU25: 0.60 | AV25: 0.60 | AW25: 0.60 | AX25: 0.60 | AY25: 0.50 | AZ25: 0.50 | BA25: 0.50 | BB25: 0.50 | BC25: 0.60 | BD25: 0.60 | BE25: 0.60 | BF25: 0.60 | BG25: 0.60 | BH25: 0.60 | BI25: 0.60 | BJ25: 0.60 | BK25: 0.60 | BL25: 0.50 | BM25: 0.50 | BN25: 0.50 | BO25: 0.50 | BP25: 0.60 | BQ25: 0.60 | BR25: 0.60
A26: System uptime | B26: 0.90 | C26: 0.90 | D26: 0.90 | E26: 0.90 | F26: 0.90 | G26: 0.90 | H26: 0.90 | I26: 0.90 | J26: 0.90 | K26: 0.90 | L26: 0.90 | M26: 0.90 | N26: 0.90 | O26: 0.90 | P26: 0.90 | Q26: 0.90 | R26: 0.90 | S26: 0.90 | T26: 0.90 | U26: 0.90 | V26: 0.90 | W26: 0.90 | X26: 0.90 | Y26: 0.90 | Z26: 0.90 | AA26: 0.90 | AB26: 0.90 | AC26: 0.90 | AD26: 0.90 | AE26: 0.90 | AF26: 0.90 | AG26: 0.90 | AH26: 0.90 | AI26: 0.90 | AJ26: 0.90 | AK26: 0.90 | AL26: 0.90 | AM26: 0.90 | AN26: 0.90 | AO26: 0.90 | AP26: 0.90 | AQ26: 0.90 | AR26: 0.90 | AS26: 0.90 | AT26: 0.90 | AU26: 0.90 | AV26: 0.90 | AW26: 0.90 | AX26: 0.90 | AY26: 0.90 | AZ26: 0.90 | BA26: 0.90 | BB26: 0.90 | BC26: 0.90 | BD26: 0.90 | BE26: 0.90 | BF26: 0.90 | BG26: 0.90 | BH26: 0.90 | BI26: 0.90 | BJ26: 0.90 | BK26: 0.90 | BL26: 0.90 | BM26: 0.90 | BN26: 0.90 | BO26: 0.90 | BP26: 0.90 | BQ26: 0.90 | BR26: 0.90
A27: Imaging efficiency | B27: 0.86 | C27: 0.86 | D27: 0.86 | E27: 0.86 | F27: 0.86 | G27: 0.86 | H27: 0.86 | I27: 0.86 | J27: 0.86 | K27: 0.86 | L27: 0.86 | M27: 0.86 | N27: 0.86 | O27: 0.86 | P27: 0.86 | Q27: 0.86 | R27: 0.86 | S27: 0.86 | T27: 0.86 | U27: 0.86 | V27: 0.86 | W27: 0.86 | X27: 0.86 | Y27: 0.86 | Z27: 0.86 | AA27: 0.86 | AB27: 0.86 | AC27: 0.86 | AD27: 0.86 | AE27: 0.86 | AF27: 0.86 | AG27: 0.86 | AH27: 0.86 | AI27: 0.86 | AJ27: 0.86 | AK27: 0.86 | AL27: 0.86 | AM27: 0.86 | AN27: 0.86 | AO27: 0.86 | AP27: 0.86 | AQ27: 0.86 | AR27: 0.86 | AS27: 0.86 | AT27: 0.86 | AU27: 0.86 | AV27: 0.86 | AW27: 0.86 | AX27: 0.86 | AY27: 0.86 | AZ27: 0.86 | BA27: 0.86 | BB27: 0.86 | BC27: 0.86 | BD27: 0.86 | BE27: 0.86 | BF27: 0.86 | BG27: 0.86 | BH27: 0.86 | BI27: 0.86 | BJ27: 0.86 | BK27: 0.86 | BL27: 0.86 | BM27: 0.86 | BN27: 0.86 | BO27: 0.86 | BP27: 0.86 | BQ27: 0.86 | BR27: 0.86
A28: Spectro efficiency | B28: 0.65 | C28: 0.65 | D28: 0.65 | E28: 0.65 | F28: 0.65 | G28: 0.65 | H28: 0.65 | I28: 0.65 | J28: 0.65 | K28: 0.65 | L28: 0.65 | M28: 0.65 | N28: 0.65 | O28: 0.65 | P28: 0.65 | Q28: 0.65 | R28: 0.65 | S28: 0.65 | T28: 0.65 | U28: 0.65 | V28: 0.65 | W28: 0.65 | X28: 0.65 | Y28: 0.65 | Z28: 0.65 | AA28: 0.65 | AB28: 0.65 | AC28: 0.65 | AD28: 0.65 | AE28: 0.65 | AF28: 0.65 | AG28: 0.65 | AH28: 0.65 | AI28: 0.65 | AJ28: 0.65 | AK28: 0.65 | AL28: 0.65 | AM28: 0.65 | AN28: 0.65 | AO28: 0.65 | AP28: 0.65 | AQ28: 0.65 | AR28: 0.65 | AS28: 0.65 | AT28: 0.65 | AU28: 0.65 | AV28: 0.65 | AW28: 0.65 | AX28: 0.65 | AY28: 0.65 | AZ28: 0.65 | BA28: 0.65 | BB28: 0.65 | BC28: 0.65 | BD28: 0.65 | BE28: 0.65 | BF28: 0.65 | BG28: 0.65 | BH28: 0.65 | BI28: 0.65 | BJ28: 0.65 | BK28: 0.65 | BL28: 0.65 | BM28: 0.65 | BN28: 0.65 | BO28: 0.65 | BP28: 0.65 | BQ28: 0.65 | BR28: 0.65
A29: Operations efficiency | B29: 0.90 | C29: 0.90 | D29: 0.90 | E29: 0.90 | F29: 0.90 | G29: 0.90 | H29: 0.90 | I29: 0.90 | J29: 0.90 | K29: 0.90 | L29: 0.90 | M29: 0.90 | N29: 0.90 | O29: 0.90 | P29: 0.90 | Q29: 0.90 | R29: 0.90 | S29: 0.90 | T29: 0.90 | U29: 0.90 | V29: 0.90 | W29: 0.90 | X29: 0.90 | Y29: 0.90 | Z29: 0.90 | AA29: 0.90 | AB29: 0.90 | AC29: 0.90 | AD29: 0.90 | AE29: 0.90 | AF29: 0.90 | AG29: 0.90 | AH29: 0.90 | AI29: 0.90 | AJ29: 0.90 | AK29: 0.90 | AL29: 0.90 | AM29: 0.90 | AN29: 0.90 | AO29: 0.90 | AP29: 0.90 | AQ29: 0.90 | AR29: 0.90 | AS29: 0.90 | AT29: 0.90 | AU29: 0.90 | AV29: 0.90 | AW29: 0.90 | AX29: 0.90 | AY29: 0.90 | AZ29: 0.90 | BA29: 0.90 | BB29: 0.90 | BC29: 0.90 | BD29: 0.90 | BE29: 0.90 | BF29: 0.90 | BG29: 0.90 | BH29: 0.90 | BI29: 0.90 | BJ29: 0.90 | BK29: 0.90 | BL29: 0.90 | BM29: 0.90 | BN29: 0.90 | BO29: 0.90 | BP29: 0.90 | BQ29: 0.90 | BR29: 0.90
A30: Hours lost to problems | C30: 0 | D30: 0 | E30: 0 | F30: 0 | G30: 0 | H30: 0 | I30: 0 | J30: 0 | T30: 0 | U30: 0 | V30: 0 | AG30: 0 | AH30: 0 | AI30: 0 | AS30: 0 | AT30: 0 | AU30: 0 | BF30: 0 | BG30: 0 | BH30: 0
A31: Hours lost to weather | C31: 0 | D31: 0 | E31: 0 | F31: 0 | G31: 0 | H31: 0 | I31: 0 | J31: 0 | T31: 0 | U31: 0 | V31: 0 | AG31: 0 | AH31: 0 | AI31: 0 | AS31: 0 | AT31: 0 | AU31: 0 | BF31: 0 | BG31: 0 | BH31: 0
A35: Dark + Gray Time
C36: 2001 | H36: 2002 | T36: 2003 | AG36: 2004 | AS36: 2005 | BF36: 2006
A37: Category | B37: Baseline | C37: Aug-01 | D37: Sep-01 | E37: Oct-01 | F37: Nov-01 | G37: Dec-01 | H37: Jan-02 | I37: Feb-02 | J37: Mar-02 | K37: Apr-02 | L37: May-02 | M37: Jun-02 | N37: Jul-02 | O37: Aug-02 | P37: Sep-02 | Q37: Oct-02 | R37: Nov-02 | S37: Dec-02 | T37: Jan-03 | U37: Feb-03 | V37: Mar-03 | W37: Apr-03 | X37: May-03 | Y37: Jun-03 | Z37: Jul-03 | AA37: Aug-03 | AB37: Aug-03 | AC37: Sep-03 | AD37: Oct-03 | AE37: Nov-03 | AF37: Dec-03 | AG37: Jan-04 | AH37: Feb-04 | AI37: Mar-04 | AJ37: Apr-04 | AK37: May-04 | AL37: Jun-04 | AM37: Jul-04 | AN37: Aug-04 | AO37: Sep-04 | AP37: Oct-04 | AQ37: Nov-04 | AR37: Dec-04 | AS37: Jan-05 | AT37: Feb-05 | AU37: Mar-05 | AV37: Apr-05 | AW37: May-05 | AX37: Jun-05 | AY37: Jul-05 | AZ37: Jul/Aug-05 | BA37: Aug-05 | BB37: Sep-05 | BC37: Oct-05 | BD37: Nov-05 | BE37: Dec-05 | BF37: Jan-06 | BG37: Feb-06 | BH37: Mar-06 | BI37: Apr-06 | BJ37: May-06 | BK37: Jun-06 | BL37: Jul-06 | BM37: Jul-06 | BN37: Aug-06 | BO37: Sep-06 | BP37: Oct-06 | BQ37: Nov-06 | BR37: Dec-06
A38: Total Time | C38: 5.8875000000000002 | D38: 6.7201388888888891 | E38: 5.4402777777777773 | F38: 8.9243055555555557 | G38: 9.2145833333333336 | H38: 9.5333333333333332 | I38: 8.5826388888888889 | J38: 7.9819444444444443 | K38: 6.582638888888888 | L38: 5.697916666666667 | M38: 5.0534722222222221 | N38: 2.9555555555555557 | O38: Summer Shutdown | P38: 5.6923611111111114 | Q38: 4.8569444444444443 | R38: 7.3993055555555562 | S38: 8.2423611111111104 | T38: 7.3465277777777773 | U38: 7.4854166666666666 | V38: 7.7381944444444448 | W38: 6.957638888888888 | X38: 5.5368055555555555 | Y38: 5.2388888888888889 | Z38: 5.0166666666666666 | AA38: Summer Shutdown | AB38: 4.0909722222222227 | AC38: 6.1541666666666659 | AD38: 8.4631944444444454 | AE38: 9.0222222222222221 | AF38: 9.6833333333333336 | AG38: 8.9868055555555557 | AH38: 8.406944444444445 | AI38: 7.2583333333333329 | AJ38: 6.3791666666666664 | AK38: 5.2166666666666668 | AL38: 5.2673611111111116 | AM38: Summer Shutdown | AN38: 7.6305555555555555 | AO38: 5.572222222222222 | AP38: 8.2118055555555554 | AQ38: 9.2736111111111104 | AR38: 9.65625 | AS38: 9.1263888888888882 | AT38: 8.6638888888888896 | AU38: 8.1381944444444443 | AV38: 6.697916666666667 | AW38: 5.4854166666666666 | AX38: 5.374305555555555 | AY38: 4.0361111111111105 | AZ38: Summer Shutdown | BA38: 8.3944444444444439 | BB38: 9.4541666666666675 | BC38: 9.5215277777777789 | BD38: 10.011111111111111 | BE38: 9.6631944444444446 | BF38: 8.4298611111111104 | BG38: 7.8180555555555555 | BH38: 6.6548611111111109 | BI38: 5.8069444444444445 | BM38: Summer Shutdown
A39: Imaging fraction | B39: 0.24 | C39: 0.17 | D39: 0.31 | E39: 0.12 | F39: 0.34 | G39: 0.31 | H39: 0.28 | I39: 0.12 | J39: 0.20 | K39: 0.02 | L39: 0.16 | M39: 0.12 | N39: 0.00 | P39: 0.09 | Q39: 0.56 | R39: 0.27 | S39: 0.17 | T39: 0.08 | U39: 0.37 | V39: 0.33 | W39: 0.38 | X39: 0.42 | Y39: 0.33 | Z39: 0.36 | AB39: 0.01 | AC39: 0.46 | AD39: 0.29 | AE39: 0.17 | AF39: 0.1 | AG39: 0.17 | AH39: 0.11 | AI39: 0.23 | AJ39: 0.34 | AK39: 0.30 | AL39: 0.34 | AN39: 0.10 | AO39: 0.45 | AP39: 0.54 | AQ39: 0.32 | AR39: 0.42 | AS39: 0.13 | AT39: 0.32 | AU39: 0.17 | AV39: 0.10 | AW39: 0.34 | AX39: 0.63 | AY39: 0.04 | BA39: 0.54 | BB39: 1.00 | BC39: 0.84 | BD39: 0.50 | BE39: 0.1 | BF39: 0.09 | BG39: 0.00 | BH39: 0.03 | BI39: 0.17
A40: Spectro fraction | B40: 0.66 | C40: 0.70 | D40: 0.59 | E40: 0.84 | F40: 0.64 | G40: 0.64 | H40: 0.65 | I40: 0.78 | J40: 0.70 | K40: 0.93 | L40: 0.78 | M40: 0.81 | N40: 0.97 | P40: 0.82 | Q40: 0.42 | R40: 0.65 | S40: 0.77 | T40: 0.79 | U40: 0.61 | V40: 0.64 | W40: 0.61 | X40: 0.58 | Y40: 0.66 | Z40: 0.58 | AB40: 0.91 | AC40: 0.44 | AD40: 0.59 | AE40: 0.57 | AF40: 0.73 | AG40: 0.40 | AH40: 0.68 | AI40: 0.65 | AJ40: 0.48 | AK40: 0.57 | AL40: 0.57 | AN40: 0.73 | AO40: 0.39 | AP40: 0.40 | AQ40: 0.63 | AR40: 0.51 | AS40: 0.72 | AT40: 0.68 | AU40: 0.75 | AV40: 0.81 | AW40: 0.59 | AX40: 0.37 | AY40: 0.59 | BA40: 0.19 | BB40: 0.02 | BC40: 0.12 | BD40: 0.39 | BE40: 0.84 | BF40: 0.78 | BG40: 0.96 | BH40: 0.88 | BI40: 0.74
A41: Weather | B41: 0.50 | C41: 0.30 | D41: 0.59 | E41: 0.82 | F41: 0.49 | G41: 0.49 | H41: 0.47 | I41: 0.42 | J41: 0.47 | K41: 0.57 | L41: 0.59 | M41: 0.57 | N41: 0.35 | P41: 0.40 | Q41: 0.41 | R41: 0.59 | S41: 0.44 | T41: 0.58 | U41: 0.57 | V41: 0.32 | W41: 0.55 | X41: 0.78 | Y41: 0.47 | Z41: 0.64 | AB41: 0.30 | AC41: 0.63 | AD41: 0.73 | AE41: 0.54 | AF41: 0.61 | AG41: 0.34 | AH41: 0.49 | AI41: 0.46 | AJ41: 0.62 | AK41: 0.61 | AL41: 0.52 | AN41: 0.39 | AO41: 0.75 | AP41: 0.47 | AQ41: 0.38 | AR41: 0.54 | AS41: 0.49 | AT41: 0.12 | AU41: 0.57 | AV41: 0.59 | AW41: 0.63 | AX41: 0.65 | AY41: 0.59 | BA41: 0.52 | BB41: 0.53 | BC41: 0.86 | BD41: 0.76 | BE41: 0.71 | BF41: 0.69 | BG41: 0.38 | BH41: 0.42 | BI41: 0.59
A42: System uptime | B42: 0.90 | C42: 0.90 | D42: 0.98 | E42: 0.94 | F42: 0.89 | G42: 0.92 | H42: 0.95 | I42: 0.99 | J42: 0.92 | K42: 0.99 | L42: 0.93 | M42: 0.97 | N42: 0.96 | P42: 0.99 | Q42: 1.00 | R42: 0.99 | S42: 0.98 | T42: 0.98 | U42: 0.87 | V42: 0.96 | W42: 0.99 | X42: 0.99 | Y42: 0.98 | Z42: 0.94 | AB42: 0.98 | AC42: 0.91 | AD42: 1.00 | AE42: 0.98 | AF42: 0.83 | AG42: 1.00 | AH42: 0.97 | AI42: 0.99 | AJ42: 1.00 | AK42: 0.95 | AL42: 0.96 | AN42: 0.98 | AO42: 0.96 | AP42: 0.92 | AQ42: 0.93 | AR42: 0.98 | AS42: 0.98 | AT42: 0.94 | AU42: 0.98 | AV42: 0.98 | AW42: 0.98 | AX42: 0.99 | AY42: 0.99 | BA42: 0.95 | BB42: 1.00 | BC42: 0.93 | BD42: 0.93 | BE42: 0.96 | BF42: 0.93 | BG42: 1.00 | BH42: 0.99 | BI42: 0.97
A43: Imaging efficiency | B43: 0.86 | C43: 0.62 | D43: 0.67 | E43: 0.63 | F43: 0.82 | G43: 0.83 | H43: 0.84 | I43: 0.74 | J43: 0.87 | K43: 0.68 | L43: 0.83 | M43: 0.84 | P43: 0.88 | Q43: 0.90 | R43: 0.90 | S43: 0.85 | T43: 0.84 | U43: 0.80 | V43: 0.84 | W43: 0.90 | X43: 0.90 | Y43: 0.79 | Z43: 0.86 | AC43: 0.80 | AD43: 0.90 | AE43: 0.82 | AF43: 0.83 | AG43: 0.06 | AH43: 0.73 | AI43: 0.72 | AJ43: 0.84 | AK43: 0.85 | AL43: 0.83 | AN43: 0.75 | AO43: 0.88 | AP43: 0.82 | AQ43: 0.91 | AR43: 0.8 | AS43: 0.89 | AT43: 0.84 | AU43: 0.94 | AV43: 0.87 | AW43: 0.83 | AX43: 0.79 | AY43: 0.60 | BA43: 0.84 | BB43: 0.84 | BC43: 0.93 | BD43: 0.91 | BE43: 0.85 | BF43: 0.82 | BH43: 0.60 | BI43: 0.74
A44: Spectro efficiency | B44: 0.65 | C44: 0.61 | D44: 0.63 | E44: 0.61 | F44: 0.60 | G44: 0.67 | H44: 0.61 | I44: 0.64 | J44: 0.61 | K44: 0.65 | L44: 0.64 | M44: 0.65 | N44: 0.65 | P44: 0.65 | Q44: 0.63 | R44: 0.63 | S44: 0.6 | T44: 0.63 | U44: 0.64 | V44: 0.58 | W44: 0.59 | X44: 0.56 | Y44: 0.56 | Z44: 0.61 | AB44: 0.60 | AC44: 0.59 | AD44: 0.70 | AE44: 0.69 | AF44: 0.7 | AG44: 0.65 | AH44: 0.66 | AI44: 0.64 | AJ44: 0.67 | AK44: 0.66 | AL44: 0.65 | AN44: 0.69 | AO44: 0.75 | AP44: 0.78 | AQ44: 0.70 | AR44: 0.72 | AS44: 0.73 | AT44: 0.69 | AU44: 0.63 | AV44: 0.71 | AW44: 0.70 | AX44: 0.67 | AY44: 0.71 | BA44: 0.49 | BB44: 0.34 | BC44: 0.62 | BD44: 0.74 | BE44: 0.76 | BF44: 0.75 | BG44: 0.75 | BH44: 0.74 | BI44: 0.68
A45: Operations efficiency | B45: 0.90 | C45: 0.94 | D45: 0.94 | E45: 0.96 | F45: 0.96 | G45: 0.93 | H45: 0.92 | I45: 0.92 | J45: 0.90 | K45: 0.95 | L45: 0.95 | M45: 0.92 | N45: 0.97 | P45: 0.96 | Q45: 0.94 | R45: 0.96 | S45: 0.95 | T45: 0.95 | U45: 0.96 | V45: 0.95 | W45: 0.96 | X45: 0.97 | Y45: 0.94 | Z45: 0.96 | AB45: 0.94 | AC45: 0.95 | AD45: 0.97 | AE45: 0.95 | AF45: 0.93 | AG45: 0.96 | AH45: 0.96 | AI45: 0.96 | AJ45: 0.96 | AK45: 0.96 | AL45: 0.94 | AN45: 0.93 | AO45: 0.97 | AP45: 0.95 | AQ45: 0.96 | AR45: 0.96 | AS45: 0.97 | AT45: 0.96 | AU45: 0.96 | AV45: 0.95 | AW45: 0.96 | AX45: 0.97 | AY45: 0.96 | BA45: 0.98 | BB45: 0.99 | BC45: 0.99 | BD45: 0.98 | BE45: 0.96 | BF45: 0.96 | BG45: 0.96 | BH45: 0.96 | BI45: 0.95
A46: Hours lost to problems | C46: 0.56180555555555556 | D46: 0.13055555555555556 | E46: 0.31527777777777777 | F46: 0.9375 | G46: 0.70763888888888893 | H46: 0.5 | I46: 9.7916666666666666E-2 | J46: 0.64166666666666672 | K46: 7.9861111111111105E-2 | L46: 0.41319444444444442 | M46: 0.17430555555555557 | N46: 0.1111111111111111 | P46: 7.1527777777777787E-2 | Q46: 0 | R46: 9.7916666666666666E-2 | S46: 0.17777777777777778 | T46: 0.12430555555555556 | U46: 0.99861111111111101 | V46: 0.16180555555555556 | W46: 5.8333333333333327E-2 | X46: 5.4166666666666669E-2 | Y46: 0.10416666666666667 | Z46: 0.3034722222222222 | AB46: 6.7361111111111108E-2 | AC46: 0.53541666666666665 | AD46: 2.7777777777777776E-2 | AE46: 0.16458333333333333 | AF46: 1.6263888888888889 | AG46: 0 | AH46: 0.25555555555555559 | AI46: 9.930555555555555E-2 | AJ46: 0.36 | AK46: 0.2673611111111111 | AL46: 0.18472222222222223 | AN46: 0.18472222222222223 | AO46: 0.20624999999999999 | AP46: 0.6381944444444444 | AQ46: 0.6118055555555556 | AR46: 0.20277777777777781 | AS46: 0.14791666666666667 | AT46: 0.48194444444444445 | AU46: 0.13680555555555554 | AV46: 0.15138888888888888 | AW46: 0.13263888888888889 | AX46: 2.8472222222222222E-2 | AY46: 4.3749999999999997E-2 | BA46: 0.43055555555555558 | BB46: 1.6666666666666666E-2 | BC46: 0.71250000000000002 | BD46: 0.7402777777777777 | BE46: 0.37916666666666665 | BF46: 0.59930555555555554 | BG46: 1.2500000000000001E-2 | BH46: 6.5972222222222224E-2 | BI46: 0.15625
A47: Hours lost to weather | C47: 4.0541666666666663 | D47: 2.7666666666666671 | E47: 1.0020833333333334 | F47: 4.4569444444444448 | G47: 4.6291666666666664 | H47: 4.8916666666666666 | I47: 4.9569444444444448 | J47: 3.8624999999999998 | K47: 2.8152777777777778 | L47: 2.1229166666666668 | M47: 2.1305555555555555 | N47: 1.9076388888888889 | P47: 3.4201388888888888 | Q47: 2.8430555555555554 | R47: 3.0395833333333333 | S47: 4.603472222222222 | T47: 3.0826388888888889 | U47: 3.0319444444444446 | V47: 5.239583333333333 | W47: 3.125 | X47: 1.2347222222222223 | Y47: 2.7638888888888888 | Z47: 1.5826388888888889 | AB47: 2.8416666666666668 | AC47: 2.2638888888888888 | AD47: 2.2590277777777779 | AE47: 4.1083333333333334 | AF47: 3.1055555555555556 | AG47: 143.15 | AH47: 4.3104166666666668 | AI47: 3.9333333333333336 | AJ47: 2.3972222222222221 | AK47: 2.0194444444444444 | AL47: 2.3583333333333334 | AN47: 4.6722222222222225 | AO47: 1.4006944444444445 | AP47: 3.9 | AQ47: 5.2763888888888895 | AR47: 4.4013888888888895 | AS47: 4.65 | AT47: 7.177083333333333 | AU47: 3.4819444444444443 | AV47: 2.7145833333333336 | AW47: 2.0187499999999998 | AX47: 1.8979166666666665 | AY47: 1.6541666666666668 | BA47: 3.7569444444444446 | BB47: 4.4152777777777779 | BC47: 1.3125 | BD47: 2.0944444444444446 | BE47: 2.6722222222222225 | BF47: 2.463888888888889 | BG47: 4.854166666666667 | BH47: 3.8527777777777779 | BI47: 2.3777777777777778
A51: Median Time for Spectroscopic Observing Activities
C53: 2001 | H53: 2002 | T53: 2003 | AG53: 2004 | AS53: 2005 | BF53: 2005
A54: Category* | B54: Baseline | C54: Aug-01 | D54: Sep-01 | E54: Oct-01 | F54: Nov-01 | G54: Dec-01 | H54: Jan-02 | I54: Feb-02 | J54: Mar-02 | K54: Apr-02 | L54: May-02 | M54: Jun-02 | N54: Jul-02 | O54: Aug-02 | P54: Sep-02 | Q54: Oct-02 | R54: Nov-02 | S54: Dec-02 | T54: Jan-03 | U54: Feb-03 | V54: Mar-03 | W54: Apr-03 | X54: May-03 | Y54: Jun-03 | Z54: Jul-03 | AA54: Aug-03 | AB54: Aug-03 | AC54: Sep-03 | AD54: Oct-03 | AE54: Nov-03 | AF54: Dec-03 | AG54: Jan-04 | AH54: Feb-04 | AI54: Mar-04 | AJ54: Apr-04 | AK54: May-04 | AL54: Jun-04 | AM54: Jul-04 | AN54: Aug-04 | AO54: Sep-04 | AP54: Oct-04 | AQ54: Nov-04 | AR54: Dec-04 | AS54: Jan-05 | AT54: Feb-05 | AU54: Mar-05 | AV54: Apr-05 | AW54: May-05 | AX54: Jun-05 | AY54: Jul-05 | AZ54: Jul/Aug-05 | BA54: Aug-05 | BB54: Sep-05 | BC54: Oct-05 | BD54: Nov-05 | BE54: Dec-05 | BF54: Jan-06 | BG54: Feb-06 | BH54: Mar-06 | BI54: Apr-06 | BJ54: May-06 | BK54: Jun-06 | BL54: Jul-06 | BM54: Jul-06 | BN54: Aug-06 | BO54: Sep-06 | BP54: Oct-06 | BQ54: Nov-06 | BR54: Dec-06
O55: Summer Shutdown | AA55: Summer Shutdown | AM55: Summer Shutdown | AZ55: Summer Shutdown | BM55: Summer Shutdown
A56: Cartridge change | B56: 10 | C56: 7 | D56: 7 | E56: 6 | F56: 6 | G56: 6 | H56: 6 | I56: 5 | J56: 5 | K56: 5 | L56: 5 | M56: 5 | N56: 5 | P56: 5 | Q56: 5 | R56: 5 | S56: 5 | T56: 5 | U56: 5 | V56: 4 | W56: 5 | X56: 4 | Y56: 4 | Z56: 5 | AB56: 7 | AC56: 4 | AD56: 4 | AE56: 4 | AF56: 4 | AG56: 8 | AH56: 4 | AI56: 4 | AJ56: 4 | AK56: 4 | AL56: 7 | AN56: 4 | AO56: 4 | AP56: 5 | AQ56: 5 | AR56: 5 | AS56: 5.00 | AT56: 5.00 | AU56: 5.00 | AV56: 4.00 | AW56: 4.00 | AX56: 4.00 | AY56: 4.00 | BA56: 5.00 | BB56: 0.00 | BC56: 8.00 | BD56: 6.00 | BE56: 5 | BF56: 5.00 | BG56: 5.00 | BH56: 5.00 | BI56: 5.00
A57: Setup | B57: 10 | C57: 14 | D57: 14 | E57: 14 | F57: 15 | G57: 13 | H57: 12 | I57: 10 | J57: 12 | K57: 8 | L57: 10 | M57: 13 | N57: 14 | P57: 11 | Q57: 14 | R57: 15 | S57: 15 | T57: 13 | U57: 11 | V57: 15 | W57: 14 | X57: 10 | Y57: 13 | Z57: 15 | AB57: 14 | AC57: 13 | AD57: 11 | AE57: 15 | AF57: 13 | AG57: 13 | AH57: 13 | AI57: 14 | AJ57: 14 | AK57: 13 | AL57: 12 | AN57: 12 | AO57: 11 | AP57: 12 | AQ57: 10 | AR57: 12 | AS57: 11.00 | AT57: 10.00 | AU57: 9.00 | AV57: 9.00 | AW57: 11.00 | AX57: 10.00 | AY57: 11.00 | BA57: 5.00 | BB57: 18.00 | BC57: 7.00 | BD57: 10.00 | BE57: 10 | BF57: 10.00 | BG57: 8.00 | BH57: 9.00 | BI57: 11.00
A58: Calibration | B58: 5 | C58: 12 | D58: 12 | E58: 12 | F58: 12 | G58: 12 | H58: 14 | I58: 12 | J58: 15 | K58: 12 | L58: 12 | M58: 12 | N58: 14 | P58: 14 | Q58: 14 | R58: 13 | S58: 13 | T58: 13 | U58: 13 | V58: 18 | W58: 13 | X58: 13 | Y58: 13 | Z58: 13 | AB58: 13 | AC58: 13 | AD58: 6 | AE58: 6 | AF58: 7 | AG58: 6 | AH58: 6 | AI58: 6 | AJ58: 6 | AK58: 6 | AL58: 6 | AN58: 6 | AO58: 6 | AP58: 6 | AQ58: 6 | AR58: 6 | AS58: 6.00 | AT58: 6.00 | AU58: 6.00 | AV58: 6.00 | AW58: 6.00 | AX58: 6.00 | AY58: 6.00 | BA58: 5.00 | BB58: 5.00 | BC58: 5.00 | BD58: 5.00 | BE58: 5 | BF58: 5.00 | BG58: 5.00 | BH58: 5.00 | BI58: 5.00
A59: CCD readout (assumed) | B59: 0 | C59: 3 | D59: 3 | E59: 3 | F59: 3 | G59: 3 | H59: 3 | I59: 3 | J59: 3 | K59: 3 | L59: 3 | M59: 3 | N59: 3 | P59: 3 | Q59: 3 | R59: 3 | S59: 3 | T59: 3 | U59: 3 | V59: 3 | W59: 3 | X59: 3 | Y59: 3 | Z59: 3 | AB59: 3 | AC59: 3 | AD59: 3 | AE59: 3 | AF59: 3 | AG59: 3 | AH59: 3 | AI59: 3 | AJ59: 3 | AK59: 3 | AL59: 3 | AN59: 3 | AO59: 3 | AP59: 3 | AQ59: 3 | AR59: 3 | AS59: 3.00 | AT59: 3.00 | AU59: 3.00 | AV59: 3.00 | AW59: 3.00 | AX59: 3.00 | AY59: 3.00 | BA59: 3.00 | BB59: 3.00 | BC59: 3.00 | BD59: 3.00 | BE59: 3 | BF59: 3.00 | BG59: 3.00 | BH59: 3.00 | BI59: 3.00 | BJ59: 3.00 | BK59: 3.00 | BL59: 3.00 | BN59: 3.00 | BO59: 3.00 | BP59: 3.00 | BQ59: 3.00 | BR59: 3
A60: Total overhead | B60: =SUM(B56:B59) -> 25 | C60: =SUM(C56:C59) -> 36 | D60: =SUM(D56:D59) -> 36 | E60: =SUM(E56:E59) -> 35 | F60: =SUM(F56:F59) -> 36 | G60: =SUM(G56:G59) -> 34 | H60: =SUM(H56:H59) -> 35 | I60: =SUM(I56:I59) -> 30 | J60: =SUM(J56:J59) -> 35 | K60: =SUM(K56:K59) -> 28 | L60: =SUM(L56:L59) -> 30 | M60: =SUM(M56:M59) -> 33 | N60: =SUM(N56:N59) -> 36 | P60: =SUM(P56:P59) -> 33 | Q60: =SUM(Q56:Q59) -> 36 | R60: =SUM(R56:R59) -> 36 | S60: =SUM(S56:S59) -> 36 | T60: =SUM(T56:T59) -> 34 | U60: =SUM(U56:U59) -> 32 | V60: =SUM(V56:V59) -> 40 | W60: =SUM(W56:W59) -> 35 | X60: =SUM(X56:X59) -> 30 | Y60: =SUM(Y56:Y59) -> 33 | Z60: =SUM(Z56:Z59) -> 36 | AB60: =SUM(AB56:AB59) -> 37 | AC60: =SUM(AC56:AC59) -> 33 | AD60: =SUM(AD56:AD59) -> 24 | AE60: =SUM(AE56:AE59) -> 28 | AF60: =SUM(AF56:AF59) -> 27 | AG60: =SUM(AG56:AG59) -> 30 | AH60: =SUM(AH56:AH59) -> 26 | AI60: =SUM(AI56:AI59) -> 27 | AJ60: =SUM(AJ56:AJ59) -> 27 | AK60: =SUM(AK56:AK59) -> 26 | AL60: =SUM(AL56:AL59) -> 28 | AN60: =SUM(AN56:AN59) -> 25 | AO60: =SUM(AO56:AO59) -> 24 | AP60: =SUM(AP56:AP59) -> 26 | AQ60: =SUM(AQ56:AQ59) -> 24 | AR60: =SUM(AR56:AR59) -> 26 | AS60: =SUM(AS56:AS59) -> 25 | AT60: =SUM(AT56:AT59) -> 24 | AU60: =SUM(AU56:AU59) -> 23 | AV60: =SUM(AV56:AV59) -> 22 | AW60: =SUM(AW56:AW59) -> 24 | AX60: =SUM(AX56:AX59) -> 23 | AY60: =SUM(AY56:AY59) -> 24 | BA60: =SUM(BA56:BA59) -> 18 | BB60: =SUM(BB56:BB59) -> 26 | BC60: =BC57+BC59 -> 10 | BD60: =BD57+BD59 -> 13 | BE60: =SUM(BE56:BE59) -> 23 | BF60: =SUM(BF56:BF59) -> 23 | BG60: =SUM(BG56:BG59) -> 21 | BH60: =SUM(BH56:BH59) -> 22 | BI60: =SUM(BI56:BI59) -> 24 | BJ60: =SUM(BJ56:BJ59) -> 3 | BK60: =SUM(BK56:BK59) -> 3 | BL60: =SUM(BL56:BL59) -> 3 | BN60: =SUM(BN56:BN59) -> 3 | BO60: =SUM(BO56:BO59) -> 3 | BP60: =BP57+BP59 -> 3 | BQ60: =BQ57+BQ59 -> 3 | BR60: =SUM(BR56:BR59) -> 3
A62: Science exposure (assumed) | B62: 45 | C62: 45 | D62: 45 | E62: 45 | F62: 45 | G62: 45 | H62: 45 | I62: 45 | J62: 45 | K62: 45 | L62: 45 | M62: 45 | N62: 45 | P62: 45 | Q62: 45 | R62: 45 | S62: 45 | T62: 45 | U62: 45 | V62: 45 | W62: 45 | X62: 45 | Y62: 45 | Z62: 45 | AB62: 45 | AC62: 45 | AD62: 45 | AE62: 45 | AF62: 45 | AG62: 45 | AH62: 45 | AI62: 45 | AJ62: 45 | AK62: 45 | AL62: 45 | AN62: 45 | AO62: 45 | AP62: 45 | AQ62: 45 | AR62: 45 | AS62: 45.00 | AT62: 45.00 | AU62: 45.00 | AV62: 45.00 | AW62: 45.00 | AX62: 45.00 | AY62: 45.00 | BA62: 45.00 | BB62: 45.00 | BC62: 45.00 | BD62: 45.00 | BE62: 45 | BF62: 45.00 | BG62: 45.00 | BH62: 45.00 | BI62: 45.00 | BJ62: 45.00 | BK62: 45.00 | BL62: 45.00 | BN62: 45.00 | BO62: 45.00 | BP62: 45.00 | BQ62: 45.00 | BR62: 45
A63: Total time per plate | B63: =B60+B62 -> 70 | C63: =C60+C62 -> 81 | D63: =D60+D62 -> 81 | E63: =E60+E62 -> 80 | F63: =F60+F62 -> 81 | G63: =G60+G62 -> 79 | H63: =H60+H62 -> 80 | I63: =I60+I62 -> 75 | J63: =J60+J62 -> 80 | K63: =K60+K62 -> 73 | L63: =L60+L62 -> 75 | M63: =M60+M62 -> 78 | N63: =N60+N62 -> 81 | P63: =P60+P62 -> 78 | Q63: =Q60+Q62 -> 81 | R63: =R60+R62 -> 81 | S63: =S60+S62 -> 81 | T63: =T60+T62 -> 79 | U63: =U60+U62 -> 77 | V63: =V60+V62 -> 85 | W63: =W60+W62 -> 80 | X63: =X60+X62 -> 75 | Y63: =Y60+Y62 -> 78 | Z63: =Z60+Z62 -> 81 | AB63: =AB60+AB62 -> 82 | AC63: =AC60+AC62 -> 78 | AD63: =AD60+AD62 -> 69 | AE63: =AE60+AE62 -> 73 | AF63: =AF60+AF62 -> 72 | AG63: =AG60+AG62 -> 75 | AH63: =AH60+AH62 -> 71 | AI63: =AI60+AI62 -> 72 | AJ63: =AJ60+AJ62 -> 72 | AK63: =AK60+AK62 -> 71 | AL63: =AL60+AL62 -> 73 | AN63: =AN60+AN62 -> 70 | AO63: =AO60+AO62 -> 69 | AP63: =AP60+AP62 -> 71 | AQ63: =AQ60+AQ62 -> 69 | AR63: =AR60+AR62 -> 71 | AS63: =AS60+AS62 -> 70 | AT63: =AT60+AT62 -> 69 | AU63: =AU60+AU62 -> 68 | AV63: =AV60+AV62 -> 67 | AW63: =AW60+AW62 -> 69 | AX63: =AX60+AX62 -> 68 | AY63: =AY60+AY62 -> 69 | BA63: =BA60+BA62 -> 63 | BB63: =BB60+BB62 -> 71 | BC63: =BC60+BC62 -> 55 | BD63: =BD60+BD62 -> 58 | BE63: =BE60+BE62 -> 68 | BF63: =BF60+BF62 -> 68 | BG63: =BG60+BG62 -> 66 | BH63: =BH60+BH62 -> 67 | BI63: =BI60+BI62 -> 69 | BJ63: =BJ60+BJ62 -> 48 | BK63: =BK60+BK62 -> 48 | BL63: =BL60+BL62 -> 48 | BN63: =BN60+BN62 -> 48 | BO63: =BO60+BO62 -> 48 | BP63: =BP60+BP62 -> 48 | BQ63: =BQ60+BQ62 -> 48 | BR63: =BR60+BR62 -> 48
A66: Spectroscopic Efficiency | B66: 0.64 | C66: =C62/C63 -> 0.55555555555555558 | D66: =D62/D63 -> 0.55555555555555558 | E66: =E62/E63 -> 0.5625 | F66: =F62/F63 -> 0.55555555555555558 | G66: =G62/G63 -> 0.569620253164557 | H66: =H62/H63 -> 0.5625 | I66: =I62/I63 -> 0.60 | J66: =J62/J63 -> 0.5625 | K66: =K62/K63 -> 0.61643835616438358 | L66: =L62/L63 -> 0.60 | M66: =M62/M63 -> 0.57692307692307687 | N66: =N62/N63 -> 0.55555555555555558 | P66: =P62/P63 -> 0.57692307692307687 | Q66: =Q62/Q63 -> 0.55555555555555558 | R66: =R62/R63 -> 0.55555555555555558 | S66: =S62/S63 -> 0.55555555555555558 | T66: =T62/T63 -> 0.569620253164557 | U66: =U62/U63 -> 0.58441558441558439 | V66: 0.53 | W66: 0.56 | X66: 0.60 | Y66: 0.58 | Z66: 0.56 | AB66: 0.55 | AC66: 0.58 | AD66: 0.65 | AE66: 0.62 | AF66: 0.62 | AG66: 0.60 | AH66: 0.63 | AI66: 0.62 | AJ66: 0.62 | AK66: 0.63 | AL66: 0.62 | AN66: 0.64 | AO66: 0.65 | AP66: 0.63 | AQ66: 0.65 | AR66: 0.63 | AS66: 0.64 | AT66: =AT62/AT63 -> 0.65217391304347827 | AU66: =AU62/AU63 -> 0.66176470588235292 | AV66: =AV62/AV63 -> 0.67164179104477617 | AW66: =AW62/AW63 -> 0.65217391304347827 | AX66: =AX62/AX63 -> 0.66176470588235292 | AY66: =AY62/AY63 -> 0.65217391304347827 | BA66: =BA62/BA63 -> 0.7142857142857143 | BB66: =BB62/BB63 -> 0.63380281690140849 | BC66: 0.66 | BD66: 0.65 | BE66: 0.66 | BF66: 0.66 | BG66: 0.68 | BH66: 0.67 | BI66: 0.65
A68: *Time shown in minutes
A70: Median Time Baseline Table (for plotting purposes)
C71: 2001 | H71: 2002 | T71: 2002 | AG71: 2004 | AS71: 2005 | BF71: 2005
A72: Category* | B72: Baseline | C72: Aug-01 | D72: Sep-01 | E72: Oct-01 | F72: Nov-01 | G72: Dec-01 | H72: Jan-02 | I72: Feb-02 | J72: Mar-02 | K72: Apr-02 | L72: May-02 | M72: Jun-02 | N72: Jul-02 | O72: Aug-02 | P72: Sep-02 | Q72: Oct-02 | R72: Nov-02 | S72: Dec-02 | T72: Jan-02 | U72: Feb-02 | V72: Mar-02 | W72: Apr-02 | X72: May-02 | Y72: Jun-02 | Z72: Jul-02 | AA72: Aug-02 | AC72: Sep-02 | AD72: Oct-02 | AE72: Nov-02 | AF72: Dec-02 | AG72: Jan-02 | AH72: Feb-02 | AI72: Mar-02 | AJ72: Apr-02 | AK72: May-02 | AL72: Jun-02 | AM72: Jul-02 | AN72: Aug-02 | AO72: Sep-02 | AP72: Oct-02 | AQ72: Nov-02 | AR72: Dec-02 | AS72: Jan-02 | AT72: Feb-02 | AU72: Mar-02 | AV72: Apr-02 | AW72: May-02 | AX72: Jun-02 | AY72: Jul-02 | AZ72: Jul/Aug | BA72: Aug-02 | BB72: Sep-02 | BC72: Oct-02 | BD72: Nov-02 | BE72: Dec-02 | BF72: Jan-02 | BG72: Feb-02 | BH72: Mar-02 | BI72: Apr-02 | BJ72: May-02 | BK72: Jun-02 | BL72: Jul-02 | BM72: Jul/Aug | BN72: Aug-02 | BO72: Sep-02 | BP72: Oct-02 | BQ72: Nov-02 | BR72: Dec-02
A73: Cartridge change | B73: 10 | C73: 10 | D73: 10 | E73: 10 | F73: 10 | G73: 10 | H73: 10 | I73: 10 | J73: 10 | K73: 10 | L73: 10 | M73: 10 | N73: 10 | O73: 10 | P73: 10 | Q73: 10 | R73: 10 | S73: 10 | T73: 10 | U73: 10 | V73: 10 | W73: 10 | X73: 10 | Y73: 10 | Z73: 10 | AA73: 10 | AB73: 10 | AC73: 10 | AD73: 10 | AE73: 10 | AF73: 10 | AG73: 10 | AH73: 10 | AI73: 10 | AJ73: 10 | AK73: 10 | AL73: 10 | AM73: 10 | AN73: 10 | AO73: 10 | AP73: 10 | AQ73: 10 | AR73: 10 | AS73: 10 | AT73: 10 | AU73: 10 | AV73: 10 | AW73: 10 | AX73: 10 | AY73: 10 | AZ73: 10 | BA73: 10 | BB73: 10 | BC73: 10 | BD73: 10 | BE73: 10 | BF73: 10 | BG73: 10 | BH73: 10 | BI73: 10 | BJ73: 10 | BK73: 10 | BL73: 10 | BM73: 10 | BN73: 10 | BO73: 10 | BP73: 10 | BQ73: 10 | BR73: 10
A74: Setup | B74: 10 | C74: 10 | D74: 10 | E74: 10 | F74: 10 | G74: 10 | H74: 10 | I74: 10 | J74: 10 | K74: 10 | L74: 10 | M74: 10 | N74: 10 | O74: 10 | P74: 10 | Q74: 10 | R74: 10 | S74: 10 | T74: 10 | U74: 10 | V74: 10 | W74: 10 | X74: 10 | Y74: 10 | Z74: 10 | AA74: 10 | AB74: 10 | AC74: 10 | AD74: 10 | AE74: 10 | AF74: 10 | AG74: 10 | AH74: 10 | AI74: 10 | AJ74: 10 | AK74: 10 | AL74: 10 | AM74: 10 | AN74: 10 | AO74: 10 | AP74: 10 | AQ74: 10 | AR74: 10 | AS74: 10 | AT74: 10 | AU74: 10 | AV74: 10 | AW74: 10 | AX74: 10 | AY74: 10 | AZ74: 10 | BA74: 10 | BB74: 10 | BC74: 10 | BD74: 10 | BE74: 10 | BF74: 10 | BG74: 10 | BH74: 10 | BI74: 10 | BJ74: 10 | BK74: 10 | BL74: 10 | BM74: 10 | BN74: 10 | BO74: 10 | BP74: 10 | BQ74: 10 | BR74: 10
A75: Calibration | B75: 5 | C75: 5 | D75: 5 | E75: 5 | F75: 5 | G75: 5 | H75: 5 | I75: 5 | J75: 5 | K75: 5 | L75: 5 | M75: 5 | N75: 5 | O75: 5 | P75: 5 | Q75: 5 | R75: 5 | S75: 5 | T75: 5 | U75: 5 | V75: 5 | W75: 5 | X75: 5 | Y75: 5 | Z75: 5 | AA75: 5 | AB75: 5 | AC75: 5 | AD75: 5 | AE75: 5 | AF75: 5 | AG75: 5 | AH75: 5 | AI75: 5 | AJ75: 5 | AK75: 5 | AL75: 5 | AM75: 5 | AN75: 5 | AO75: 5 | AP75: 5 | AQ75: 5 | AR75: 5 | AS75: 5 | AT75: 5 | AU75: 5 | AV75: 5 | AW75: 5 | AX75: 5 | AY75: 5 | AZ75: 5 | BA75: 5 | BB75: 5 | BC75: 5 | BD75: 5 | BE75: 5 | BF75: 5 | BG75: 5 | BH75: 5 | BI75: 5 | BJ75: 5 | BK75: 5 | BL75: 5 | BM75: 5 | BN75: 5 | BO75: 5 | BP75: 5 | BQ75: 5 | BR75: 5
A76: CCD readout (assumed) | B76: 0 | C76: 0 | D76: 0 | E76: 0 | F76: 0 | G76: 0 | H76: 0 | I76: 0 | J76: 0 | K76: 0 | L76: 0 | M76: 0 | N76: 0 | O76: 0 | P76: 0 | Q76: 0 | R76: 0 | S76: 0 | T76: 0 | U76: 0 | V76: 0 | W76: 0 | X76: 0 | Y76: 0 | Z76: 0 | AA76: 0 | AB76: 0 | AC76: 0 | AD76: 0 | AE76: 0 | AF76: 0 | AG76: 0 | AH76: 0 | AI76: 0 | AJ76: 0 | AK76: 0 | AL76: 0 | AM76: 0 | AN76: 0 | AO76: 0 | AP76: 0 | AQ76: 0 | AR76: 0 | AS76: 0 | AT76: 0 | AU76: 0 | AV76: 0 | AW76: 0 | AX76: 0 | AY76: 0 | AZ76: 0 | BA76: 0 | BB76: 0 | BC76: 0 | BD76: 0 | BE76: 0 | BF76: 0 | BG76: 0 | BH76: 0 | BI76: 0 | BJ76: 0 | BK76: 0 | BL76: 0 | BM76: 0 | BN76: 0 | BO76: 0 | BP76: 0 | BQ76: 0 | BR76: 0
A77: Total overhead | B77: =SUM(B73:B76) -> 25 | C77: =SUM(C73:C76) -> 25 | D77: =SUM(D73:D76) -> 25 | E77: =SUM(E73:E76) -> 25 | F77: =SUM(F73:F76) -> 25 | G77: =SUM(G73:G76) -> 25 | H77: =SUM(H73:H76) -> 25 | I77: =SUM(I73:I76) -> 25 | J77: =SUM(J73:J76) -> 25 | K77: =SUM(K73:K76) -> 25 | L77: =SUM(L73:L76) -> 25 | M77: =SUM(M73:M76) -> 25 | N77: =SUM(N73:N76) -> 25 | O77: =SUM(O73:O76) -> 25 | P77: =SUM(P73:P76) -> 25 | Q77: =SUM(Q73:Q76) -> 25 | R77: =SUM(R73:R76) -> 25 | S77: =SUM(S73:S76) -> 25 | T77: =SUM(T73:T76) -> 25 | U77: =SUM(U73:U76) -> 25 | V77: =SUM(V73:V76) -> 25 | W77: =SUM(W73:W76) -> 25 | X77: =SUM(X73:X76) -> 25 | Y77: =SUM(Y73:Y76) -> 25 | Z77: =SUM(Z73:Z76) -> 25 | AA77: =SUM(AA73:AA76) -> 25 | AB77: =SUM(AB73:AB76) -> 25 | AC77: =SUM(AC73:AC76) -> 25 | AD77: =SUM(AD73:AD76) -> 25 | AE77: =SUM(AE73:AE76) -> 25 | AF77: =SUM(AF73:AF76) -> 25 | AG77: =SUM(AG73:AG76) -> 25 | AH77: =SUM(AH73:AH76) -> 25 | AI77: =SUM(AI73:AI76) -> 25 | AJ77: =SUM(AJ73:AJ76) -> 25 | AK77: =SUM(AK73:AK76) -> 25 | AL77: =SUM(AL73:AL76) -> 25 | AM77: =SUM(AM73:AM76) -> 25 | AN77: =SUM(AN73:AN76) -> 25 | AO77: =SUM(AO73:AO76) -> 25 | AP77: =SUM(AP73:AP76) -> 25 | AQ77: =SUM(AQ73:AQ76) -> 25 | AR77: =SUM(AR73:AR76) -> 25 | AS77: =SUM(AS73:AS76) -> 25 | AT77: =SUM(AT73:AT76) -> 25 | AU77: =SUM(AU73:AU76) -> 25 | AV77: =SUM(AV73:AV76) -> 25 | AW77: =SUM(AW73:AW76) -> 25 | AX77: =SUM(AX73:AX76) -> 25 | AY77: =SUM(AY73:AY76) -> 25 | AZ77: =SUM(AZ73:AZ76) -> 25 | BA77: =SUM(BA73:BA76) -> 25 | BB77: =SUM(BB73:BB76) -> 25 | BC77: =SUM(BC73:BC76) -> 25 | BD77: =SUM(BD73:BD76) -> 25 | BE77: =SUM(BE73:BE76) -> 25 | BF77: =SUM(BF73:BF76) -> 25 | BG77: =SUM(BG73:BG76) -> 25 | BH77: =SUM(BH73:BH76) -> 25 | BI77: =SUM(BI73:BI76) -> 25 | BJ77: =SUM(BJ73:BJ76) -> 25 | BK77: =SUM(BK73:BK76) -> 25 | BL77: =SUM(BL73:BL76) -> 25 | BM77: =SUM(BM73:BM76) -> 25 | BN77: =SUM(BN73:BN76) -> 25 | BO77: =SUM(BO73:BO76) -> 25 | BP77: =SUM(BP73:BP76) -> 25 | BQ77: =SUM(BQ73:BQ76) -> 25 | BR77: =SUM(BR73:BR76) -> 25
A79: Science exposure (assumed) | B79: 45 | C79: 45 | D79: 45 | E79: 45 | F79: 45 | G79: 45 | H79: 45 | I79: 45 | J79: 45 | K79: 45 | L79: 45 | M79: 45 | N79: 45 | O79: 45 | P79: 45 | Q79: 45 | R79: 45 | S79: 45 | T79: 45 | U79: 45 | V79: 45 | W79: 45 | X79: 45 | Y79: 45 | Z79: 45 | AA79: 45 | AB79: 45 | AC79: 45 | AD79: 45 | AE79: 45 | AF79: 45 | AG79: 45 | AH79: 45 | AI79: 45 | AJ79: 45 | AK79: 45 | AL79: 45 | AM79: 45 | AN79: 45 | AO79: 45 | AP79: 45 | AQ79: 45 | AR79: 45 | AS79: 45 | AT79: 45 | AU79: 45 | AV79: 45 | AW79: 45 | AX79: 45 | AY79: 45 | AZ79: 45 | BA79: 45 | BB79: 45 | BC79: 45 | BD79: 45 | BE79: 45 | BF79: 45 | BG79: 45 | BH79: 45 | BI79: 45 | BJ79: 45 | BK79: 45 | BL79: 45 | BM79: 45 | BN79: 45 | BO79: 45 | BP79: 45 | BQ79: 45 | BR79: 45
A80: Total time per plate | B80: =B77+B79 -> 70 | C80: =C77+C79 -> 70 | D80: =D77+D79 -> 70 | E80: =E77+E79 -> 70 | F80: =F77+F79 -> 70 | G80: =G77+G79 -> 70 | H80: =H77+H79 -> 70 | I80: =I77+I79 -> 70 | J80: =J77+J79 -> 70 | K80: =K77+K79 -> 70 | L80: =L77+L79 -> 70 | M80: =M77+M79 -> 70 | N80: =N77+N79 -> 70 | O80: =O77+O79 -> 70 | P80: =P77+P79 -> 70 | Q80: =Q77+Q79 -> 70 | R80: =R77+R79 -> 70 | S80: =S77+S79 -> 70 | T80: =T77+T79 -> 70 | U80: =U77+U79 -> 70 | V80: =V77+V79 -> 70 | W80: =W77+W79 -> 70 | X80: =X77+X79 -> 70 | Y80: =Y77+Y79 -> 70 | Z80: =Z77+Z79 -> 70 | AA80: =AA77+AA79 -> 70 | AB80: =AB77+AB79 -> 70 | AC80: =AC77+AC79 -> 70 | AD80: =AD77+AD79 -> 70 | AE80: =AE77+AE79 -> 70 | AF80: =AF77+AF79 -> 70 | AG80: =AG77+AG79 -> 70 | AH80: =AH77+AH79 -> 70 | AI80: =AI77+AI79 -> 70 | AJ80: =AJ77+AJ79 -> 70 | AK80: =AK77+AK79 -> 70 | AL80: =AL77+AL79 -> 70 | AM80: =AM77+AM79 -> 70 | AN80: =AN77+AN79 -> 70 | AO80: =AO77+AO79 -> 70 | AP80: =AP77+AP79 -> 70 | AQ80: =AQ77+AQ79 -> 70 | AR80: =AR77+AR79 -> 70 | AS80: =AS77+AS79 -> 70 | AT80: =AT77+AT79 -> 70 | AU80: =AU77+AU79 -> 70 | AV80: =AV77+AV79 -> 70 | AW80: =AW77+AW79 -> 70 | AX80: =AX77+AX79 -> 70 | AY80: =AY77+AY79 -> 70 | AZ80: =AZ77+AZ79 -> 70 | BA80: =BA77+BA79 -> 70 | BB80: =BB77+BB79 -> 70 | BC80: =BC77+BC79 -> 70 | BD80: =BD77+BD79 -> 70 | BE80: =BE77+BE79 -> 70 | BF80: =BF77+BF79 -> 70 | BG80: =BG77+BG79 -> 70 | BH80: =BH77+BH79 -> 70 | BI80: =BI77+BI79 -> 70 | BJ80: =BJ77+BJ79 -> 70 | BK80: =BK77+BK79 -> 70 | BL80: =BL77+BL79 -> 70 | BM80: =BM77+BM79 -> 70 | BN80: =BN77+BN79 -> 70 | BO80: =BO77+BO79 -> 70 | BP80: =BP77+BP79 -> 70 | BQ80: =BQ77+BQ79 -> 70 | BR80: =BR77+BR79 -> 70
A82: Spectroscopic Efficiency | B82: 0.64 | C82: =C79/C80 -> 0.6428571428571429 | D82: =D79/D80 -> 0.6428571428571429 | E82: =E79/E80 -> 0.6428571428571429 | F82: =F79/F80 -> 0.6428571428571429 | G82: =G79/G80 -> 0.6428571428571429 | H82: =H79/H80 -> 0.6428571428571429 | I82: =I79/I80 -> 0.6428571428571429 | J82: =J79/J80 -> 0.6428571428571429 | K82: =K79/K80 -> 0.6428571428571429 | L82: =L79/L80 -> 0.6428571428571429 | M82: =M79/M80 -> 0.6428571428571429 | N82: =N79/N80 -> 0.6428571428571429 | O82: =O79/O80 -> 0.6428571428571429 | P82: =P79/P80 -> 0.6428571428571429 | Q82: =Q79/Q80 -> 0.6428571428571429 | R82: =R79/R80 -> 0.6428571428571429 | S82: =S79/S80 -> 0.6428571428571429 | T82: =T79/T80 -> 0.6428571428571429 | U82: =U79/U80 -> 0.6428571428571429 | V82: =V79/V80 -> 0.6428571428571429 | W82: =W79/W80 -> 0.6428571428571429 | X82: =X79/X80 -> 0.6428571428571429 | Y82: =Y79/Y80 -> 0.6428571428571429 | Z82: =Z79/Z80 -> 0.6428571428571429 | AA82: =AA79/AA80 -> 0.6428571428571429 | AB82: =AB79/AB80 -> 0.6428571428571429 | AC82: =AC79/AC80 -> 0.6428571428571429 | AD82: =AD79/AD80 -> 0.6428571428571429 | AE82: =AE79/AE80 -> 0.6428571428571429 | AF82: =AF79/AF80 -> 0.6428571428571429 | AG82: =AG79/AG80 -> 0.6428571428571429 | AH82: =AH79/AH80 -> 0.6428571428571429 | AI82: =AI79/AI80 -> 0.6428571428571429 | AJ82: =AJ79/AJ80 -> 0.6428571428571429 | AK82: =AK79/AK80 -> 0.6428571428571429 | AL82: =AL79/AL80 -> 0.6428571428571429 | AM82: =AM79/AM80 -> 0.6428571428571429 | AN82: =AN79/AN80 -> 0.6428571428571429 | AO82: =AO79/AO80 -> 0.6428571428571429 | AP82: =AP79/AP80 -> 0.6428571428571429 | AQ82: =AQ79/AQ80 -> 0.6428571428571429 | AR82: =AR79/AR80 -> 0.6428571428571429 | AS82: =AS79/AS80 -> 0.6428571428571429 | AT82: =AT79/AT80 -> 0.6428571428571429 | AU82: =AU79/AU80 -> 0.6428571428571429 | AV82: =AV79/AV80 -> 0.6428571428571429 | AW82: =AW79/AW80 -> 0.6428571428571429 | AX82: =AX79/AX80 -> 0.6428571428571429 | AY82: =AY79/AY80 -> 0.6428571428571429 | AZ82: =AZ79/AZ80 -> 0.6428571428571429 | BA82: =BA79/BA80 -> 0.6428571428571429 | BB82: =BB79/BB80 -> 0.6428571428571429 | BC82: =BC79/BC80 -> 0.6428571428571429 | BD82: =BD79/BD80 -> 0.6428571428571429 | BE82: =BE79/BE80 -> 0.6428571428571429 | BF82: =BF79/BF80 -> 0.6428571428571429 | BG82: =BG79/BG80 -> 0.6428571428571429 | BH82: =BH79/BH80 -> 0.6428571428571429 | BI82: =BI79/BI80 -> 0.6428571428571429 | BJ82: =BJ79/BJ80 -> 0.6428571428571429 | BK82: =BK79/BK80 -> 0.6428571428571429 | BL82: =BL79/BL80 -> 0.6428571428571429 | BM82: =BM79/BM80 -> 0.6428571428571429 | BN82: =BN79/BN80 -> 0.6428571428571429 | BO82: =BO79/BO80 -> 0.6428571428571429 | BP82: =BP79/BP80 -> 0.6428571428571429 | BQ82: =BQ79/BQ80 -> 0.6428571428571429 | BR82: =BR79/BR80 -> 0.6428571428571429
A84: *Time shown in minutes
A85: Printable PDF version