A1: SDSS 5-Year Baseline Survey
A2: Baseline Performance Metrics: Survey of the Southern Equatorial Stripe
A3: Revised 08-24-01
A5: Period | C5: Available dark hrs. | D5: Imaging fraction | E5: Spectro fraction | F5: Weather | G5: System uptime | H5: Imaging efficiency | I5: Spectro efficiency | J5: Imaging ops. | K5: Spectro ops. | L5: End game | M5: Available imaging hrs. | N5: Available spectro hrs. | O5: Imaging (sq. deg.) | P5: Num of spectro plates
A6: 2000 | B6: Q1
B7: Q2 | M7: = C7*D7*F7*G7*H7*J7 -> 0 | N7: = C7*E7*F7*G7*I7*K7 -> 0 | O7: = M7 * 18.75 -> 0 | P7: = N7 / 0.75 -> 0
B8: Q3 | C8: 0 | D8: 0.4 | E8: 0.6 | F8: 0.5 | G8: 0.9 | H8: 0.86 | I8: 0.65 | J8: 0.5 | K8: 0.25 | L8: 1 | M8: = C8*D8*F8*G8*H8*J8 -> 0 | N8: = C8*E8*F8*G8*I8*K8 -> 0 | O8: = M8 * 18.75 -> 0 | P8: = N8 / 0.75 -> 0
B9: Q4 | C9: 0 | D9: 0.4 | E9: 0.6 | F9: 0.6 | G9: 0.9 | H9: 0.86 | I9: 0.65 | J9: 0.75 | K9: 0.5 | L9: 1 | M9: = C9*D9*F9*G9*H9*J9 -> 0 | N9: = C9*E9*F9*G9*I9*K9 -> 0 | O9: = M9 * 18.75 -> 0 | P9: = N9 / 0.75 -> 0
A10: 2001 | B10: Q1 | M10: = C10*D10*F10*G10*H10*J10 -> 0 | N10: = C10*E10*F10*G10*I10*K10 -> 0 | O10: = M10 * 18.75 -> 0 | P10: = N10 / 0.75 -> 0
B11: Q2 | M11: = C11*D11*F11*G11*H11*J11 -> 0 | N11: = C11*E11*F11*G11*I11*K11 -> 0 | O11: = M11 * 18.75 -> 0 | P11: = N11 / 0.75 -> 0
B12: Q3 | C12: 94 | D12: 0.4 | E12: 0.6 | F12: 0.5 | G12: 0.9 | H12: 0.86 | I12: 0.65 | J12: 0.9 | K12: 0.9 | L12: 1 | M12: = C12*D12*F12*G12*H12*J12 -> 13.096080000000002 | N12: = C12*E12*F12*G12*I12*K12 -> 14.847300000000001 | O12: = M12 * 18.75 -> 245.55150000000003 | P12: = N12 / 0.75 -> 19.796400000000002
B13: Q4 | C13: 137 | D13: 0.4 | E13: 0.6 | F13: 0.6 | G13: 0.9 | H13: 0.86 | I13: 0.65 | J13: 0.9 | K13: 0.9 | L13: 1 | M13: = C13*D13*F13*G13*H13*J13 -> 22.904208000000001 | N13: = C13*E13*F13*G13*I13*K13 -> 25.96698 | O13: = M13 * 18.75 -> 429.45390000000003 | P13: = N13 / 0.75 -> 34.622639999999997
A14: 2002 | B14: Q1 | M14: = C14*D14*F14*G14*H14*J14 -> 0 | N14: = C14*E14*F14*G14*I14*K14 -> 0 | O14: = M14 * 18.75 -> 0 | P14: = N14 / 0.75 -> 0
B15: Q2 | M15: = C15*D15*F15*G15*H15*J15 -> 0 | N15: = C15*E15*F15*G15*I15*K15 -> 0 | O15: = M15 * 18.75 -> 0 | P15: = N15 / 0.75 -> 0
B16: Q3 | C16: 195 | D16: 0.4 | E16: 0.6 | F16: 0.5 | G16: 0.9 | H16: 0.86 | I16: 0.65 | J16: 0.9 | K16: 0.9 | L16: 1 | M16: = C16*D16*F16*G16*H16*J16 -> 27.167400000000001 | N16: = C16*E16*F16*G16*I16*K16 -> 30.800250000000005 | O16: = M16 * 18.75 -> 509.38875000000002 | P16: = N16 / 0.75 -> 41.067000000000007
B17: Q4 | C17: 277 | D17: 0.4 | E17: 0.6 | F17: 0.6 | G17: 0.9 | H17: 0.86 | I17: 0.65 | J17: 0.9 | K17: 0.9 | L17: 1 | M17: = C17*D17*F17*G17*H17*J17 -> 46.309968000000005 | N17: = C17*E17*F17*G17*I17*K17 -> 52.502580000000002 | O17: = M17 * 18.75 -> 868.31190000000004 | P17: = N17 / 0.75 -> 70.003439999999998
A18: 2003 | B18: Q1 | M18: = C18*D18*F18*G18*H18*J18 -> 0 | N18: = C18*E18*F18*G18*I18*K18 -> 0 | O18: = M18 * 18.75 -> 0 | P18: = N18 / 0.75 -> 0
B19: Q2 | M19: = C19*D19*F19*G19*H19*J19 -> 0 | N19: = C19*E19*F19*G19*I19*K19 -> 0 | O19: = M19 * 18.75 -> 0 | P19: = N19 / 0.75 -> 0
B20: Q3 | C20: 195 | D20: 0.4 | E20: 0.6 | F20: 0.5 | G20: 0.9 | H20: 0.86 | I20: 0.65 | J20: 0.9 | K20: 0.9 | L20: 1 | M20: = C20*D20*F20*G20*H20*J20 -> 27.167400000000001 | N20: = C20*E20*F20*G20*I20*K20 -> 30.800250000000005 | O20: = M20 * 18.75 -> 509.38875000000002 | P20: = N20 / 0.75 -> 41.067000000000007
B21: Q4 | C21: 277 | D21: 0.4 | E21: 0.6 | F21: 0.6 | G21: 0.9 | H21: 0.86 | I21: 0.65 | J21: 0.9 | K21: 0.9 | L21: 1 | M21: = C21*D21*F21*G21*H21*J21 -> 46.309968000000005 | N21: = C21*E21*F21*G21*I21*K21 -> 52.502580000000002 | O21: = M21 * 18.75 -> 868.31190000000004 | P21: = N21 / 0.75 -> 70.003439999999998
A22: 2004 | B22: Q1 | M22: = C22*D22*F22*G22*H22*J22 -> 0 | N22: = C22*E22*F22*G22*I22*K22 -> 0 | O22: = M22 * 18.75 -> 0 | P22: = N22 / 0.75 -> 0
B23: Q2 | M23: = C23*D23*F23*G23*H23*J23 -> 0 | N23: = C23*E23*F23*G23*I23*K23 -> 0 | O23: = M23 * 18.75 -> 0 | P23: = N23 / 0.75 -> 0
B24: Q3 | C24: 195 | D24: 0.4 | E24: 0.6 | F24: 0.5 | G24: 0.9 | H24: 0.86 | I24: 0.65 | J24: 0.9 | K24: 0.9 | L24: 1 | M24: = C24*D24*F24*G24*H24*J24 -> 27.167400000000001 | N24: = C24*E24*F24*G24*I24*K24 -> 30.800250000000005 | O24: = M24 * 18.75 -> 509.38875000000002 | P24: = N24 / 0.75 -> 41.067000000000007
B25: Q4 | C25: 277 | D25: 0.4 | E25: 0.6 | F25: 0.6 | G25: 0.9 | H25: 0.86 | I25: 0.65 | J25: 0.9 | K25: 0.9 | L25: 1 | M25: = C25*D25*F25*G25*H25*J25 -> 46.309968000000005 | N25: = C25*E25*F25*G25*I25*K25 -> 52.502580000000002 | O25: = M25 * 18.75 -> 868.31190000000004 | P25: = N25 / 0.75 -> 70.003439999999998
A26: 2005 | B26: Q1 | M26: = C26*D26*F26*G26*H26*J26 -> 0 | N26: = C26*E26*F26*G26*I26*K26 -> 0 | O26: = M26 * 18.75 -> 0 | P26: = N26 / 0.75 -> 0
B27: Q2 | M27: = C27*D27*F27*G27*H27*J27 -> 0 | N27: = C27*E27*F27*G27*I27*K27 -> 0 | O27: = M27 * 18.75 -> 0 | P27: = N27 / 0.75 -> 0
A28: TOTAL | C28: =SUM(C7:C27) -> 1647 | M28: =SUM(M7:M27) -> 256.43239200000005 | N28: =SUM(N7:N27) -> 290.72277000000003 | O28: = M28 * 18.75 -> 4808.1073500000011 | P28: =SUM(P7:P27) -> 387.63036000000005