A1: SDSS Survey of the Southern Equatorial Stripe
A2: Cumulative Data Collected vs. Baseline
A3: Updated 06/17/05
B5: Baseline Plan | G5: Actual Performance
B6: Square Degrees | E6: No. plts | G6: Square Degrees | J6: No. plts
A7: Period | B7: by Qtr | C7: Cumulative | D7: # times observed | E7: by Qtr | F7: Cumulative | G7: by Qtr | H7: Cumulative | I7: # times observed | J7: by Qtr | K7: Cumulative | M7: Good | N7: Unique | O7: Diff | P7: Incr
A8: 1999-Q1 | B8: 0 | C8: =B8 -> 0 | D8: =C8/270 -> 0 | E8: 0 | F8: =E8 -> 0 | G8: 0 | H8: =G8 -> 0 | I8: =H8/270 -> 0 | J8: 0 | K8: =J8 -> 0 | M8: 208 | N8: 186 | O8: =M8-N8 -> 22
A9: Q2 | B9: 0 | C9: =B9+C8 -> 0 | D9: =C9/270 -> 0 | E9: 0 | F9: =E9+F8 -> 0 | G9: 0 | H9: =H8+G9 -> 0 | I9: =H9/270 -> 0 | J9: 0 | K9: =J9+K8 -> 0 | M9: 208 | N9: 186 | O9: =M9-N9 -> 22 | P9: =O9-O8 -> 0
A10: Q3 | B10: 0 | C10: =B10+C9 -> 0 | D10: =C10/270 -> 0 | E10: 0 | F10: =E10+F9 -> 0 | G10: 0 | H10: =H9+G10 -> 0 | I10: =H10/270 -> 0 | J10: 0 | K10: =J10+K9 -> 0 | M10: 208 | N10: 186 | O10: =M10-N10 -> 22 | P10: =O10-O9 -> 0
A11: Q4 | B11: 0 | C11: =B11+C10 -> 0 | D11: =C11/270 -> 0 | E11: 0 | F11: =E11+F10 -> 0 | G11: 1 | H11: =H10+G11 -> 1 | I11: =H11/270 -> 3.7037037037037038E-3 | J11: 0 | K11: =J11+K10 -> 0 | M11: 252 | N11: 208 | O11: =M11-N11 -> 44 | P11: =O11-O10 -> 22
A12: 2000-Q1 | B12: 0 | C12: =B12+C11 -> 0 | D12: =C12/270 -> 0 | E12: 0 | F12: =E12+F11 -> 0 | G12: 0 | H12: =H11+G12 -> 1 | I12: =H12/270 -> 3.7037037037037038E-3 | J12: 2 | K12: =J12+K11 -> 2 | M12: 252 | N12: 208 | O12: =M12-N12 -> 44 | P12: =O12-O11 -> 0
A13: Q2 | B13: 0 | C13: =B13+C12 -> 0 | D13: =C13/270 -> 0 | E13: 0 | F13: =E13+F12 -> 0 | G13: 0 | H13: =H12+G13 -> 1 | I13: =H13/270 -> 3.7037037037037038E-3 | J13: 0 | K13: =J13+K12 -> 2 | M13: 252 | N13: 208 | O13: =M13-N13 -> 44 | P13: =O13-O12 -> 0
A14: Q3 | B14: 0 | C14: =B14+C13 -> 0 | D14: =C14/270 -> 0 | E14: 0 | F14: =E14+F13 -> 0 | G14: 22 | H14: =H13+G14 -> 23 | I14: =H14/270 -> 8.5185185185185183E-2 | J14: 0 | K14: =J14+K13 -> 2 | M14: 314 | N14: 208 | O14: =M14-N14 -> 106 | P14: =O14-O13 -> 62
A15: Q4 | B15: 0 | C15: =B15+C14 -> 0 | D15: =C15/270 -> 0 | E15: 0 | F15: =E15+F14 -> 0 | G15: 0 | H15: =H14+G15 -> 23 | I15: =H15/270 -> 8.5185185185185183E-2 | J15: 0 | K15: =J15+K14 -> 2 | M15: 459 | N15: 255 | O15: =M15-N15 -> 204 | P15: =O15-O14 -> 98
A16: 2001-Q1 | B16: 0 | C16: =B16+C15 -> 0 | D16: =C16/270 -> 0 | E16: 0 | F16: =E16+F15 -> 0 | G16: 1 | H16: =H15+G16 -> 24 | I16: =H16/270 -> 8.8888888888888892E-2 | J16: 0 | K16: =J16+K15 -> 2 | M16: 459 | N16: 255 | O16: =M16-N16 -> 204 | P16: =O16-O15 -> 0
A17: Q2 | B17: 0 | C17: =B17+C16 -> 0 | D17: =C17/270 -> 0 | E17: 0 | F17: =E17+F16 -> 0 | G17: 0 | H17: =H16+G17 -> 24 | I17: =H17/270 -> 8.8888888888888892E-2 | J17: 0 | K17: =J17+K16 -> 2 | M17: 476 | N17: 265 | O17: =M17-N17 -> 211 | P17: =O17-O16 -> 7
A18: Q3 | B18: 245.55150000000003 | C18: =B18+C17 -> 245.55150000000003 | D18: =C18/270 -> 0.90945000000000009 | E18: 19.796400000000002 | F18: =E18+F17 -> 19.796400000000002 | G18: 5 | H18: =H17+G18 -> 29 | I18: =H18/270 -> 0.10740740740740741 | J18: 11 | K18: =J18+K17 -> 13 | M18: 636 | N18: 270 | O18: =M18-N18 -> 366 | P18: =O18-O17 -> 155
A19: Q4 | B19: 429.45390000000003 | C19: =B19+C18 -> 675.00540000000001 | D19: =C19/270 -> 2.5000200000000001 | E19: 34.622639999999997 | F19: =E19+F18 -> 54.419039999999995 | G19: 516 | H19: =H18+G19 -> 545 | I19: =H19/270 -> 2.0185185185185186 | J19: 31 | K19: =J19+K18 -> 44 | M19: 1158 | N19: 270 | O19: =M19-N19 -> 888 | P19: =O19-O18 -> 522
A20: 2002-Q1 | B20: 0 | C20: =B20+C19 -> 675.00540000000001 | D20: =C20/270 -> 2.5000200000000001 | E20: 0 | F20: =E20+F19 -> 54.419039999999995 | G20: 206 | H20: =H19+G20 -> 751 | I20: =H20/270 -> 2.7814814814814817 | J20: 8 | K20: =J20+K19 -> 52 | M20: 1298 | N20: 270 | O20: =M20-N20 -> 1028 | P20: =O20-O19 -> 140
A21: Q2 | B21: 0 | C21: =B21+C20 -> 675.00540000000001 | D21: =C21/270 -> 2.5000200000000001 | E21: 0 | F21: =E21+F20 -> 54.419039999999995 | G21: 0 | H21: =H20+G21 -> 751 | I21: =H21/270 -> 2.7814814814814817 | J21: 0 | K21: =J21+K20 -> 52 | M21: 1298 | N21: 270 | O21: =M21-N21 -> 1028 | P21: =O21-O20 -> 0
A22: Q3 | B22: 509.38875000000002 | C22: =B22+C21 -> 1184.3941500000001 | D22: =C22/270 -> 4.3866450000000006 | E22: 41.067000000000007 | F22: =E22+F21 -> 95.486040000000003 | G22: 48 | H22: =H21+G22 -> 799 | I22: =H22/270 -> 2.9592592592592593 | J22: 18 | K22: =J22+K21 -> 70 | M22: 1391 | N22: 270 | O22: =M22-N22 -> 1121 | P22: =O22-O21 -> 93
A23: Q4 | B23: 868.31190000000004 | C23: =B23+C22 -> 2052.7060500000002 | D23: =C23/270 -> 7.602615000000001 | E23: 70.003439999999998 | F23: =E23+F22 -> 165.48948000000001 | G23: 796 | H23: =H22+G23 -> 1595 | I23: =H23/270 -> 5.9074074074074074 | J23: 38 | K23: =J23+K22 -> 108 | M23: 1800 | N23: 270 | O23: =M23-N23 -> 1530 | P23: =O23-O22 -> 409
A24: 2003-Q1 | B24: 0 | C24: =B24+C23 -> 2052.7060500000002 | D24: =C24/270 -> 7.602615000000001 | E24: 0 | F24: =E24+F23 -> 165.48948000000001 | G24: 0 | H24: =H23+G24 -> 1595 | I24: =H24/270 -> 5.9074074074074074 | J24: 31 | K24: =J24+K23 -> 139
A25: Q2 | B25: 0 | C25: =B25+C24 -> 2052.7060500000002 | D25: =C25/270 -> 7.602615000000001 | E25: 0 | F25: =E25+F24 -> 165.48948000000001 | G25: 0 | H25: =H24+G25 -> 1595 | I25: =H25/270 -> 5.9074074074074074 | J25: 10 | K25: =J25+K24 -> 149
A26: Q3 | B26: 509.38875000000002 | C26: =B26+C25 -> 2562.0948000000003 | D26: =C26/270 -> 9.4892400000000006 | E26: 41.067000000000007 | F26: =E26+F25 -> 206.55648000000002 | G26: 0 | H26: =H25+G26 -> 1595 | I26: =H26/270 -> 5.9074074074074074 | J26: 34 | K26: =J26+K25 -> 183
A27: Q4 | B27: 868.31190000000004 | C27: =B27+C26 -> 3430.4067000000005 | D27: =C27/270 -> 12.705210000000001 | E27: 70.003439999999998 | F27: =E27+F26 -> 276.55992000000003 | G27: 962 | H27: =H26+G27 -> 2557 | I27: =H27/270 -> 9.4703703703703699 | J27: 84 | K27: =J27+K26 -> 267
A28: 2004-Q1 | B28: 0 | C28: =B28+C27 -> 3430.4067000000005 | D28: =C28/270 -> 12.705210000000001 | E28: 0 | F28: =E28+F27 -> 276.55992000000003 | G28: 0 | H28: =H27+G28 -> 2557 | I28: =H28/270 -> 9.4703703703703699 | J28: 10 | K28: =J28+K27 -> 277
A29: Q2 | B29: 0 | C29: =B29+C28 -> 3430.4067000000005 | D29: =C29/270 -> 12.705210000000001 | E29: 0 | F29: =E29+F28 -> 276.55992000000003 | G29: 0 | H29: =H28+G29 -> 2557 | I29: =H29/270 -> 9.4703703703703699 | J29: 8 | K29: =J29+K28 -> 285
A30: Q3 | B30: 509.38875000000002 | C30: =B30+C29 -> 3939.7954500000005 | D30: =C30/270 -> 14.591835000000001 | E30: 41.067000000000007 | F30: =E30+F29 -> 317.62692000000004 | G30: 121 | H30: =H29+G30 -> 2678 | I30: =H30/270 -> 9.9185185185185194 | J30: 51 | K30: =J30+K29 -> 336
A31: Q4 | B31: 868.31190000000004 | C31: =B31+C30 -> 4808.1073500000002 | D31: =C31/270 -> 17.807805000000002 | E31: 70.003439999999998 | F31: =E31+F30 -> 387.63036000000005 | G31: 807 | H31: =H30+G31 -> 3485 | I31: =H31/270 -> 12.907407407407407 | J31: 44 | K31: =J31+K30 -> 380
A32: 2005-Q1 | B32: 0 | C32: =B32+C31 -> 4808.1073500000002 | D32: =C32/270 -> 17.807805000000002 | E32: 0 | F32: =E32+F31 -> 387.63036000000005 | G32: 0 | H32: =H31+G32 -> 3485 | I32: =H32/270 -> 12.907407407407407 | J32: 23 | K32: =J32+K31 -> 403
A33: Q2 | B33: 0 | C33: =B33+C32 -> 4808.1073500000002 | D33: =C33/270 -> 17.807805000000002 | E33: 0 | F33: =E33+F32 -> 387.63036000000005 | G33: 0 | H33: =H32+G33 -> 3485 | I33: =H33/270 -> 12.907407407407407 | J33: 6 | K33: =J33+K32 -> 409
A34: TOTAL | B34: =SUM(B8:B33) -> 4808.1073500000002 | C34: =C33 -> 4808.1073500000002 | D34: =D33 -> 17.807805000000002 | E34: =SUM(E8:E33) -> 387.63036000000005 | F34: =F33 -> 387.63036000000005
A36: 2005-Q2 actual numbers reflect data collected through 06/11/05.