A1: SDSS 5-Year Baseline Survey
A2: Revised Baseline Performance Metrics for Imaging - Northern Survey Region
A3: Revised 20-Jan-2005
A5: Period | C5: Available dark hrs. | E5: Imaging fraction | F5: Weather | G5: System uptime | H5: Imaging efficiency | I5: Imaging ops. | J5: End game | K5: Available imaging hours | L5: Imaging (sq. deg.)
A6: 2000 | B6: Q1 | C6: - | E6: - | F6: - | G6: - | H6: - | I6: - | J6: - | K6: 0 | L6: 0
B7: Q2 | C7: 277 | E7: 0.23 | F7: 0.6 | G7: 0.9 | H7: 0.86 | I7: 0.9 | J7: 1 | K7: = C7*E7*F7*G7*H7*I7 -> 26.628231599999996 | L7: = K7 * 15.5 -> 412.73758979999991
B8: Q3 | C8: 40 | E8: 0.23 | F8: 0.5 | G8: 0.9 | H8: 0.86 | I8: 0.9 | J8: 1 | K8: = C8*E8*F8*G8*H8*I8 -> 3.2043600000000003 | L8: = K8 * 15.5 -> 49.667580000000008
B9: Q4 | C9: 196 | E9: 0.23 | F9: 0.6 | G9: 0.9 | H9: 0.86 | I9: 0.9 | J9: 1 | K9: = C9*E9*F9*G9*H9*I9 -> 18.841636800000003 | L9: = K9 * 15.5 -> 292.04537040000002
A10: 2001 | B10: Q1 | C10: 464 | E10: 0.23 | F10: 0.6 | G10: 0.9 | H10: 0.86 | I10: 0.9 | J10: 1 | K10: = C10*E10*F10*G10*H10*I10 -> 44.604691199999998 | L10: = K10 * 15.5 -> 691.3727136
B11: Q2 | C11: 277 | E11: 0.23 | F11: 0.6 | G11: 0.9 | H11: 0.86 | I11: 0.9 | J11: 1 | K11: = C11*E11*F11*G11*H11*I11 -> 26.628231599999996 | L11: = K11 * 15.5 -> 412.73758979999991
B12: Q3 | C12: 40 | E12: 0.23 | F12: 0.5 | G12: 0.9 | H12: 0.86 | I12: 0.9 | J12: 1 | K12: = C12*E12*F12*G12*H12*I12 -> 3.2043600000000003 | L12: = K12 * 15.5 -> 49.667580000000008
B13: Q4 | C13: 196 | E13: 0.23 | F13: 0.6 | G13: 0.9 | H13: 0.86 | I13: 0.9 | J13: 1 | K13: = C13*E13*F13*G13*H13*I13 -> 18.841636800000003 | L13: = K13 * 15.5 -> 292.04537040000002
A14: 2002 | B14: Q1 | C14: 464 | E14: 0.23 | F14: 0.6 | G14: 0.9 | H14: 0.86 | I14: 0.9 | J14: 1 | K14: = C14*E14*F14*G14*H14*I14 -> 44.604691199999998 | L14: = K14 * 15.5 -> 691.3727136
B15: Q2 | C15: 277 | E15: 0.23 | F15: 0.6 | G15: 0.9 | H15: 0.86 | I15: 0.9 | J15: 1 | K15: = C15*E15*F15*G15*H15*I15 -> 26.628231599999996 | L15: = K15 * 15.5 -> 412.73758979999991
B16: Q3 | C16: 40 | E16: 0.23 | F16: 0.5 | G16: 0.9 | H16: 0.86 | I16: 0.9 | J16: 1 | K16: = C16*E16*F16*G16*H16*I16 -> 3.2043600000000003 | L16: = K16 * 15.5 -> 49.667580000000008
B17: Q4 | C17: 196 | E17: 0.23 | F17: 0.6 | G17: 0.9 | H17: 0.86 | I17: 0.9 | J17: 1 | K17: = C17*E17*F17*G17*H17*I17 -> 18.841636800000003 | L17: = K17 * 15.5 -> 292.04537040000002
A18: 2003 | B18: Q1 | C18: 464 | E18: 0.23 | F18: 0.6 | G18: 0.9 | H18: 0.86 | I18: 0.9 | J18: 1 | K18: = C18*E18*F18*G18*H18*I18 -> 44.604691199999998 | L18: = K18 * 15.5 -> 691.3727136
B19: Q2 | C19: 277 | E19: 0.23 | F19: 0.6 | G19: 0.9 | H19: 0.86 | I19: 0.9 | J19: 1 | K19: = C19*E19*F19*G19*H19*I19 -> 26.628231599999996 | L19: = K19 * 15.5 -> 412.73758979999991
B20: Q3 | C20: 40 | E20: 0.23 | F20: 0.5 | G20: 0.9 | H20: 0.86 | I20: 0.9 | J20: 1 | K20: = C20*E20*F20*G20*H20*I20 -> 3.2043600000000003 | L20: = K20 * 15.5 -> 49.667580000000008
B21: Q4 | C21: 196 | E21: 0.23 | F21: 0.6 | G21: 0.9 | H21: 0.86 | I21: 0.9 | J21: 1 | K21: = C21*E21*F21*G21*H21*I21 -> 18.841636800000003 | L21: = K21 * 15.5 -> 292.04537040000002
A22: 2004 | B22: Q1 | C22: 464 | E22: 0.23 | F22: 0.6 | G22: 0.9 | H22: 0.86 | I22: 0.9 | J22: 1 | K22: = C22*E22*F22*G22*H22*I22 -> 44.604691199999998 | L22: = K22 * 15.5 -> 691.3727136
B23: Q2 | C23: 277 | E23: 0.23 | F23: 0.6 | G23: 0.9 | H23: 0.86 | I23: 0.9 | J23: 1 | K23: = C23*E23*F23*G23*H23*I23 -> 26.628231599999996 | L23: = K23 * 15.5 -> 412.73758979999991
B24: Q3 | C24: 40 | E24: 0.23 | F24: 0.5 | G24: 0.9 | H24: 0.86 | I24: 0.9 | J24: 1 | K24: = C24*E24*F24*G24*H24*I24 -> 3.2043600000000003 | L24: = K24 * 15.5 -> 49.667580000000008
B25: Q4 | C25: 196 | E25: 0.23 | F25: 0.6 | G25: 0.9 | H25: 0.86 | I25: 0.9 | J25: 1 | K25: = C25*E25*F25*G25*H25*I25 -> 18.841636800000003 | L25: = K25 * 15.5 -> 292.04537040000002
A26: 2005 | B26: Q1 | C26: 464 | E26: 0.23 | F26: 0.6 | G26: 0.9 | H26: 0.86 | I26: 0.9 | J26: 1 | K26: = C26*E26*F26*G26*H26*I26 -> 44.604691199999998 | L26: = K26 * 15.5 -> 691.3727136
B27: Q2 | C27: 277 | E27: 0.23 | F27: 0.6 | G27: 0.9 | H27: 0.86 | I27: 0.9 | J27: 1 | K27: = C27*E27*F27*G27*H27*I27 -> 26.628231599999996 | L27: = K27 * 15.5 -> 412.73758979999991
A28: TOTAL | C28: =SUM(C7:C27) -> 5162 | K28: =SUM(K7:K27) -> 493.02282959999997 | L28: =SUM(L7:L27) -> 7641.8538588000001
A30: Notes
A31: 1) The 20-Jan-05 revision casts imaging progress in terms of "footprint" square degrees. The original baseline was cast in terms of "unique" square degrees.