A1: SDSS Northern Survey Region
A2: Cumulative Data Collected vs. Baseline
A3: Updated 07/10/06
B5: Baseline Plan | H5: Actual Performance
B6: Square Degrees | D6: Orig. Baseline - Plates | F6: Rev. Baseline - Plates | H6: Square Degrees | J6: No. plts
A7: Period | B7: by Qtr | C7: Cumulative | D7: by Qtr | E7: Cumulative | F7: by Qtr | G7: Cumulative | H7: by Qtr | I7: Cumulative | J7: by Qtr | K7: Cumulative
A8: 1999-Q1 | B8: 0 | C8: =B8 -> 0 | D8: 0 | E8: =D8 -> 0 | F8: =J8 -> 0 | G8: =F8 -> 0 | H8: 224 | I8: =H8 -> 224 | J8: 0 | K8: =J8 -> 0
A9: Q2 | B9: 0 | C9: =B9+C8 -> 0 | D9: 0 | E9: =D9+E8 -> 0 | F9: =J9 -> 0 | G9: =F9+G8 -> 0 | H9: 0 | I9: =H9+I8 -> 224 | J9: 0 | K9: =J9+K8 -> 0
A10: Q3 | B10: 0 | C10: =B10+C9 -> 0 | D10: 0 | E10: =D10+E9 -> 0 | F10: =J10 -> 0 | G10: =F10+G9 -> 0 | H10: 0 | I10: =H10+I9 -> 224 | J10: 0 | K10: =J10+K9 -> 0
A11: Q4 | B11: 0 | C11: =B11+C10 -> 0 | D11: 0 | E11: =D11+E10 -> 0 | F11: =J11 -> 0 | G11: =F11+G10 -> 0 | H11: 0 | I11: =H11+I10 -> 224 | J11: 0 | K11: =J11+K10 -> 0
A12: 2000-Q1 | B12: 0 | C12: =B12+C11 -> 0 | D12: 0 | E12: =D12+E11 -> 0 | F12: =J12 -> 10 | G12: =F12+G11 -> 10 | H12: 122 | I12: =H12+I11 -> 346 | J12: 10 | K12: =J12+K11 -> 10
A13: Q2 | B13: 412.73758979999991 | C13: =B13+C12 -> 412.73758979999991 | D13: 0 | E13: =D13+E12 -> 0 | F13: =J13 -> 36 | G13: =F13+G12 -> 46 | H13: 584 | I13: =H13+I12 -> 930 | J13: 36 | K13: =J13+K12 -> 46
A14: Q3 | B14: 49.667580000000008 | C14: =B14+C13 -> 462.4051697999999 | D14: 0 | E14: =D14+E13 -> 0 | F14: =J14 -> 3 | G14: =F14+G13 -> 49 | H14: 0 | I14: =H14+I13 -> 930 | J14: 3 | K14: =J14+K13 -> 49
A15: Q4 | B15: 292.04537040000002 | C15: =B15+C14 -> 754.45054019999998 | D15: 0 | E15: =D15+E14 -> 0 | F15: =J15 -> 44 | G15: =F15+G14 -> 93 | H15: 109 | I15: =H15+I14 -> 1039 | J15: 44 | K15: =J15+K14 -> 93
A16: 2001-Q1 | B16: 691.3727136 | C16: =B16+C15 -> 1445.8232538 | D16: 114.00479999999999 | E16: =D16+E15 -> 114.00479999999999 | F16: =J16 -> 56 | G16: =F16+G15 -> 149 | H16: 363 | I16: =H16+I15 -> 1402 | J16: 56 | K16: =J16+K15 -> 149
A17: Q2 | B17: 412.73758979999991 | C17: =B17+C16 -> 1858.5608435999998 | D17: 81.670679999999976 | E17: =D17+E16 -> 195.67547999999996 | F17: =J17 -> 55 | G17: =F17+G16 -> 204 | H17: 406 | I17: =H17+I16 -> 1808 | J17: 55 | K17: =J17+K16 -> 204
A18: Q3 | B18: 49.667580000000008 | C18: =B18+C17 -> 1908.2284235999998 | D18: 9.8279999999999994 | E18: =D18+E17 -> 205.50347999999997 | F18: =J18 -> 2 | G18: =F18+G17 -> 206 | H18: 34 | I18: =H18+I17 -> 1842 | J18: 2 | K18: =J18+K17 -> 206
A19: Q4 | B19: 292.04537040000002 | C19: =B19+C18 -> 2200.2737939999997 | D19: 57.788639999999994 | E19: =D19+E18 -> 263.29211999999995 | F19: =J19 -> 26 | G19: =F19+G18 -> 232 | H19: 277 | I19: =H19+I18 -> 2119 | J19: 26 | K19: =J19+K18 -> 232
A20: 2002-Q1 | B20: 691.3727136 | C20: =B20+C19 -> 2891.6465075999995 | D20: 136.80575999999999 | E20: =D20+E19 -> 400.09787999999992 | F20: =J20 -> 82 | G20: =F20+G19 -> 314 | H20: 497 | I20: =H20+I19 -> 2616 | J20: 82 | K20: =J20+K19 -> 314
A21: Q2 | B21: 412.73758979999991 | C21: =B21+C20 -> 3304.3840973999995 | D21: 81.670679999999976 | E21: =D21+E20 -> 481.76855999999987 | F21: =J21 -> 113 | G21: =F21+G20 -> 427 | H21: 279 | I21: =H21+I20 -> 2895 | J21: 113 | K21: =J21+K20 -> 427
A22: Q3 | B22: 49.667580000000008 | C22: =B22+C21 -> 3354.0516773999993 | D22: 9.8279999999999994 | E22: =D22+E21 -> 491.59655999999984 | F22: =J22 -> 8 | G22: =F22+G21 -> 435 | H22: 0 | I22: =H22+I21 -> 2895 | J22: 8 | K22: =J22+K21 -> 435
A23: Q4 | B23: 292.04537040000002 | C23: =B23+C22 -> 3646.0970477999995 | D23: 66.044160000000005 | E23: =D23+E22 -> 557.64071999999987 | F23: =J23 -> 19 | G23: =F23+G22 -> 454 | H23: 244 | I23: =H23+I22 -> 3139 | J23: 19 | K23: =J23+K22 -> 454
A24: 2003-Q1 | B24: 691.3727136 | C24: =B24+C23 -> 4337.4697613999997 | D24: 156.34944000000004 | E24: =D24+E23 -> 713.99015999999995 | F24: =J24 -> 93 | G24: =F24+G23 -> 547 | H24: 829 | I24: =H24+I23 -> 3968 | J24: 93 | K24: =J24+K23 -> 547
A25: Q2 | B25: 412.73758979999991 | C25: =B25+C24 -> 4750.2073511999997 | D25: 93.337920000000011 | E25: =D25+E24 -> 807.32808 | F25: =J25 -> 125 | G25: =F25+G24 -> 672 | H25: 892 | I25: =H25+I24 -> 4860 | J25: 125 | K25: =J25+K24 -> 672
A26: Q3 | B26: 49.667580000000008 | C26: =B26+C25 -> 4799.8749312 | D26: 11.232000000000001 | E26: =D26+E25 -> 818.56007999999997 | F26: =J26 -> 7 | G26: =F26+G25 -> 679 | H26: 0 | I26: =H26+I25 -> 4860 | J26: 7 | K26: =J26+K25 -> 679
A27: Q4 | B27: 292.04537040000002 | C27: =B27+C26 -> 5091.9203016000001 | D27: 66.044160000000005 | E27: =D27+E26 -> 884.60424 | F27: =J27 -> 48 | G27: =F27+G26 -> 727 | H27: 194 | I27: =H27+I26 -> 5054 | J27: 48 | K27: =J27+K26 -> 727
A28: 2004-Q1 | B28: 691.3727136 | C28: =B28+C27 -> 5783.2930151999999 | D28: 156.34944000000004 | E28: =D28+E27 -> 1040.9536800000001 | F28: =J28 -> 83 | G28: =F28+G27 -> 810 | H28: 348 | I28: =H28+I27 -> 5402 | J28: 83 | K28: =J28+K27 -> 810
A29: Q2 | B29: 412.73758979999991 | C29: =B29+C28 -> 6196.0306049999999 | D29: 93.337920000000011 | E29: =D29+E28 -> 1134.2916 | F29: =J29 -> 86 | G29: =F29+G28 -> 896 | H29: 768 | I29: =H29+I28 -> 6170 | J29: 86 | K29: =J29+K28 -> 896
A30: Q3 | B30: 49.667580000000008 | C30: =B30+C29 -> 6245.6981850000002 | D30: 11.232000000000001 | E30: =D30+E29 -> 1145.5236 | F30: =J30 -> 8 | G30: =F30+G29 -> 904 | H30: 0 | I30: =H30+I29 -> 6170 | J30: 8 | K30: =J30+K29 -> 904
A31: Q4 | B31: 292.04537040000002 | C31: =B31+C30 -> 6537.7435554000003 | D31: 82.555200000000013 | E31: =D31+E30 -> 1228.0788 | F31: =J31 -> 32 | G31: =F31+G30 -> 936 | H31: 279 | I31: =H31+I30 -> 6449 | J31: 32 | K31: =J31+K30 -> 936
A32: 2005-Q1 | B32: 691.3727136 | C32: =B32+C31 -> 7229.1162690000001 | D32: 195.43679999999998 | E32: =D32+E31 -> 1423.5155999999999 | F32: =J32 -> 79 | G32: =F32+G31 -> 1015 | H32: 448 | I32: =H32+I31 -> 6897 | J32: 79 | K32: =J32+K31 -> 1015
A33: Q2 | B33: 412.73758979999991 | C33: =B33+C32 -> 7641.8538588000001 | D33: 116.67239999999998 | E33: =D33+E32 -> 1540.1879999999999 | F33: =J33 -> 118 | G33: =F33+G32 -> 1133 | H33: 537 | I33: =H33+I32 -> 7434 | J33: 118 | K33: =J33+K32 -> 1133
A34: Q3 | B34: 41 | C34: =B34+C33 -> 7682.8538588000001 | F34: 6 | G34: =F34+G33 -> 1139 | H34: 0 | I34: =H34+I33 -> 7434 | J34: 0 | K34: =J34+K33 -> 1133
A35: Q4 | B35: 125 | C35: =B35+C34 -> 7807.8538588000001 | F35: 19 | G35: =F35+G34 -> 1158 | H35: 77 | I35: =H35+I34 -> 7511 | J35: 28 | K35: =J35+K34 -> 1161
A36: 2006-Q1 | B36: 0 | C36: =B36+C35 -> 7807.8538588000001 | F36: 106 | G36: =F36+G35 -> 1264 | H36: 50 | I36: =H36+I35 -> 7561 | J36: 128 | K36: =J36+K35 -> 1289
A37: Q2 | B37: 0 | C37: =B37+C36 -> 7807.8538588000001 | F37: 81 | G37: =F37+G36 -> 1345 | H37: 16 | I37: =H37+I36 -> 7577 | J37: 78 | K37: =J37+K36 -> 1367
A38: Q3 | B38: 0 | C38: =B38+C37 -> 7807.8538588000001 | F38: 6 | G38: =F38+G37 -> 1351
A39: Q4 | B39: 0 | C39: =B39+C38 -> 7807.8538588000001 | F39: 19 | G39: =F39+G38 -> 1370
A40: 2007-Q1 | B40: 0 | C40: =B40+C39 -> 7807.8538588000001 | F40: 86 | G40: =F40+G39 -> 1456
A41: Q2 | B41: 0 | C41: =B41+C40 -> 7807.8538588000001 | F41: 65 | G41: =F41+G40 -> 1521
A42: Q3 | B42: 0 | C42: =B42+C41 -> 7807.8538588000001 | F42: 5 | G42: =F42+G41 -> 1526
A43: Q4 | B43: 0 | C43: =B43+C42 -> 7807.8538588000001 | F43: 15 | G43: =F43+G42 -> 1541
A44: 2008-Q1 | B44: 0 | C44: =B44+C43 -> 7807.8538588000001 | F44: 86 | G44: =F44+G43 -> 1627
A45: Q2 | B45: 0 | C45: =B45+C44 -> 7807.8538588000001 | F45: 65 | G45: =F45+G44 -> 1692
A46: TOTAL | B46: =SUM(B8:B45) -> 7807.8538588000001 | C46: =C45 -> 7807.8538588000001 | E46: =E33 -> 1540.1879999999999 | F46: =SUM(F8:F45) -> 1692 | G46: =G45 -> 1692
A48: 2006-Q2 actual numbers include data collected through 07/06/06.

B1: SDSS Northern Survey Region
B2: Cumulative Data Collected vs. Baseline
B3: Updated 07/10/06
E5: Baseline Plan | I5: Actual Performance
B6: Line | D6: Month | E6: Square Degrees | G6: No. plts | I6: Square Degrees1 | K6: No. plts
B7: No. | C7: Year | E7: by Qtr | F7: Cumulative | G7: by Qtr | H7: Cumulative | I7: by Month | J7: Cumulative | K7: by Month | L7: Cumulative
B8: 1 | C8: 1999 | D8: Jan | I8: 0 | J8: =I8 -> 0 | K8: 0 | L8: =K8 -> 0
B9: 2 | D9: Feb | I9: 0 | J9: =I9+J8 -> 0 | K9: 0 | L9: =K9+L8 -> 0
B10: 3 | C10: Q1 | D10: Mar | E10: 0 | F10: =E10 -> 0 | G10: 0 | H10: 0 | I10: 224 | J10: =I10+J9 -> 224 | K10: 0 | L10: =K10+L9 -> 0
B11: 4 | D11: Apr | I11: 0 | J11: =I11+J10 -> 224 | K11: 0 | L11: =K11+L10 -> 0
B12: 5 | D12: May | I12: 0 | J12: =I12+J11 -> 224 | K12: 0 | L12: =K12+L11 -> 0
B13: 6 | C13: Q2 | D13: Jun | E13: 0 | F13: =E13+F10 -> 0 | G13: 0 | H13: 0 | I13: 0 | J13: =I13+J12 -> 224 | K13: 0 | L13: =K13+L12 -> 0
B14: 7 | D14: Jul | I14: 0 | J14: =I14+J13 -> 224 | K14: 0 | L14: =K14+L13 -> 0
B15: 8 | D15: Aug | I15: 0 | J15: =I15+J14 -> 224 | K15: 0 | L15: =K15+L14 -> 0
B16: 9 | C16: Q3 | D16: Sep | E16: 0 | F16: =E16+F13 -> 0 | G16: 0 | H16: 0 | I16: 0 | J16: =I16+J15 -> 224 | K16: 0 | L16: =K16+L15 -> 0
B17: 10 | D17: Oct | I17: 0 | J17: =I17+J16 -> 224 | K17: 0 | L17: =K17+L16 -> 0
B18: 11 | D18: Nov | I18: 0 | J18: =I18+J17 -> 224 | K18: 0 | L18: =K18+L17 -> 0
B19: 12 | C19: Q4 | D19: Dec | E19: 0 | F19: =E19+F16 -> 0 | G19: 0 | H19: 0 | I19: 0 | J19: =I19+J18 -> 224 | K19: 0 | L19: =K19+L18 -> 0
B20: 13 | C20: 2000 | D20: Jan | I20: 0 | J20: =I20+J19 -> 224 | K20: 0 | L20: =K20+L19 -> 0
B21: 14 | D21: Feb | I21: 63 | J21: =I21+J20 -> 287 | K21: 0 | L21: =K21+L20 -> 0
B22: 15 | C22: Q1 | D22: Mar | E22: 0 | F22: =E22+F19 -> 0 | G22: =K22 -> 10 | H22: =G22 -> 10 | I22: 59 | J22: =I22+J21 -> 346 | K22: 10 | L22: =K22+L21 -> 10
B23: 16 | D23: Apr | G23: =K23 -> 5 | H23: =G23+H22 -> 15 | I23: 261 | J23: =I23+J22 -> 607 | K23: 5 | L23: =K23+L22 -> 15
B24: 17 | D24: May | G24: =K24 -> 14 | H24: =G24+H23 -> 29 | I24: 323 | J24: =I24+J23 -> 930 | K24: 14 | L24: =K24+L23 -> 29
B25: 18 | C25: Q2 | D25: Jun | E25: 412.73758979999991 | F25: =E25+F22 -> 412.73758979999991 | G25: =K25 -> 17 | H25: =G25+H24 -> 46 | I25: 0 | J25: =I25+J24 -> 930 | K25: 17 | L25: =K25+L24 -> 46
B26: 19 | D26: Jul | G26: =K26 -> 0 | H26: =G26+H25 -> 46 | I26: 0 | J26: =I26+J25 -> 930 | K26: 0 | L26: =K26+L25 -> 46
B27: 20 | D27: Aug | G27: =K27 -> 0 | H27: =G27+H26 -> 46 | I27: 0 | J27: =I27+J26 -> 930 | K27: 0 | L27: =K27+L26 -> 46
B28: 21 | C28: Q3 | D28: Sep | E28: 49.667580000000008 | F28: =E28+F25 -> 462.4051697999999 | G28: =K28 -> 3 | H28: =G28+H27 -> 49 | I28: 0 | J28: =I28+J27 -> 930 | K28: 3 | L28: =K28+L27 -> 49
B29: 22 | D29: Oct | G29: =K29 -> 3 | H29: =G29+H28 -> 52 | I29: 0 | J29: =I29+J28 -> 930 | K29: 3 | L29: =K29+L28 -> 52
B30: 23 | D30: Nov | G30: =K30 -> 17 | H30: =G30+H29 -> 69 | I30: 90 | J30: =I30+J29 -> 1020 | K30: 17 | L30: =K30+L29 -> 69
B31: 24 | C31: Q4 | D31: Dec | E31: 292.04537040000002 | F31: =E31+F28 -> 754.45054019999998 | G31: =K31 -> 24 | H31: =G31+H30 -> 93 | I31: 19 | J31: =I31+J30 -> 1039 | K31: 24 | L31: =K31+L30 -> 93
B32: 25 | C32: 2001 | D32: Jan | G32: =K32 -> 9 | H32: =G32+H31 -> 102 | I32: 56 | J32: =I32+J31 -> 1095 | K32: 9 | L32: =K32+L31 -> 102
B33: 26 | D33: Feb | G33: =K33 -> 11 | H33: =G33+H32 -> 113 | I33: 177 | J33: =I33+J32 -> 1272 | K33: 11 | L33: =K33+L32 -> 113
B34: 27 | C34: Q1 | D34: Mar | E34: 691.3727136 | F34: =E34+F31 -> 1445.8232538 | G34: =K34 -> 36 | H34: =G34+H33 -> 149 | I34: 130 | J34: =I34+J33 -> 1402 | K34: 36 | L34: =K34+L33 -> 149
B35: 28 | D35: Apr | G35: =K35 -> 27 | H35: =G35+H34 -> 176 | I35: 138 | J35: =I35+J34 -> 1540 | K35: 27 | L35: =K35+L34 -> 176
B36: 29 | D36: May | G36: =K36 -> 19 | H36: =G36+H35 -> 195 | I36: 208 | J36: =I36+J35 -> 1748 | K36: 19 | L36: =K36+L35 -> 195
B37: 30 | C37: Q2 | D37: Jun | E37: 412.73758979999991 | F37: =E37+F34 -> 1858.5608435999998 | G37: =K37 -> 9 | H37: =G37+H36 -> 204 | I37: 60 | J37: =I37+J36 -> 1808 | K37: 9 | L37: =K37+L36 -> 204
B38: 31 | D38: Jul | G38: =K38 -> 0 | H38: =G38+H37 -> 204 | I38: 0 | J38: =I38+J37 -> 1808 | K38: 0 | L38: =K38+L37 -> 204
B39: 32 | D39: Aug | G39: =K39 -> 2 | H39: =G39+H38 -> 206 | I39: 0 | J39: =I39+J38 -> 1808 | K39: 2 | L39: =K39+L38 -> 206
B40: 33 | C40: Q3 | D40: Sep | E40: 49.667580000000008 | F40: =E40+F37 -> 1908.2284235999998 | G40: =K40 -> 0 | H40: =G40+H39 -> 206 | I40: 34 | J40: =I40+J39 -> 1842 | K40: 0 | L40: =K40+L39 -> 206
B41: 34 | D41: Oct | G41: =K41 -> 3 | H41: =G41+H40 -> 209 | I41: 0 | J41: =I41+J40 -> 1842 | K41: 3 | L41: =K41+L40 -> 209
B42: 35 | D42: Nov | G42: =K42 -> 10 | H42: =G42+H41 -> 219 | I42: 62 | J42: =I42+J41 -> 1904 | K42: 10 | L42: =K42+L41 -> 219
B43: 36 | C43: Q4 | D43: Dec | E43: 292.04537040000002 | F43: =E43+F40 -> 2200.2737939999997 | G43: =K43 -> 13 | H43: =G43+H42 -> 232 | I43: 215 | J43: =I43+J42 -> 2119 | K43: 13 | L43: =K43+L42 -> 232
B44: 37 | C44: 2002 | D44: Jan | G44: =K44 -> 20 | H44: =G44+H43 -> 252 | I44: 132 | J44: =I44+J43 -> 2251 | K44: 20 | L44: =K44+L43 -> 252
B45: 38 | D45: Feb | G45: =K45 -> 37 | H45: =G45+H44 -> 289 | I45: 185 | J45: =I45+J44 -> 2436 | K45: 37 | L45: =K45+L44 -> 289
B46: 39 | C46: Q1 | D46: Mar | E46: 691.3727136 | F46: =E46+F43 -> 2891.6465075999995 | G46: =K46 -> 25 | H46: =G46+H45 -> 314 | I46: 180 | J46: =I46+J45 -> 2616 | K46: 25 | L46: =K46+L45 -> 314
B47: 40 | D47: Apr | G47: =K47 -> 61 | H47: =G47+H46 -> 375 | I47: 46 | J47: =I47+J46 -> 2662 | K47: 61 | L47: =K47+L46 -> 375
B48: 41 | D48: May | G48: =K48 -> 31 | H48: =G48+H47 -> 406 | I48: 151 | J48: =I48+J47 -> 2813 | K48: 31 | L48: =K48+L47 -> 406
B49: 42 | C49: Q2 | D49: Jun | E49: 412.73758979999991 | F49: =E49+F46 -> 3304.3840973999995 | G49: =K49 -> 21 | H49: =G49+H48 -> 427 | I49: 82 | J49: =I49+J48 -> 2895 | K49: 21 | L49: =K49+L48 -> 427
B50: 43 | D50: Jul | G50: =K50 -> 6 | H50: =G50+H49 -> 433 | I50: 0 | J50: =I50+J49 -> 2895 | K50: 6 | L50: =K50+L49 -> 433
B51: 44 | D51: Aug | G51: =K51 -> 0 | H51: =G51+H50 -> 433 | I51: 0 | J51: =I51+J50 -> 2895 | K51: 0 | L51: =K51+L50 -> 433
B52: 45 | C52: Q3 | D52: Sep | E52: 49.667580000000008 | F52: =E52+F49 -> 3354.0516773999993 | G52: =K52 -> 3 | H52: =G52+H51 -> 436 | I52: 0 | J52: =I52+J51 -> 2895 | K52: 3 | L52: =K52+L51 -> 436
B53: 46 | D53: Oct | G53: =K53 -> 0 | H53: =G53+H52 -> 436 | I53: 3 | J53: =I53+J52 -> 2898 | K53: 0 | L53: =K53+L52 -> 436
B54: 47 | D54: Nov | G54: =K54 -> 9 | H54: =G54+H53 -> 445 | I54: 55 | J54: =I54+J53 -> 2953 | K54: 9 | L54: =K54+L53 -> 445
B55: 48 | C55: Q4 | D55: Dec | E55: 292.04537040000002 | F55: =E55+F52 -> 3646.0970477999995 | G55: =K55 -> 10 | H55: =G55+H54 -> 455 | I55: 147 | J55: =I55+J54 -> 3100 | K55: 10 | L55: =K55+L54 -> 455
B56: 49 | C56: 2003 | D56: Jan | G56: =K56 -> 32 | H56: =G56+H55 -> 487 | I56: 39 | J56: =I56+J55 -> 3139 | K56: 32 | L56: =K56+L55 -> 487
B57: 50 | D57: Feb | G57: =K57 -> 32 | H57: =G57+H56 -> 519 | I57: 233 | J57: =I57+J56 -> 3372 | K57: 32 | L57: =K57+L56 -> 519
B58: 51 | C58: Q1 | D58: Mar | E58: 691.3727136 | F58: =E58+F55 -> 4337.4697613999997 | G58: =K58 -> 29 | H58: =G58+H57 -> 548 | I58: 256 | J58: =I58+J57 -> 3628 | K58: 29 | L58: =K58+L57 -> 548
B59: 52 | D59: Apr | G59: =K59 -> 43 | H59: =G59+H58 -> 591 | I59: 450 | J59: =I59+J58 -> 4078 | K59: 43 | L59: =K59+L58 -> 591
B60: 53 | D60: May | G60: =K60 -> 40 | H60: =G60+H59 -> 631 | I60: 479 | J60: =I60+J59 -> 4557 | K60: 40 | L60: =K60+L59 -> 631
B61: 54 | C61: Q2 | D61: Jun | E61: 412.73758979999991 | F61: =E61+F58 -> 4750.2073511999997 | G61: =K61 -> 41 | H61: =G61+H60 -> 672 | I61: 134 | J61: =I61+J60 -> 4691 | K61: 41 | L61: =K61+L60 -> 672
B62: 55 | D62: Jul | G62: =K62 -> 0 | H62: =G62+H61 -> 672 | I62: 169 | J62: =I62+J61 -> 4860 | K62: 0 | L62: =K62+L61 -> 672
B63: 56 | D63: Aug | G63: =K63 -> 5 | H63: =G63+H62 -> 677 | I63: 0 | J63: =I63+J62 -> 4860 | K63: 5 | L63: =K63+L62 -> 677
B64: 57 | C64: Q3 | D64: Sep | E64: 49.667580000000008 | F64: =E64+F61 -> 4799.8749312 | G64: =K64 -> 2 | H64: =G64+H63 -> 679 | I64: 0 | J64: =I64+J63 -> 4860 | K64: 2 | L64: =K64+L63 -> 679
B65: 58 | D65: Oct | G65: =K65 -> 8 | H65: =G65+H64 -> 687 | I65: 89 | J65: =I65+J64 -> 4949 | K65: 8 | L65: =K65+L64 -> 687
B66: 59 | D66: Nov | G66: =K66 -> 14 | H66: =G66+H65 -> 701 | I66: 63 | J66: =I66+J65 -> 5012 | K66: 14 | L66: =K66+L65 -> 701
B67: 60 | C67: Q4 | D67: Dec | E67: 292.04537040000002 | F67: =E67+F64 -> 5091.9203016000001 | G67: =K67 -> 25 | H67: =G67+H66 -> 726 | I67: 42 | J67: =I67+J66 -> 5054 | K67: 25 | L67: =K67+L66 -> 726
B68: 61 | C68: 2004 | D68: Jan | G68: =K68 -> 10 | H68: =G68+H67 -> 736 | I68: 125 | J68: =I68+J67 -> 5179 | K68: 10 | L68: =K68+L67 -> 736
B69: 62 | D69: Feb | G69: =K69 -> 37 | H69: =G69+H68 -> 773 | I69: 74 | J69: =I69+J68 -> 5253 | K69: 37 | L69: =K69+L68 -> 773
B70: 63 | C70: Q1 | D70: Mar | E70: 691.3727136 | F70: =E70+F67 -> 5783.2930151999999 | G70: =K70 -> 37 | H70: =G70+H69 -> 810 | I70: 149 | J70: =I70+J69 -> 5402 | K70: 37 | L70: =K70+L69 -> 810
B71: 64 | D71: Apr | G71: =K71 -> 33 | H71: =G71+H70 -> 843 | I71: 317 | J71: =I71+J70 -> 5719 | K71: 33 | L71: =K71+L70 -> 843
B72: 65 | D72: May | G72: =K72 -> 33 | H72: =G72+H71 -> 876 | I72: 239 | J72: =I72+J71 -> 5958 | K72: 33 | L72: =K72+L71 -> 876
B73: 66 | C73: Q2 | D73: Jun | E73: 412.73758979999991 | F73: =E73+F70 -> 6196.0306049999999 | G73: =K73 -> 20 | H73: =G73+H72 -> 896 | I73: 212 | J73: =I73+J72 -> 6170 | K73: 20 | L73: =K73+L72 -> 896
B74: 67 | D74: Jul | G74: =K74 -> 0 | H74: =G74+H73 -> 896 | I74: 0 | J74: =I74+J73 -> 6170 | K74: 0 | L74: =K74+L73 -> 896
B75: 68 | D75: Aug | G75: =K75 -> 6 | H75: =G75+H74 -> 902 | I75: 0 | J75: =I75+J74 -> 6170 | K75: 6 | L75: =K75+L74 -> 902
B76: 69 | C76: Q3 | D76: Sep | E76: 49.667580000000008 | F76: =E76+F73 -> 6245.6981850000002 | G76: =K76 -> 2 | H76: =G76+H75 -> 904 | I76: 0 | J76: =I76+J75 -> 6170 | K76: 2 | L76: =K76+L75 -> 904
B77: 70 | D77: Oct | G77: =K77 -> 1 | H77: =G77+H76 -> 905 | I77: 0 | J77: =I77+J76 -> 6170 | K77: 1 | L77: =K77+L76 -> 905
B78: 71 | D78: Nov | G78: =K78 -> 16 | H78: =G78+H77 -> 921 | I78: 0 | J78: =I78+J77 -> 6170 | K78: 16 | L78: =K78+L77 -> 921
B79: 72 | C79: Q4 | D79: Dec | E79: 292.04537040000002 | F79: =E79+F76 -> 6537.7435554000003 | G79: =K79 -> 14 | H79: =G79+H78 -> 935 | I79: 279 | J79: =I79+J78 -> 6449 | K79: 14 | L79: =K79+L78 -> 935
B80: 73 | C80: 2005 | D80: Jan | G80: =K80 -> 31 | H80: =G80+H79 -> 966 | I80: 152 | J80: =I80+J79 -> 6601 | K80: 31 | L80: =K80+L79 -> 966
B81: 74 | D81: Feb | G81: =K81 -> 7 | H81: =G81+H80 -> 973 | I81: 54 | J81: =I81+J80 -> 6655 | K81: 7 | L81: =K81+L80 -> 973
B82: 75 | C82: Q1 | D82: Mar | E82: 691.3727136 | F82: =E82+F79 -> 7229.1162690000001 | G82: =K82 -> 42 | H82: =G82+H81 -> 1015 | I82: 242 | J82: =I82+J81 -> 6897 | K82: 42 | L82: =K82+L81 -> 1015
B83: 76 | D83: Apr | G83: =K83 -> 55 | H83: =G83+H82 -> 1070 | I83: 113 | J83: =I83+J82 -> 7010 | K83: 55 | L83: =K83+L82 -> 1070
B84: 77 | D84: May | G84: =K84 -> 35 | H84: =G84+H83 -> 1105 | I84: 280 | J84: =I84+J83 -> 7290 | K84: 35 | L84: =K84+L83 -> 1105
B85: 78 | C85: Q2 | D85: Jun | E85: 412.73758979999991 | F85: =E85+F82 -> 7641.8538588000001 | G85: =K85 -> 28 | H85: =G85+H84 -> 1133 | I85: 144 | J85: =I85+J84 -> 7434 | K85: 28 | L85: =K85+L84 -> 1133
B86: 79 | D86: Jul | I86: 0 | J86: =I86+J85 -> 7434 | K86: 0 | L86: =K86+L85 -> 1133
B87: 80 | D87: Aug | I87: 0 | J87: =I87+J86 -> 7434 | K87: 0 | L87: =K87+L86 -> 1133
B88: 81 | C88: Q3 | D88: Sep | E88: 41 | F88: =E88+F85 -> 7682.8538588000001 | G88: 6 | H88: =G88+H85 -> 1139 | I88: 0 | J88: =I88+J87 -> 7434 | K88: 0 | L88: =K88+L87 -> 1133
B89: 82 | D89: Oct | I89: 0 | J89: =I89+J88 -> 7434 | K89: 0 | L89: =K89+L88 -> 1133
B90: 83 | D90: Nov | I90: 0 | J90: =I90+J89 -> 7434 | K90: 6 | L90: =K90+L89 -> 1139
B91: 84 | C91: Q4 | D91: Dec | E91: 125 | F91: =E91+F88 -> 7807.8538588000001 | G91: 19 | H91: =G91+H88 -> 1158 | I91: 40 | J91: =I91+J90 -> 7474 | K91: 22 | L91: =K91+L90 -> 1161
B92: 85 | C92: 2006 | D92: Jan | I92: 37 | J92: =I92+J91 -> 7511 | K92: 26 | L92: =K92+L91 -> 1187
B93: 86 | D93: Feb | I93: 50 | J93: =I93+J92 -> 7561 | K93: 26 | L93: =K93+L92 -> 1213
B94: 87 | C94: Q1 | D94: Mar | E94: 0 | F94: =E94+F91 -> 7807.8538588000001 | G94: 106 | H94: =G94+H91 -> 1264 | I94: 0 | J94: =I94+J93 -> 7561 | K94: 41 | L94: =K94+L93 -> 1254
B95: 88 | D95: Apr | I95: 0 | J95: =I95+J94 -> 7561 | K95: 35 | L95: =K95+L94 -> 1289
B96: 89 | D96: May | I96: 4 | J96: =I96+J95 -> 7565 | K96: 34 | L96: =K96+L95 -> 1323
B97: 90 | C97: Q2 | D97: Jun | E97: 0 | F97: =E97+F94 -> 7807.8538588000001 | G97: 81 | H97: =G97+H94 -> 1345 | I97: 12 | J97: =I97+J96 -> 7577 | K97: 44 | L97: =K97+L96 -> 1367
B98: 91 | D98: Jul
B99: 92 | D99: Aug
B100: 93 | C100: Q3 | D100: Sep | E100: 0 | F100: =E100+F97 -> 7807.8538588000001 | G100: 6 | H100: =G100+H97 -> 1351
B101: 94 | D101: Oct
B102: 95 | D102: Nov
B103: 96 | C103: Q4 | D103: Dec | E103: 0 | F103: =E103+F100 -> 7807.8538588000001 | G103: 19 | H103: =G103+H100 -> 1370
B104: 97 | C104: 2007 | D104: Jan
B105: 98 | D105: Feb
B106: 99 | C106: Q1 | D106: Mar | E106: 0 | F106: =E106+F103 -> 7807.8538588000001 | G106: 86 | H106: =G106+H103 -> 1456
B107: 100 | D107: Apr
B108: 101 | D108: May
B109: 102 | C109: Q2 | D109: Jun | E109: 0 | F109: =E109+F106 -> 7807.8538588000001 | G109: 65 | H109: =G109+H106 -> 1521
B110: 103 | D110: Jul
B111: 104 | D111: Aug
B112: 105 | C112: Q3 | D112: Sep | E112: 0 | F112: =E112+F109 -> 7807.8538588000001 | G112: 5 | H112: =G112+H109 -> 1526
B113: 106 | D113: Oct
B114: 107 | D114: Nov
B115: 108 | C115: Q4 | D115: Dec | E115: 0 | F115: =E115+F112 -> 7807.8538588000001 | G115: 15 | H115: =G115+H112 -> 1541
B116: 109 | C116: 2007 | D116: Jan
B117: 110 | D117: Feb
B118: 111 | C118: Q1 | D118: Mar | E118: 0 | F118: =E118+F115 -> 7807.8538588000001 | G118: 86 | H118: =G118+H115 -> 1627
B119: 112 | D119: Apr
B120: 113 | D120: May
B121: 114 | C121: Q2 | D121: Jun | E121: 0 | F121: =E121+F118 -> 7807.8538588000001 | G121: 65 | H121: =G121+H118 -> 1692
B122: TOTAL | F122: =F121 -> 7807.8538588000001 | H122: =H121 -> 1692
B125: Notes:
B126: 1) Imaging progress reported in terms of "footprint" square degrees.