A1: SDSS 5-Year Baseline Survey
A2: Revised Baseline Performance Metrics for the Northern Survey Region
A3: Revised 20-Jan-2005
A5: Period | C5: Available dark hrs. | D5: Imaging fraction | E5: Spectro fraction | F5: Weather | G5: System uptime | H5: Imaging efficiency | I5: Spectro efficiency | J5: Imaging ops. | K5: Spectro ops. | L5: End game | M5: Available imaging hours | N5: Available spectro hours | O5: Imaging (sq. deg.) | P5: Num of spectro plates
A6: 2000 | B6: Q1 | C6: - | D6: - | E6: - | F6: - | G6: - | H6: - | I6: - | J6: - | K6: - | L6: - | M6: 0 | N6: 0 | O6: 0 | P6: 0
B7: Q2 | C7: 277 | D7: 0.23 | E7: 0.77 | F7: 0.6 | G7: 0.9 | H7: 0.86 | I7: 0.65 | J7: 0.9 | K7: 0.9 | L7: 1 | M7: = C7*D7*F7*G7*H7*J7 -> 26.628231599999996 | N7: = C7*E7*F7*G7*I7*K7 -> 67.378310999999997 | O7: = M7 * 15.5 -> 412.73758979999991 | P7: = N7 / 0.75 -> 89.837747999999991
B8: Q3 | C8: 40 | D8: 0.23 | E8: 0.77 | F8: 0.5 | G8: 0.9 | H8: 0.86 | I8: 0.65 | J8: 0.9 | K8: 0.9 | L8: 1 | M8: = C8*D8*F8*G8*H8*J8 -> 3.2043600000000003 | N8: = C8*E8*F8*G8*I8*K8 -> 8.1081000000000003 | O8: = M8 * 15.5 -> 49.667580000000008 | P8: = N8 / 0.75 -> 10.8108
B9: Q4 | C9: 196 | D9: 0.23 | E9: 0.77 | F9: 0.6 | G9: 0.9 | H9: 0.86 | I9: 0.65 | J9: 0.9 | K9: 0.9 | L9: 1 | M9: = C9*D9*F9*G9*H9*J9 -> 18.841636800000003 | N9: = C9*E9*F9*G9*I9*K9 -> 47.67562800000001 | O9: = M9 * 15.5 -> 292.04537040000002 | P9: = N9 / 0.75 -> 63.567504000000014
A10: 2001 | B10: Q1 | C10: 464 | D10: 0.23 | E10: 0.77 | F10: 0.6 | G10: 0.9 | H10: 0.86 | I10: 0.65 | J10: 0.9 | K10: 0.9 | L10: 1 | M10: = C10*D10*F10*G10*H10*J10 -> 44.604691199999998 | N10: = C10*E10*F10*G10*I10*K10 -> 112.86475200000002 | O10: = M10 * 15.5 -> 691.3727136 | P10: = N10 / 0.75 -> 150.48633600000002
B11: Q2 | C11: 277 | D11: 0.23 | E11: 0.77 | F11: 0.6 | G11: 0.9 | H11: 0.86 | I11: 0.65 | J11: 0.9 | K11: 0.9 | L11: 1 | M11: = C11*D11*F11*G11*H11*J11 -> 26.628231599999996 | N11: = C11*E11*F11*G11*I11*K11 -> 67.378310999999997 | O11: = M11 * 15.5 -> 412.73758979999991 | P11: = N11 / 0.75 -> 89.837747999999991
B12: Q3 | C12: 40 | D12: 0.23 | E12: 0.77 | F12: 0.5 | G12: 0.9 | H12: 0.86 | I12: 0.65 | J12: 0.9 | K12: 0.9 | L12: 1 | M12: = C12*D12*F12*G12*H12*J12 -> 3.2043600000000003 | N12: = C12*E12*F12*G12*I12*K12 -> 8.1081000000000003 | O12: = M12 * 15.5 -> 49.667580000000008 | P12: = N12 / 0.75 -> 10.8108
B13: Q4 | C13: 196 | D13: 0.23 | E13: 0.77 | F13: 0.6 | G13: 0.9 | H13: 0.86 | I13: 0.65 | J13: 0.9 | K13: 0.9 | L13: 1 | M13: = C13*D13*F13*G13*H13*J13 -> 18.841636800000003 | N13: = C13*E13*F13*G13*I13*K13 -> 47.67562800000001 | O13: = M13 * 15.5 -> 292.04537040000002 | P13: = N13 / 0.75 -> 63.567504000000014
A14: 2002 | B14: Q1 | C14: 464 | D14: 0.23 | E14: 0.77 | F14: 0.6 | G14: 0.9 | H14: 0.86 | I14: 0.65 | J14: 0.9 | K14: 0.9 | L14: 1 | M14: = C14*D14*F14*G14*H14*J14 -> 44.604691199999998 | N14: = C14*E14*F14*G14*I14*K14 -> 112.86475200000002 | O14: = M14 * 15.5 -> 691.3727136 | P14: = N14 / 0.75 -> 150.48633600000002
B15: Q2 | C15: 277 | D15: 0.23 | E15: 0.77 | F15: 0.6 | G15: 0.9 | H15: 0.86 | I15: 0.65 | J15: 0.9 | K15: 0.9 | L15: 1 | M15: = C15*D15*F15*G15*H15*J15 -> 26.628231599999996 | N15: = C15*E15*F15*G15*I15*K15 -> 67.378310999999997 | O15: = M15 * 15.5 -> 412.73758979999991 | P15: = N15 / 0.75 -> 89.837747999999991
B16: Q3 | C16: 40 | D16: 0.23 | E16: 0.77 | F16: 0.5 | G16: 0.9 | H16: 0.86 | I16: 0.65 | J16: 0.9 | K16: 0.9 | L16: 1 | M16: = C16*D16*F16*G16*H16*J16 -> 3.2043600000000003 | N16: = C16*E16*F16*G16*I16*K16 -> 8.1081000000000003 | O16: = M16 * 15.5 -> 49.667580000000008 | P16: = N16 / 0.75 -> 10.8108
B17: Q4 | C17: 196 | D17: 0.23 | E17: 0.77 | F17: 0.6 | G17: 0.9 | H17: 0.86 | I17: 0.65 | J17: 0.9 | K17: 0.9 | L17: 1 | M17: = C17*D17*F17*G17*H17*J17 -> 18.841636800000003 | N17: = C17*E17*F17*G17*I17*K17 -> 47.67562800000001 | O17: = M17 * 15.5 -> 292.04537040000002 | P17: = N17 / 0.75 -> 63.567504000000014
A18: 2003 | B18: Q1 | C18: 464 | D18: 0.23 | E18: 0.77 | F18: 0.6 | G18: 0.9 | H18: 0.86 | I18: 0.65 | J18: 0.9 | K18: 0.9 | L18: 1 | M18: = C18*D18*F18*G18*H18*J18 -> 44.604691199999998 | N18: = C18*E18*F18*G18*I18*K18 -> 112.86475200000002 | O18: = M18 * 15.5 -> 691.3727136 | P18: = N18 / 0.75 -> 150.48633600000002
B19: Q2 | C19: 277 | D19: 0.23 | E19: 0.77 | F19: 0.6 | G19: 0.9 | H19: 0.86 | I19: 0.65 | J19: 0.9 | K19: 0.9 | L19: 1 | M19: = C19*D19*F19*G19*H19*J19 -> 26.628231599999996 | N19: = C19*E19*F19*G19*I19*K19 -> 67.378310999999997 | O19: = M19 * 15.5 -> 412.73758979999991 | P19: = N19 / 0.75 -> 89.837747999999991
B20: Q3 | C20: 40 | D20: 0.23 | E20: 0.77 | F20: 0.5 | G20: 0.9 | H20: 0.86 | I20: 0.65 | J20: 0.9 | K20: 0.9 | L20: 1 | M20: = C20*D20*F20*G20*H20*J20 -> 3.2043600000000003 | N20: = C20*E20*F20*G20*I20*K20 -> 8.1081000000000003 | O20: = M20 * 15.5 -> 49.667580000000008 | P20: = N20 / 0.75 -> 10.8108
B21: Q4 | C21: 196 | D21: 0.23 | E21: 0.77 | F21: 0.6 | G21: 0.9 | H21: 0.86 | I21: 0.65 | J21: 0.9 | K21: 0.9 | L21: 1 | M21: = C21*D21*F21*G21*H21*J21 -> 18.841636800000003 | N21: = C21*E21*F21*G21*I21*K21 -> 47.67562800000001 | O21: = M21 * 15.5 -> 292.04537040000002 | P21: = N21 / 0.75 -> 63.567504000000014
A22: 2004 | B22: Q1 | C22: 464 | D22: 0.23 | E22: 0.77 | F22: 0.6 | G22: 0.9 | H22: 0.86 | I22: 0.65 | J22: 0.9 | K22: 0.9 | L22: 1 | M22: = C22*D22*F22*G22*H22*J22 -> 44.604691199999998 | N22: = C22*E22*F22*G22*I22*K22 -> 112.86475200000002 | O22: = M22 * 15.5 -> 691.3727136 | P22: = N22 / 0.75 -> 150.48633600000002
B23: Q2 | C23: 277 | D23: 0.23 | E23: 0.77 | F23: 0.6 | G23: 0.9 | H23: 0.86 | I23: 0.65 | J23: 0.9 | K23: 0.9 | L23: 1 | M23: = C23*D23*F23*G23*H23*J23 -> 26.628231599999996 | N23: = C23*E23*F23*G23*I23*K23 -> 67.378310999999997 | O23: = M23 * 15.5 -> 412.73758979999991 | P23: = N23 / 0.75 -> 89.837747999999991
B24: Q3 | C24: 40 | D24: 0.23 | E24: 0.77 | F24: 0.5 | G24: 0.9 | H24: 0.86 | I24: 0.65 | J24: 0.9 | K24: 0.9 | L24: 1 | M24: = C24*D24*F24*G24*H24*J24 -> 3.2043600000000003 | N24: = C24*E24*F24*G24*I24*K24 -> 8.1081000000000003 | O24: = M24 * 15.5 -> 49.667580000000008 | P24: = N24 / 0.75 -> 10.8108
B25: Q4 | C25: 196 | D25: 0.23 | E25: 0.77 | F25: 0.6 | G25: 0.9 | H25: 0.86 | I25: 0.65 | J25: 0.9 | K25: 0.9 | L25: 1 | M25: = C25*D25*F25*G25*H25*J25 -> 18.841636800000003 | N25: = C25*E25*F25*G25*I25*K25 -> 47.67562800000001 | O25: = M25 * 15.5 -> 292.04537040000002 | P25: = N25 / 0.75 -> 63.567504000000014
A26: 2005 | B26: Q1 | C26: 464 | D26: 0.23 | E26: 0.77 | F26: 0.6 | G26: 0.9 | H26: 0.86 | I26: 0.65 | J26: 0.9 | K26: 0.9 | L26: 1 | M26: = C26*D26*F26*G26*H26*J26 -> 44.604691199999998 | N26: = C26*E26*F26*G26*I26*K26 -> 112.86475200000002 | O26: = M26 * 15.5 -> 691.3727136 | P26: = N26 / 0.75 -> 150.48633600000002
B27: Q2 | C27: 277 | D27: 0.23 | E27: 0.77 | F27: 0.6 | G27: 0.9 | H27: 0.86 | I27: 0.65 | J27: 0.9 | K27: 0.9 | L27: 1 | M27: = C27*D27*F27*G27*H27*J27 -> 26.628231599999996 | N27: = C27*E27*F27*G27*I27*K27 -> 67.378310999999997 | O27: = M27 * 15.5 -> 412.73758979999991 | P27: = N27 / 0.75 -> 89.837747999999991
A28: TOTAL | C28: =SUM(C7:C27) -> 5162 | M28: =SUM(M7:M27) -> 493.02282959999997 | N28: =SUM(N7:N27) -> 1247.5122660000002 | O28: =SUM(O7:O27) -> 7641.8538588000001 | P28: =SUM(P7:P27) -> 1663.349688
A30: Notes
A31: 1) The 20-Jan-05 revision casts imaging progress in terms of "footprint" square degrees. The original baseline was cast in terms of "unique" square degrees.