A1: SDSS-II SEGUE Survey
A2: Cumulative Data Collected vs. Baseline
A3: Updated 06/08/06
B5: Baseline Plan | F5: Actual Performance
B6: Square Degrees | D6: # of Tiles | F6: Square Degrees | H6: # of actual plates observed | L6: Est. # of corresponding tiles | N6: Est. # of plate equivalents
A7: Period | B7: by Qtr | C7: Cumulative | D7: by Qtr | E7: Cumulative | F7: by Qtr | G7: Cumulative | H7: Bright | I7: Faint | J7: Total | K7: Cumulative | L7: # of tiles | M7: Cumulative | N7: # of plate-equiv | O7: Cumulative
B8: 0 | C8: 0 | D8: 0 | E8: 0
A9: 2005-Q3 | B9: 201 | C9: =B9 -> 201 | D9: 11.2 | E9: =D9 -> 11.2 | F9: 1336 | G9: =F9 -> 1336 | H9: 47 | I9: 32 | J9: =H9+I9 -> 79 | K9: =J9 -> 79 | L9: =J9/2 -> 39.5 | M9: =L9 -> 39.5 | N9: =H9+2*I9 -> 111 | O9: =N9 -> 111
A10: Q4 | B10: 306 | C10: =B10+C9 -> 507 | D10: 17.1 | E10: =D10+E9 -> 28.3 | F10: 313 | G10: =F10+G9 -> 1649 | H10: 8 | I10: 12 | J10: =H10+I10 -> 20 | K10: =J10+K9 -> 99 | L10: =J10/2 -> 10 | M10: =L10+M9 -> 49.5 | N10: =H10+2*I10 -> 32 | O10: =N10+O9 -> 143
A11: 2006-Q1 | B11: 460 | C11: =B11+C10 -> 967 | D11: 15.2 | E11: =D11+E10 -> 43.5 | F11: 191 | G11: =F11+G10 -> 1840 | H11: 21 | I11: 21 | J11: =H11+I11 -> 42 | K11: =J11+K10 -> 141 | L11: =J11/2 -> 21 | M11: =L11+M10 -> 70.5 | N11: =H11+2*I11 -> 63 | O11: =N11+O10 -> 206
A12: Q2 | B12: 225 | C12: =B12+C11 -> 1192 | D12: 12.5 | E12: =D12+E11 -> 56 | F12: 431 | G12: =F12+G11 -> 2271 | H12: 5 | I12: 8 | J12: =H12+I12 -> 13 | K12: =J12+K11 -> 154 | L12: =J12/2 -> 6.5 | M12: =L12+M11 -> 77 | N12: =H12+2*I12 -> 21 | O12: =N12+O11 -> 227
A13: Q3 | B13: 210 | C13: =B13+C12 -> 1402 | D13: 11.8 | E13: =D13+E12 -> 67.8
A14: Q4 | B14: 430 | C14: =B14+C13 -> 1832 | D14: 17.1 | E14: =D14+E13 -> 84.9
A15: 2007-Q1 | B15: 535 | C15: =B15+C14 -> 2367 | D15: 21.4 | E15: =D15+E14 -> 106.3
A16: Q2 | B16: 303 | C16: =B16+C15 -> 2670 | D16: 16.9 | E16: =D16+E15 -> 123.2
A17: Q3 | B17: 215 | C17: =B17+C16 -> 2885 | D17: 12.1 | E17: =D17+E16 -> 135.3
A18: Q4 | B18: 435 | C18: =B18+C17 -> 3320 | D18: 18.3 | E18: =D18+E17 -> 153.6
A19: 2008-Q1 | B19: 0 | C19: =B19+C18 -> 3320 | D19: 30.3 | E19: =D19+E18 -> 183.9
A20: Q2 | B20: 0 | C20: =B20+C19 -> 3320 | D20: 21.9 | E20: =D20+E19 -> 205.8
A21: TOTAL | B21: =SUM(B9:B20) -> 3320 | D21: =SUM(D9:D20) -> 205.8 | F21: =SUM(F9:F20) -> 2271 | H21: =SUM(H9:H20) -> 81 | I21: =SUM(I9:I20) -> 73 | L21: =SUM(L9:L20) -> 77 | N21: =SUM(N9:N20) -> 227
A24: Notes
A25: 1) | B25: One SEGUE-faint plate equals two plate-equivalents
A26: 2) | B26: For this accounting, # of tiles is computed by dividing the total number of actual plates observed by two.
B27: A SEGUE tile is considered complete when both the bright and faint combination for a field are complete.
A28: 3) | B28: 2006-Q2 progress includes data collected through 07/06/06