B1: SDSS-II SEGUE Survey
B2: Cumulative Data Collected vs. Baseline
B3: Updated 07/10/06
E5: Baseline Plan | I5: Actual Performance
B6: Line | D6: Month | E6: Square Degrees | G6: # of tiles | I6: Square Degrees1 | K6: # of plates observed | Q6: Est. # of corresponding tiles | S6: Est. # of plate-equivalents
B7: No. | C7: Year | E7: by Qtr | F7: Cumulative | G7: by Qtr | H7: Cumulative | I7: by Month | J7: Cumulative | K7: Bright | L7: Faint | M7: Total | N7: Bright Cumulative | O7: Faint Cumulative | P7: Total Cumulative | Q7: Total | R7: Cumulative | S7: Total | T7: Cumulative
C8: 2005
B9: 1 | D9: Jun | E9: 0 | F9: =E9 -> 0 | G9: 0 | H9: =G9 -> 0 | I9: 1304 | J9: =I9 -> 1304 | K9: 47 | L9: 32 | M9: =K9+L9 -> 79 | N9: =K9 -> 47 | O9: =L9 -> 32 | P9: =M9 -> 79 | Q9: =M9/2 -> 39.5 | R9: =Q9 -> 39.5 | S9: =K9+2*L9 -> 111 | T9: =S9 -> 111
B10: 2 | D10: Jul | I10: 0 | J10: =I10+J9 -> 1304 | K10: 0 | L10: 0 | M10: =K10+L10 -> 0 | N10: =K10+N9 -> 47 | O10: =L10+O9 -> 32 | P10: =M10+P9 -> 79 | Q10: =M10/2 -> 0 | R10: =Q10+R9 -> 39.5 | S10: =K10+2*L10 -> 0 | T10: =S10+T9 -> 111
B11: 3 | D11: Aug | I11: 0 | J11: =I11+J10 -> 1304 | K11: 0 | L11: 0 | M11: =K11+L11 -> 0 | N11: =K11+N10 -> 47 | O11: =L11+O10 -> 32 | P11: =M11+P10 -> 79 | Q11: =M11/2 -> 0 | R11: =Q11+R10 -> 39.5 | S11: =K11+2*L11 -> 0 | T11: =S11+T10 -> 111
B12: 4 | C12: Q3 | D12: Sep | E12: 201 | F12: =E12+F9 -> 201 | G12: 11.2 | H12: =G12+H9 -> 11.2 | I12: 32 | J12: =I12+J11 -> 1336 | K12: 0 | L12: 3 | M12: =K12+L12 -> 3 | N12: =K12+N11 -> 47 | O12: =L12+O11 -> 35 | P12: =M12+P11 -> 82 | Q12: =M12/2 -> 1.5 | R12: =Q12+R11 -> 41 | S12: =K12+2*L12 -> 6 | T12: =S12+T11 -> 117
B13: 5 | D13: Oct | I13: 190 | J13: =I13+J12 -> 1526 | K13: 0 | L13: 1 | M13: =K13+L13 -> 1 | N13: =K13+N12 -> 47 | O13: =L13+O12 -> 36 | P13: =M13+P12 -> 83 | Q13: =M13/2 -> 0.5 | R13: =Q13+R12 -> 41.5 | S13: =K13+2*L13 -> 2 | T13: =S13+T12 -> 119
B14: 6 | D14: Nov | I14: 75 | J14: =I14+J13 -> 1601 | K14: 2 | L14: 1 | M14: =K14+L14 -> 3 | N14: =K14+N13 -> 49 | O14: =L14+O13 -> 37 | P14: =M14+P13 -> 86 | Q14: =M14/2 -> 1.5 | R14: =Q14+R13 -> 43 | S14: =K14+2*L14 -> 4 | T14: =S14+T13 -> 123
B15: 7 | C15: Q4 | D15: Dec | E15: 306 | F15: =E15+F12 -> 507 | G15: 17.1 | H15: =G15+H12 -> 28.3 | I15: 48 | J15: =I15+J14 -> 1649 | K15: 6 | L15: 7 | M15: =K15+L15 -> 13 | N15: =K15+N14 -> 55 | O15: =L15+O14 -> 44 | P15: =M15+P14 -> 99 | Q15: =M15/2 -> 6.5 | R15: =Q15+R14 -> 49.5 | S15: =K15+2*L15 -> 20 | T15: =S15+T14 -> 143
B16: 8 | C16: 2006 | D16: Dec/Jan | I16: 90 | J16: =I16+J15 -> 1739 | K16: 10 | L16: 12 | M16: =K16+L16 -> 22 | N16: =K16+N15 -> 65 | O16: =L16+O15 -> 56 | P16: =M16+P15 -> 121 | Q16: =M16/2 -> 11 | R16: =Q16+R15 -> 60.5 | S16: =K16+2*L16 -> 34 | T16: =S16+T15 -> 177
B17: 9 | D17: Jan | I17: 82 | J17: =I17+J16 -> 1821 | K17: 9 | L17: 8 | M17: =K17+L17 -> 17 | N17: =K17+N16 -> 74 | O17: =L17+O16 -> 64 | P17: =M17+P16 -> 138 | Q17: =M17/2 -> 8.5 | R17: =Q17+R16 -> 69 | S17: =K17+2*L17 -> 25 | T17: =S17+T16 -> 202
B18: 10 | C18: Q1 | D18: Feb+Mar | E18: 460 | F18: =E18+F15 -> 967 | G18: 15.2 | H18: =G18+H15 -> 43.5 | I18: 19 | J18: =I18+J17 -> 1840 | K18: 2 | L18: 1 | M18: =K18+L18 -> 3 | N18: =K18+N17 -> 76 | O18: =L18+O17 -> 65 | P18: =M18+P17 -> 141 | Q18: =M18/2 -> 1.5 | R18: =Q18+R17 -> 70.5 | S18: =K18+2*L18 -> 4 | T18: =S18+T17 -> 206
B19: 11 | D19: Apr | I19: 119 | J19: =I19+J18 -> 1959 | K19: 1 | L19: 2 | M19: =K19+L19 -> 3 | N19: =K19+N18 -> 77 | O19: =L19+O18 -> 67 | P19: =M19+P18 -> 144 | Q19: =M19/2 -> 1.5 | R19: =Q19+R18 -> 72 | S19: =K19+2*L19 -> 5 | T19: =S19+T18 -> 211
B20: 12 | D20: May | I20: 271 | J20: =I20+J19 -> 2230 | K20: 1 | L20: 1 | M20: =K20+L20 -> 2 | N20: =K20+N19 -> 78 | O20: =L20+O19 -> 68 | P20: =M20+P19 -> 146 | Q20: =M20/2 -> 1 | R20: =Q20+R19 -> 73 | S20: =K20+2*L20 -> 3 | T20: =S20+T19 -> 214
B21: 13 | C21: Q2 | D21: Jun | E21: 225 | F21: =E21+F18 -> 1192 | G21: 12.5 | H21: =G21+H18 -> 56 | I21: 41 | J21: =I21+J20 -> 2271 | K21: 3 | L21: 5 | M21: =K21+L21 -> 8 | N21: =K21+N20 -> 81 | O21: =L21+O20 -> 73 | P21: =M21+P20 -> 154 | Q21: =M21/2 -> 4 | R21: =Q21+R20 -> 77 | S21: =K21+2*L21 -> 13 | T21: =S21+T20 -> 227
B22: 14 | D22: Jul | I22: 0
B23: 15 | D23: Aug | I23: 0
B24: 16 | C24: Q3 | D24: Sep | E24: 210 | F24: =E24+F21 -> 1402 | G24: 11.8 | H24: =G24+H21 -> 67.8 | I24: 0
B25: 17 | D25: Oct | I25: 0
B26: 18 | D26: Nov | I26: 0
B27: 19 | C27: Q4 | D27: Dec | E27: 430 | F27: =E27+F24 -> 1832 | G27: 17.1 | H27: =G27+H24 -> 84.9 | I27: 0
B28: 20 | C28: 2007 | D28: Jan | I28: 0
B29: 21 | D29: Feb | I29: 0
B30: 22 | C30: Q1 | D30: Mar | E30: 535 | F30: =E30+F27 -> 2367 | G30: 21.4 | H30: =G30+H27 -> 106.3 | I30: 0
B31: 23 | D31: Apr | I31: 0
B32: 24 | D32: May | I32: 0
B33: 25 | C33: Q2 | D33: Jun | E33: 303 | F33: =E33+F30 -> 2670 | G33: 16.9 | H33: =G33+H30 -> 123.2 | I33: 0
B34: 26 | D34: Jul | I34: 0
B35: 27 | D35: Aug | I35: 0
B36: 28 | C36: Q3 | D36: Sep | E36: 215 | F36: =E36+F33 -> 2885 | G36: 12.1 | H36: =G36+H33 -> 135.3 | I36: 0
B37: 29 | D37: Oct | I37: 0
B38: 30 | D38: Nov | I38: 0
B39: 31 | C39: Q4 | D39: Dec | E39: 435 | F39: =E39+F36 -> 3320 | G39: 18.3 | H39: =G39+H36 -> 153.6 | I39: 0
B40: 32 | C40: 2008 | D40: Jan | I40: 0
B41: 33 | D41: Feb | I41: 0
B42: 34 | C42: Q1 | D42: Mar | E42: 0 | F42: =E42+F39 -> 3320 | G42: 30.3 | H42: =G42+H39 -> 183.9 | I42: 0
B43: 35 | D43: Apr | I43: 0
B44: 36 | D44: May | I44: 0
B45: 37 | C45: Q2 | D45: Jun | E45: 0 | F45: =E45+F42 -> 3320 | G45: 21.9 | H45: =G45+H42 -> 205.8 | I45: 0
B46: TOTAL | F46: =F45 -> 3320 | H46: =H45 -> 205.8 | K46: =SUM(K9:K45) -> 81 | L46: =SUM(L9:L45) -> 73 | Q46: =SUM(Q9:Q45) -> 77 | S46: =SUM(S9:S45) -> 227
B49: Notes:
B50: 1) Imaging progress reported in terms of "footprint" square degrees.