A2: SDSS-II Baseline Projection - SEGUE Survey
B5: Imaging | D5: Spectroscopy
B6: Square Degrees | D6: # of Tiles
A7: Period | B7: by Qtr | C7: Cumulative | D7: by Qtr | E7: Cumulative
B8: 0 | C8: 0 | D8: 0 | E8: 0
A9: 2005-Q3 | B9: 201 | C9: =B9 -> 201 | D9: 11.2 | E9: =D9 -> 11.2
A10: Q4 | B10: 306 | C10: =B10+C9 -> 507 | D10: 17.1 | E10: =D10+E9 -> 28.3
A11: 2006-Q1 | B11: 460 | C11: =B11+C10 -> 967 | D11: 15.2 | E11: =D11+E10 -> 43.5
A12: Q2 | B12: 225 | C12: =B12+C11 -> 1192 | D12: 12.5 | E12: =D12+E11 -> 56
A13: Q3 | B13: 210 | C13: =B13+C12 -> 1402 | D13: 11.8 | E13: =D13+E12 -> 67.8
A14: Q4 | B14: 430 | C14: =B14+C13 -> 1832 | D14: 17.1 | E14: =D14+E13 -> 84.9
A15: 2007-Q1 | B15: 535 | C15: =B15+C14 -> 2367 | D15: 21.4 | E15: =D15+E14 -> 106.3
A16: Q2 | B16: 303 | C16: =B16+C15 -> 2670 | D16: 16.9 | E16: =D16+E15 -> 123.2
A17: Q3 | B17: 215 | C17: =B17+C16 -> 2885 | D17: 12.1 | E17: =D17+E16 -> 135.3
A18: Q4 | B18: 435 | C18: =B18+C17 -> 3320 | D18: 18.3 | E18: =D18+E17 -> 153.6
A19: 2008-Q1 | B19: 0 | C19: =B19+C18 -> 3320 | D19: 30.3 | E19: =D19+E18 -> 183.9
A20: Q2 | B20: 0 | C20: =B20+C19 -> 3320 | D20: 21.9 | E20: =D20+E19 -> 205.8
A21: TOTAL | B21: =SUM(B9:B20) -> 3320 | D21: =SUM(D9:D20) -> 205.8
A24: Notes
A25: 1) | B25: A SEGUE tile consists of one bright and one faint plate combination. A tile is considered
B26: complete when both the bright and faint plates for a field are complete.
A27: 2) | B27: One SEGUE-faint plate equals two plate-equivalents