A1: SDSS Southern Spectroscopic Survey
A2: Cumulative Data Collected vs. Baseline
A3: Updated 06/17/05
C5: Baseline Plan | E5: Actual Performance
C6: Number of plates | E6: Number of plates
B7: Period | C7: by Qtr | D7: Cumulative | E7: by Qtr | F7: Cumulative
B8: 1999-Q1 | C8: 0 | D8: =C8 -> 0 | E8: 0 | F8: =E8 -> 0
B9: Q2 | C9: 0 | D9: =C9+D8 -> 0 | E9: 0 | F9: =E9+F8 -> 0
B10: Q3 | C10: 0 | D10: =C10+D9 -> 0 | E10: 0 | F10: =E10+F9 -> 0
B11: Q4 | C11: 0 | D11: =C11+D10 -> 0 | E11: 0 | F11: =E11+F10 -> 0
B12: 2000-Q1 | C12: 0 | D12: =C12+D11 -> 0 | E12: 0 | F12: =E12+F11 -> 0
B13: Q2 | C13: 0 | D13: =C13+D12 -> 0 | E13: 0 | F13: =E13+F12 -> 0
B14: Q3 | C14: 15.21 | D14: =C14+D13 -> 15.21 | E14: 43 | F14: =E14+F13 -> 43
B15: Q4 | C15: 51.854400000000005 | D15: =C15+D14 -> 67.064400000000006 | E15: 20 | F15: =E15+F14 -> 63
B16: 2001-Q1 | C16: 0 | D16: =C16+D15 -> 67.064400000000006 | E16: 3 | F16: =E16+F15 -> 66
B17: Q2 | C17: 0 | D17: =C17+D16 -> 67.064400000000006 | E17: 2 | F17: =E17+F16 -> 68
B18: Q3 | C18: 28.360800000000008 | D18: =C18+D17 -> 95.425200000000018 | E18: 31 | F18: =E18+F17 -> 99
B19: Q4 | C19: 53.071200000000005 | D19: =C19+D18 -> 148.49640000000002 | E19: 32 | F19: =E19+F18 -> 131
B20: 2002-Q1 | C20: 0 | D20: =C20+D19 -> 148.49640000000002 | E20: 0 | F20: =E20+F19 -> 131
B21: Q2 | C21: 0 | D21: =C21+D20 -> 148.49640000000002 | E21: 5 | F21: =E21+F20 -> 136
B22: Q3 | C22: 0 | D22: =C22+D21 -> 148.49640000000002 | E22: 15 | F22: =E22+F21 -> 151
B23: Q4 | C23: 0 | D23: =C23+D22 -> 148.49640000000002 | E23: 2 | F23: =E23+F22 -> 153
B24: 2003-Q1 | C24: 0 | D24: =C24+D23 -> 148.49640000000002 | E24: 0 | F24: =E24+F23 -> 153
B25: Q2 | C25: 0 | D25: =C25+D24 -> 148.49640000000002 | E25: 2 | F25: =E25+F24 -> 155
B26: Q3 | C26: 0 | D26: =C26+D25 -> 148.49640000000002 | E26: 1 | F26: =E26+F25 -> 156
B27: Q4 | C27: 0 | D27: =C27+D26 -> 148.49640000000002 | E27: 0 | F27: =E27+F26 -> 156
B28: 2004-Q1 | C28: 0 | D28: =C28+D27 -> 148.49640000000002 | E28: 0 | F28: =E28+F27 -> 156
B29: Q2 | C29: 0 | D29: =C29+D28 -> 148.49640000000002 | E29: 0 | F29: =E29+F28 -> 156
B30: Q3 | C30: 0 | D30: =C30+D29 -> 148.49640000000002 | E30: 0 | F30: =E30+F29 -> 156
B31: Q4 | C31: 0 | D31: =C31+D30 -> 148.49640000000002 | E31: 0 | F31: =E31+F30 -> 156
B32: 2005-Q1 | C32: 0 | D32: =C32+D31 -> 148.49640000000002 | E32: 0 | F32: =E32+F31 -> 156
B33: Q2 | C33: 0 | D33: =C33+D32 -> 148.49640000000002 | E33: 0 | F33: =E33+F32 -> 156
B34: TOTAL | C34: =SUM(C8:C33) -> 148.49640000000002 | D34: =D33 -> 148.49640000000002
B36: - This table combines first-pass spectroscopy from the equatorial and outrigger stripes.
B37: - Actual 2005-Q2 results include data collected through 06/11/05.