A1: SDSS Southern Photometric Survey
A2: Cumulative Data Collected vs. Baseline
A3: Updated 06/17/05
C5: Baseline Plan | E5: Actual Performance
C6: Combined | E6: South-Outriggers | G6: South-Equator | I6: Combined
C7: (Square Degrees) | E7: (Square Degrees) | G7: (Square Degrees) | I7: (Square Degrees)
B8: Period | C8: by Qtr | D8: Cumulative | E8: by Qtr | F8: Cumulative | G8: by Qtr | H8: Cumulative | I8: by Qtr | J8: Cumulative
B9: 1999-Q1 | C9: 0 | D9: =C9 -> 0 | E9: 0 | F9: =E9 -> 0 | G9: 186 | H9: =G9 -> 186 | I9: =E9+G9 -> 186 | J9: =I9 -> 186
B10: Q2 | C10: 0 | D10: =C10+D9 -> 0 | E10: 0 | F10: =E10+F9 -> 0 | G10: 0 | H10: =H9+G10 -> 186 | I10: =E10+G10 -> 0 | J10: =I10+J9 -> 186
B11: Q3 | C11: 0 | D11: =C11+D10 -> 0 | E11: 0 | F11: =E11+F10 -> 0 | G11: 0 | H11: =H10+G11 -> 186 | I11: =E11+G11 -> 0 | J11: =I11+J10 -> 186
B12: Q4 | C12: 0 | D12: =C12+D11 -> 0 | E12: 111 | F12: =E12+F11 -> 111 | G12: 22 | H12: =H11+G12 -> 208 | I12: =E12+G12 -> 133 | J12: =I12+J11 -> 319
B13: 2000-Q1 | C13: 0 | D13: =C13+D12 -> 0 | E13: 0 | F13: =E13+F12 -> 111 | G13: 0 | H13: =H12+G13 -> 208 | I13: =E13+G13 -> 0 | J13: =I13+J12 -> 319
B14: Q2 | C14: 0 | D14: =C14+D13 -> 0 | E14: 0 | F14: =E14+F13 -> 111 | G14: 0 | H14: =H13+G14 -> 208 | I14: =E14+G14 -> 0 | J14: =I14+J13 -> 319
B15: Q3 | C15: 141.49687499999999 | D15: =C15+D14 -> 141.49687499999999 | E15: 253 | F15: =E15+F14 -> 364 | G15: 0 | H15: =H14+G15 -> 208 | I15: =E15+G15 -> 253 | J15: =I15+J14 -> 572
B16: Q4 | C16: 361.79662500000006 | D16: =C16+D15 -> 503.29350000000005 | E16: 25 | F16: =E16+F15 -> 389 | G16: 47 | H16: =H15+G16 -> 255 | I16: =E16+G16 -> 72 | J16: =I16+J15 -> 644
B17: 2001-Q1 | C17: 0 | D17: =C17+D16 -> 503.29350000000005 | E17: 0 | F17: =E17+F16 -> 389 | G17: 0 | H17: =H16+G17 -> 255 | I17: =E17+G17 -> 0 | J17: =I17+J16 -> 644
B18: Q2 | C18: 0 | D18: =C18+D17 -> 503.29350000000005 | E18: 0 | F18: =E18+F17 -> 389 | G18: 10 | H18: =H17+G18 -> 265 | I18: =E18+G18 -> 10 | J18: =I18+J17 -> 654
B19: Q3 | C19: 131.91862500000002 | D19: =C19+D18 -> 635.21212500000001 | E19: 79 | F19: =E19+F18 -> 468 | G19: 5 | H19: =G19+H18 -> 270 | I19: =E19+G19 -> 84 | J19: =I19+J18 -> 738
B20: Q4 | C20: 109.71450000000002 | D20: =C20+D19 -> 744.92662500000006 | E20: 0 | F20: =E20+F19 -> 468 | G20: 0 | H20: =G20+H19 -> 270 | I20: =E20+G20 -> 0 | J20: =I20+J19 -> 738
B21: 2002-Q1 | C21: 0 | D21: =C21+D20 -> 744.92662500000006 | E21: 0 | F21: =E21+F20 -> 468 | G21: 0 | H21: =G21+H20 -> 270 | I21: =E21+G21 -> 0 | J21: =I21+J20 -> 738
B22: Q2 | C22: 0 | D22: =C22+D21 -> 744.92662500000006 | E22: 0 | F22: =E22+F21 -> 468 | G22: 0 | H22: =G22+H21 -> 270 | I22: =E22+G22 -> 0 | J22: =I22+J21 -> 738
B23: Q3 | C23: 0 | D23: =C23+D22 -> 744.92662500000006 | E23: 0 | F23: =E23+F22 -> 468 | G23: 0 | H23: =G23+H22 -> 270 | I23: =E23+G23 -> 0 | J23: =I23+J22 -> 738
B24: Q4 | C24: 0 | D24: =C24+D23 -> 744.92662500000006 | E24: 0 | F24: =E24+F23 -> 468 | G24: 0 | H24: 270 | I24: =E24+G24 -> 0 | J24: =I24+J23 -> 738
B25: 2003-Q1 | C25: 0 | D25: =C25+D24 -> 744.92662500000006 | E25: 0 | F25: =E25+F24 -> 468 | G25: 0 | H25: =G25+H24 -> 270 | I25: =E25+G25 -> 0 | J25: =I25+J24 -> 738
B26: Q2 | C26: 0 | D26: =C26+D25 -> 744.92662500000006 | E26: 0 | F26: =E26+F25 -> 468 | G26: 0 | H26: =G26+H25 -> 270 | I26: =E26+G26 -> 0 | J26: =I26+J25 -> 738
B27: Q3 | C27: 0 | D27: =C27+D26 -> 744.92662500000006 | E27: 0 | F27: =E27+F26 -> 468 | G27: 0 | H27: =G27+H26 -> 270 | I27: =E27+G27 -> 0 | J27: =I27+J26 -> 738
B28: Q4 | C28: 0 | D28: =C28+D27 -> 744.92662500000006 | E28: 0 | F28: =E28+F27 -> 468 | G28: 0 | H28: =G28+H27 -> 270 | I28: =E28+G28 -> 0 | J28: =I28+J27 -> 738
B29: 2004-Q1 | C29: 0 | D29: =C29+D28 -> 744.92662500000006 | E29: 0 | F29: =E29+F28 -> 468 | G29: 0 | H29: =G29+H28 -> 270 | I29: =E29+G29 -> 0 | J29: =I29+J28 -> 738
B30: Q2 | C30: 0 | D30: =C30+D29 -> 744.92662500000006 | E30: 0 | F30: =E30+F29 -> 468 | G30: 0 | H30: =G30+H29 -> 270 | I30: =E30+G30 -> 0 | J30: =I30+J29 -> 738
B31: Q3 | C31: 0 | D31: =C31+D30 -> 744.92662500000006 | E31: 0 | F31: =E31+F30 -> 468 | G31: 0 | H31: =G31+H30 -> 270 | I31: =E31+G31 -> 0 | J31: =I31+J30 -> 738
B32: Q4 | C32: 0 | D32: =C32+D31 -> 744.92662500000006 | E32: 0 | F32: =E32+F31 -> 468 | G32: 0 | H32: =G32+H31 -> 270 | I32: =E32+G32 -> 0 | J32: =I32+J31 -> 738
B33: 2005-Q1 | C33: 0 | D33: =C33+D32 -> 744.92662500000006 | E33: 0 | F33: =E33+F32 -> 468 | G33: 0 | H33: =G33+H32 -> 270 | I33: =E33+G33 -> 0 | J33: =I33+J32 -> 738
B34: Q2 | C34: 0 | D34: =C34+D33 -> 744.92662500000006 | E34: 0 | F34: =E34+F33 -> 468 | G34: 0 | H34: =G34+H33 -> 270 | I34: =E34+G34 -> 0 | J34: =I34+J33 -> 738
B35: TOTAL | C35: =SUM(C9:C34) -> 744.92662500000006 | D35: =D34 -> 744.92662500000006
B38: - This table combines first-pass imaging from the equatorial and outrigger stripes.
B39: - 2005-Q2 actual numbers include data collected through 06/11/05.
B40: \