A1: SDSS 5-Year Baseline Survey
A2: Baseline Performance Metrics: Southern Photometric Survey
A3: Revised 08-24-01
A5: Period | C5: Available dark hrs. (Outriggers) | D5: Available dark hrs. (Equator) | E5: Available dark hrs. (Total) | F5: Imaging fraction | G5: Weather | H5: System uptime | I5: Imaging efficiency | J5: Imaging ops. | K5: End game | L5: Available imaging hrs. | M5: Imaging (sq. deg)
A6: 2000 | B6: Q1
B7: Q2 | L7: = E7*F7*G7*H7*I7*J7 -> 0 | M7: = L7 *18.75 -> 0
B8: Q3 | C8: 130 | D8: 65 | E8: =SUM(C8:D8) -> 195 | F8: 0.2 | G8: 0.5 | H8: 0.9 | I8: 0.86 | J8: 0.5 | K8: 1 | L8: = E8*F8*G8*H8*I8*J8 -> 7.5465 | M8: = L8 *18.75 -> 141.49687499999999
B9: Q4 | C9: 185 | D9: 92 | E9: =SUM(C9:D9) -> 277 | F9: 0.2 | G9: 0.6 | H9: 0.9 | I9: 0.86 | J9: 0.75 | K9: 1 | L9: = E9*F9*G9*H9*I9*J9 -> 19.295820000000003 | M9: = L9 *18.75 -> 361.79662500000006
A10: 2001 | B10: Q1 | L10: = E10*F10*G10*H10*I10*J10 -> 0 | M10: = L10 *18.75 -> 0
B11: Q2 | L11: = E11*F11*G11*H11*I11*J11 -> 0 | M11: = L11 *18.75 -> 0
B12: Q3 | C12: 58 | D12: 43 | E12: =SUM(C12:D12) -> 101 | F12: 0.2 | G12: 0.5 | H12: 0.9 | I12: 0.86 | J12: 0.9 | K12: 1 | L12: = E12*F12*G12*H12*I12*J12 -> 7.0356600000000009 | M12: = L12 *18.75 -> 131.91862500000002
B13: Q4 | C13: 81 | D13: 59 | E13: =SUM(C13:D13) -> 140 | F13: 0.1 | G13: 0.6 | H13: 0.9 | I13: 0.86 | J13: 0.9 | K13: 1 | L13: = E13*F13*G13*H13*I13*J13 -> 5.8514400000000011 | M13: = L13 *18.75 -> 109.71450000000002
A14: 2002 | B14: Q1 | L14: = E14*F14*G14*H14*I14*J14 -> 0 | M14: = L14 *18.75 -> 0
B15: Q2 | L15: = E15*F15*G15*H15*I15*J15 -> 0 | M15: = L15 *18.75 -> 0
B16: Q3 | E16: =SUM(C16:D16) -> 0 | F16: 0.2 | G16: 0.5 | H16: 0.9 | I16: 0.86 | J16: 0.9 | K16: 1 | L16: = E16*F16*G16*H16*I16*J16 -> 0 | M16: = L16 *18.75 -> 0
B17: Q4 | E17: =SUM(C17:D17) -> 0 | F17: 0.2 | G17: 0.6 | H17: 0.9 | I17: 0.86 | J17: 0.9 | K17: 1 | L17: = E17*F17*G17*H17*I17*J17 -> 0 | M17: = L17 *18.75 -> 0
A18: 2003 | B18: Q1 | L18: = E18*F18*G18*H18*I18*J18 -> 0 | M18: = L18 *18.75 -> 0
B19: Q2 | L19: = E19*F19*G19*H19*I19*J19 -> 0 | M19: = L19 *18.75 -> 0
B20: Q3 | E20: =SUM(C20:D20) -> 0 | F20: 0.2 | G20: 0.5 | H20: 0.9 | I20: 0.86 | J20: 0.9 | K20: 1 | L20: = E20*F20*G20*H20*I20*J20 -> 0 | M20: = L20 *18.75 -> 0
B21: Q4 | E21: =SUM(C21:D21) -> 0 | F21: 0.2 | G21: 0.6 | H21: 0.9 | I21: 0.86 | J21: 0.9 | K21: 1 | L21: = E21*F21*G21*H21*I21*J21 -> 0 | M21: = L21 *18.75 -> 0
A22: 2004 | B22: Q1 | L22: = E22*F22*G22*H22*I22*J22 -> 0 | M22: = L22 *18.75 -> 0
B23: Q2 | L23: = E23*F23*G23*H23*I23*J23 -> 0 | M23: = L23 *18.75 -> 0
B24: Q3 | E24: =SUM(C24:D24) -> 0 | F24: 0.2 | G24: 0.5 | H24: 0.9 | I24: 0.86 | J24: 0.9 | K24: 1 | L24: = E24*F24*G24*H24*I24*J24 -> 0 | M24: = L24 *18.75 -> 0
B25: Q4 | E25: =SUM(C25:D25) -> 0 | F25: 0.2 | G25: 0.6 | H25: 0.9 | I25: 0.86 | J25: 0.9 | K25: 1 | L25: = E25*F25*G25*H25*I25*J25 -> 0 | M25: = L25 *18.75 -> 0
A26: 2005 | B26: Q1 | L26: = E26*F26*G26*H26*I26*J26 -> 0 | M26: = L26 *18.75 -> 0
B27: Q2 | L27: = E27*F27*G27*H27*I27*J27 -> 0 | M27: = L27 *18.75 -> 0
A28: TOTAL | C28: =SUM(C7:C27) -> 454 | D28: =SUM(D7:D27) -> 259 | E28: =SUM(E7:E27) -> 713 | L28: =SUM(L7:L27) -> 39.729420000000005 | M28: =SUM(M7:M27) -> 744.92662500000006
A31: Notes:
A32: 1) | B32: This table combines first-pass imaging from the equatorial and outrigger stripes.