A2: Test # | B2: Altitude Range (deg) | C2: # of Sweeps | D2: Velocity (kcps) | E2: Position prior to re-fiducializing | F2: Position after re-fiducializing | G2: Change (asec) | H2: Change (encoder counts)
A3: 1 | B3: 6 to 90 | C3: 3 | D3: 100 | E3: 0.66666666666666663 | F3: 0.66658136574074078 | G3: =E3-F3 -> 8.5300925925846371E-5 | H3: 512
A4: 2 | B4: 20 to 90 | C4: 3 | D4: 100 | E4: 0.66666666666666663 | F4: 0.66658495370370374 | G4: =E4-F4 -> 8.1712962962887659E-5 | H4: 490
A5: 3 | B5: 60 to 90 | C5: 3 | D5: 100 | E5: 0.66666666666666663 | F5: 0.66662546296296299 | G5: =E5-F5 -> 4.1203703703640571E-5 | H5: 247
A6: 4 | B6: 6 to 90 | C6: 3 | D6: 200 | E6: 0.66666666666666663 | F6: 0.66636006944444448 | G6: =E6-F6 -> 3.0659722222214914E-4 | H6: 1840
A7: 5 | B7: 20 to 90 | C7: 3 | D7: 200 | E7: 0.66666666666666663 | F7: 0.66660023148148151 | G7: =E7-F7 -> 6.6435185185120815E-5 | H7: 399
A8: 6 | B8: 60 to 90 | C8: 3 | D8: 200 | E8: 0.66666666666666663 | F8: 0.66662835648148155 | G8: =E8-F8 -> 3.8310185185075341E-5 | H8: 230
A9: 7 | B9: 6 to 90 | C9: 6 | D9: 100 | E9: 0.66666666666666663 | F9: 0.66652511574074069 | G9: =E9-F9 -> 1.4155092592593732E-4 | H9: 849
A10: 8 | B10: 20 to 90 | C10: 6 | D10: 100 | E10: 0.66666666666666663 | F10: 0.66652523148148146 | G10: =E10-F10 -> 1.4143518518516807E-4 | H10: 849
A11: 9 | B11: 60 to 90 | C11: 6 | D11: 100 | E11: 0.66666666666666663 | F11: 0.66657731481481475 | G11: =E11-F11 -> 8.9351851851882103E-5 | H11: 536
A12: 10 | B12: 6 to 90 | C12: 6 | D12: 200 | E12: 0.66666666666666663 | F12: 0.66653414351851847 | G12: =E12-F12 -> 1.3252314814815591E-4 | H12: 795
A13: 11 | B13: 20 to 90 | C13: 6 | D13: 200 | E13: 0.66666666666666663 | F13: 0.66651446759259259 | G13: =E13-F13 -> 1.521990740740442E-4 | H13: 913