A1: Performance Statistics for SDSS Observing Operations
A2: Updated 9/28/04
A4: Dark Time
C5: 2001 | H5: 2002 | T5: 2003 | AG5: 2004
A6: Category | B6: Baseline | C6: Aug-01 | D6: Sep-01 | E6: Oct-01 | F6: Nov-01 | G6: Dec-01 | H6: Jan-02 | I6: Feb-02 | J6: Mar-02 | K6: Apr-02 | L6: May-02 | M6: Jun-02 | N6: Jul-02 | O6: Aug-02 | P6: Sep-02 | Q6: Oct-02 | R6: Nov-02 | S6: Dec-02 | T6: Jan-03 | U6: Feb-03 | V6: Mar-03 | W6: Apr-03 | X6: May-03 | Y6: Jun-03 | Z6: Jul-03 | AA6: Aug-03 | AB6: Aug-03 | AC6: Sep-03 | AD6: Oct-03 | AE6: Nov-03 | AF6: Dec-03 | AG6: Jan-04 | AH6: Feb-04 | AI6: Mar-04 | AJ6: Apr-04 | AK6: May-04 | AL6: Jun-04 | AM6: Jul-04 | AN6: Aug-04 | AO6: Sep-04 | AP6: Oct-04 | AQ6: Nov-04 | AR6: Dec-04
A7: Total Time | C7: 4.2243055555555555 | D7: 4.8409722222222227 | E7: 4.0986111111111105 | F7: 6.1993055555555552 | G7: 6.5555555555555562 | H7: 6.7229166666666664 | I7: 6.3611111111111107 | J7: 6.0013888888888891 | K7: 5.1527777777777777 | L7: 4.1743055555555557 | M7: 3.8569444444444443 | N7: 2.55 | O7: Summer Shutdown | P7: 4.3576388888888884 | Q7: 3.6847222222222222 | R7: 5.4805555555555552 | S7: 5.9555555555555557 | T7: 5.7416666666666671 | U7: 5.843055555555555 | V7: 5.84375 | W7: 5.2743055555555554 | X7: 4.6194444444444445 | Y7: 4.1229166666666668 | Z7: 3.8534722222222224 | AA7: Summer Shutdown | AB7: 3.5722222222222224 | AC7: 4.7805555555555559 | AD7: 5.6631944444444438 | AE7: 6.0069444444444438 | AF7: 6.2847222222222223 | AG7: 6.1291666666666664 | AH7: 5.8590277777777784 | AI7: 5.3298611111111116 | AJ7: 4.7979166666666666 | AK7: 4.1395833333333334 | AL7: 4.0069444444444446 | AM7: Summer Shutdown | AN7: 4.885416666666667 | AO7: 4.5152777777777775
A8: Imaging fraction | B8: 00.24 | C8: 00.21 | D8: 00.43 | E8: 00.13 | F8: 00.44 | G8: 00.38 | H8: 00.31 | I8: 00.13 | J8: 00.24 | K8: 00.02 | L8: 00.22 | M8: 00.15 | N8: 0.00 | P8: 00.12 | Q8: 00.6 | R8: 00.34 | S8: 00.26 | T8: 00.07 | U8: 00.32 | V8: 00.44 | W8: 00.43 | X8: 00.43 | Y8: 00.34 | Z8: 00.36 | AB8: 00.01 | AC8: 00.54 | AD8: 00.38 | AE8: 00.23 | AF8: 00.12 | AG8: 00.31 | AH8: 00.13 | AI8: 00.24 | AJ8: 00.38 | AK8: 00.34 | AL8: 00.35 | AN8: 00.05 | AO8: 00.48
A9: Spectro fraction | B9: 00.66 | C9: 00.73 | D9: 00.48 | E9: 00.81 | F9: 00.51 | G9: 00.56 | H9: 00.58 | I9: 00.76 | J9: 00.64 | K9: 00.93 | L9: 00.74 | M9: 00.76 | N9: 00.97 | P9: 00.78 | Q9: 00.34 | R9: 00.55 | S9: 00.65 | T9: 00.77 | U9: 00.6 | V9: 00.52 | W9: 00.54 | X9: 00.54 | Y9: 00.6 | Z9: 00.54 | AB9: 00.9 | AC9: 00.3 | AD9: 00.52 | AE9: 00.46 | AF9: 00.71 | AG9: 0.25 | AH9: 00.68 | AI9: 00.69 | AJ9: 00.48 | AK9: 00.55 | AL9: 00.55 | AN9: 00.8 | AO9: 00.35
A10: Weather | B10: 0.50 | C10: 00.31 | D10: 00.53 | E10: 00.88 | F10: 0.50 | G10: 00.52 | H10: 00.55 | I10: 00.46 | J10: 00.44 | K10: 00.64 | L10: 00.53 | M10: 00.52 | N10: 00.37 | P10: 00.4 | Q10: 00.47 | R10: 00.58 | S10: 00.34 | T10: 00.64 | U10: 00.63 | V10: 00.29 | W10: 00.58 | X10: 00.8 | Y10: 00.49 | Z10: 00.7 | AB10: 00.29 | AC10: 00.63 | AD10: 00.77 | AE10: 00.56 | AF10: 00.68 | AG10: 00.27 | AH10: 00.51 | AI10: 00.51 | AJ10: 00.67 | AK10: 00.62 | AL10: 00.59 | AN10: 00.4 | AO10: 00.74
A11: System uptime | B11: 00.9 | C11: 00.89 | D11: 00.98 | E11: 00.93 | F11: 00.89 | G11: 00.92 | H11: 00.93 | I11: 00.99 | J11: 00.95 | K11: 00.99 | L11: 00.9 | M11: 00.98 | N11: 00.96 | P11: 00.98 | Q11: 1.00 | R11: 00.98 | S11: 00.98 | T11: 00.98 | U11: 00.91 | V11: 00.99 | W11: 1.00 | X11: 00.99 | Y11: 00.98 | Z11: 00.92 | AB11: 00.99 | AC11: 00.92 | AD11: 1.00 | AE11: 00.97 | AF11: 00.84 | AG11: 1.00 | AH11: 00.96 | AI11: 00.98 | AJ11: 00.99 | AK11: 00.94 | AL11: 00.98 | AN11: 00.98 | AO11: 00.95
A12: Imaging efficiency | B12: 00.86 | C12: 00.62 | D12: 00.67 | E12: 00.63 | F12: 00.82 | G12: 00.83 | H12: 00.84 | I12: 00.74 | J12: 00.87 | K12: 00.68 | L12: 00.83 | M12: 00.84 | P12: 00.88 | Q12: 00.9 | R12: 00.9 | S12: 00.85 | T12: 00.84 | U12: 00.8 | V12: 00.84 | W12: 00.9 | X12: 00.9 | Y12: 00.79 | Z12: 00.86 | AC12: 00.8 | AD12: 00.9 | AE12: 00.82 | AF12: 00.83 | AG12: 00.06 | AH12: 00.73 | AI12: 00.72 | AJ12: 00.84 | AK12: 00.85 | AL12: 00.83 | AN12: 0.75 | AO12: 00.88
A13: Spectro efficiency | B13: 00.65 | C13: 00.6 | D13: 00.59 | E13: 00.57 | F13: 00.6 | G13: 00.66 | H13: 00.6 | I13: 00.66 | J13: 00.58 | K13: 00.63 | L13: 00.63 | M13: 00.58 | N13: 00.65 | P13: 00.67 | Q13: 00.56 | R13: 00.64 | S13: 00.66 | T13: 00.63 | U13: 00.61 | V13: 00.57 | W13: 00.6 | X13: 00.6 | Y13: 00.55 | Z13: 00.61 | AB13: 00.6 | AC13: 00.55 | AD13: 00.7 | AE13: 00.7 | AF13: 00.7 | AG13: 00.65 | AH13: 00.69 | AI13: 00.66 | AJ13: 00.67 | AK13: 00.69 | AL13: 00.66 | AN13: 00.7 | AO13: 00.72
A14: Operations efficiency | B14: 00.9 | C14: 00.93 | D14: 00.93 | E14: 00.96 | F14: 00.96 | G14: 00.94 | H14: 00.93 | I14: 00.93 | J14: 00.89 | K14: 00.95 | L14: 00.97 | M14: 00.92 | N14: 00.97 | P14: 00.96 | Q14: 00.94 | R14: 00.97 | S14: 00.97 | T14: 00.96 | U14: 00.96 | V14: 00.96 | W14: 00.96 | X14: 00.97 | Y14: 00.95 | Z14: 00.97 | AB14: 00.93 | AC14: 00.95 | AD14: 00.97 | AE14: 00.96 | AF14: 00.94 | AG14: 00.56 | AH14: 00.96 | AI14: 00.96 | AJ14: 00.97 | AK14: 00.96 | AL14: 00.96 | AN14: 00.92 | AO14: 00.97
A15: Hours lost to problems | C15: 0.4513888888888889 | D15: 9.8611111111111108E-2 | E15: 0.28541666666666665 | F15: 0.69166666666666676 | G15: 0.52777777777777779 | H15: 0.46527777777777773 | I15: 8.4722222222222213E-2 | J15: 0.28541666666666665 | K15: 5.6944444444444443E-2 | L15: 0.40763888888888888 | M15: 7.9166666666666663E-2 | N15: 0.1111111111111111 | P15: 6.7361111111111108E-2 | Q15: 0 | R15: 9.0277777777777776E-2 | S15: 0.1173611111111111 | T15: 0.12430555555555556 | U15: 0.54861111111111105 | V15: 8.7499999999999994E-2 | W15: 6.9444444444444441E-3 | X15: 5.4166666666666669E-2 | Y15: 8.0555555555555561E-2 | Z15: 0.3034722222222222 | AB15: 3.1944444444444449E-2 | AC15: 0.3979166666666667 | AD15: 2.7777777777777776E-2 | AE15: 0.16458333333333333 | AF15: 1.0020833333333334 | AG15: 0 | AH15: 0.22013888888888888 | AI15: 9.930555555555555E-2 | AJ15: 2.5000000000000001E-2 | AK15: 0.2673611111111111 | AL15: 6.3194444444444442E-2 | AN15: 0.10625 | AO15: 0.20624999999999999
A16: Hours lost to weather | C16: 2.8562500000000002 | D16: 2.2951388888888888 | E16: 0.5083333333333333 | F16: 3.0513888888888889 | G16: 3.0819444444444444 | H16: 2.9034722222222222 | I16: 3.4604166666666667 | J16: 3.2583333333333333 | K16: 1.8298611111111109 | L16: 1.752777777777778 | M16: 1.8479166666666667 | N16: 1.6027777777777779 | P16: 2.6284722222222223 | Q16: 1.9395833333333332 | R16: 2.3194444444444442 | S16: 3.9541666666666671 | T16: 2.0756944444444447 | U16: 2.1347222222222224 | V16: 4.1208333333333336 | W16: 2.2013888888888888 | X16: 0.9243055555555556 | Y16: 2.0958333333333332 | Z16: 0.92847222222222225 | AB16: 2.5208333333333335 | AC16: 1.784027777777778 | AD16: 1.3284722222222223 | AE16: 2.6618055555555555 | AF16: 1.6465277777777778 | AG16: 4.4986111111111109 | AH16: 2.8680555555555554 | AI16: 2.6062500000000002 | AJ16: 1.5777777777777777 | AK16: 1.5611111111111111 | AL16: 1.6041666666666667 | AN16: 2.9097222222222219 | AO16: 1.1645833333333333
A19: Dark Time Baseline Table (for plotting purposes)
C20: 2001 | H20: 2002 | T20: 2002 | AG20: 2002
A21: Category | B21: Baseline | C21: Aug-01 | D21: Sep | E21: Oct | F21: Nov | G21: Dec | H21: Jan | I21: Feb | J21: Mar | K21: Apr | L21: May | M21: Jun | N21: Jul | O21: Aug | P21: Sep | Q21: Oct | R21: Nov | S21: Dec | T21: Jan | U21: Feb | V21: Mar | W21: Apr | X21: May | Y21: Jun | Z21: Jul | AA21: Aug | AC21: Sep | AD21: Oct | AE21: Nov | AF21: Dec | AG21: Jan | AH21: Feb | AI21: Mar | AJ21: Apr | AK21: May | AL21: Jun | AM21: Jul | AN21: Aug | AO21: Sep | AP21: Oct | AQ21: Nov | AR21: Dec
A22: Total Time | C22: 0 | D22: 0 | E22: 0 | F22: 0 | G22: 0 | H22: 0 | I22: 0 | J22: 0 | T22: 0 | U22: 0 | V22: 0 | AG22: 0 | AH22: 0 | AI22: 0
A23: Imaging fraction | B23: 00.24 | C23: 00.24 | D23: 00.24 | E23: 00.24 | F23: 00.24 | G23: 00.24 | H23: 00.24 | I23: 00.24 | J23: 00.24 | K23: 00.24 | L23: 00.24 | M23: 00.24 | N23: 00.24 | O23: 00.24 | P23: 00.24 | Q23: 00.24 | R23: 00.24 | S23: 00.24 | T23: 00.24 | U23: 00.24 | V23: 00.24 | W23: 00.24 | X23: 00.24 | Y23: 00.24 | Z23: 00.24 | AA23: 00.24 | AB23: 00.24 | AC23: 00.24 | AD23: 00.24 | AE23: 00.24 | AF23: 00.24 | AG23: 00.24 | AH23: 00.24 | AI23: 00.24 | AJ23: 00.24 | AK23: 00.24 | AL23: 00.24 | AM23: 00.24 | AN23: 00.24 | AO23: 00.24 | AP23: 00.24 | AQ23: 00.24 | AR23: 00.24
A24: Spectro fraction | B24: 00.66 | C24: 00.66 | D24: 00.66 | E24: 00.66 | F24: 00.66 | G24: 00.66 | H24: 00.66 | I24: 00.66 | J24: 00.66 | K24: 00.66 | L24: 00.66 | M24: 00.66 | N24: 00.66 | O24: 00.66 | P24: 00.66 | Q24: 00.66 | R24: 00.66 | S24: 00.66 | T24: 00.66 | U24: 00.66 | V24: 00.66 | W24: 00.66 | X24: 00.66 | Y24: 00.66 | Z24: 00.66 | AA24: 00.66 | AB24: 00.66 | AC24: 00.66 | AD24: 00.66 | AE24: 00.66 | AF24: 00.66 | AG24: 00.66 | AH24: 00.66 | AI24: 00.66 | AJ24: 00.66 | AK24: 00.66 | AL24: 00.66 | AM24: 00.66 | AN24: 00.66 | AO24: 00.66 | AP24: 00.66 | AQ24: 00.66 | AR24: 00.66
A25: Weather | B25: 0.50 | C25: 0.50 | D25: 0.50 | E25: 00.6 | F25: 00.6 | G25: 00.6 | H25: 00.6 | I25: 00.6 | J25: 00.6 | K25: 00.6 | L25: 00.6 | M25: 00.6 | N25: 0.50 | O25: 0.50 | P25: 0.50 | Q25: 00.6 | R25: 00.6 | S25: 00.6 | T25: 00.6 | U25: 00.6 | V25: 00.6 | W25: 00.6 | X25: 00.6 | Y25: 00.6 | Z25: 0.50 | AA25: 0.50 | AB25: 0.50 | AC25: 0.50 | AD25: 00.6 | AE25: 00.6 | AF25: 00.6 | AG25: 00.6 | AH25: 00.6 | AI25: 00.6 | AJ25: 00.6 | AK25: 00.6 | AL25: 00.6 | AM25: 0.50 | AN25: 0.50 | AO25: 0.50 | AP25: 00.6 | AQ25: 00.6 | AR25: 00.6
A26: System uptime | B26: 00.9 | C26: 00.9 | D26: 00.9 | E26: 00.9 | F26: 00.9 | G26: 00.9 | H26: 00.9 | I26: 00.9 | J26: 00.9 | K26: 00.9 | L26: 00.9 | M26: 00.9 | N26: 00.9 | O26: 00.9 | P26: 00.9 | Q26: 00.9 | R26: 00.9 | S26: 00.9 | T26: 00.9 | U26: 00.9 | V26: 00.9 | W26: 00.9 | X26: 00.9 | Y26: 00.9 | Z26: 00.9 | AA26: 00.9 | AB26: 00.9 | AC26: 00.9 | AD26: 00.9 | AE26: 00.9 | AF26: 00.9 | AG26: 00.9 | AH26: 00.9 | AI26: 00.9 | AJ26: 00.9 | AK26: 00.9 | AL26: 00.9 | AM26: 00.9 | AN26: 00.9 | AO26: 00.9 | AP26: 00.9 | AQ26: 00.9 | AR26: 00.9
A27: Imaging efficiency | B27: 00.86 | C27: 00.86 | D27: 00.86 | E27: 00.86 | F27: 00.86 | G27: 00.86 | H27: 00.86 | I27: 00.86 | J27: 00.86 | K27: 00.86 | L27: 00.86 | M27: 00.86 | N27: 00.86 | O27: 00.86 | P27: 00.86 | Q27: 00.86 | R27: 00.86 | S27: 00.86 | T27: 00.86 | U27: 00.86 | V27: 00.86 | W27: 00.86 | X27: 00.86 | Y27: 00.86 | Z27: 00.86 | AA27: 00.86 | AB27: 00.86 | AC27: 00.86 | AD27: 00.86 | AE27: 00.86 | AF27: 00.86 | AG27: 00.86 | AH27: 00.86 | AI27: 00.86 | AJ27: 00.86 | AK27: 00.86 | AL27: 00.86 | AM27: 00.86 | AN27: 00.86 | AO27: 00.86 | AP27: 00.86 | AQ27: 00.86 | AR27: 00.86
A28: Spectro efficiency | B28: 00.65 | C28: 00.65 | D28: 00.65 | E28: 00.65 | F28: 00.65 | G28: 00.65 | H28: 00.65 | I28: 00.65 | J28: 00.65 | K28: 00.65 | L28: 00.65 | M28: 00.65 | N28: 00.65 | O28: 00.65 | P28: 00.65 | Q28: 00.65 | R28: 00.65 | S28: 00.65 | T28: 00.65 | U28: 00.65 | V28: 00.65 | W28: 00.65 | X28: 00.65 | Y28: 00.65 | Z28: 00.65 | AA28: 00.65 | AB28: 00.65 | AC28: 00.65 | AD28: 00.65 | AE28: 00.65 | AF28: 00.65 | AG28: 00.65 | AH28: 00.65 | AI28: 00.65 | AJ28: 00.65 | AK28: 00.65 | AL28: 00.65 | AM28: 00.65 | AN28: 00.65 | AO28: 00.65 | AP28: 00.65 | AQ28: 00.65 | AR28: 00.65
A29: Operations efficiency | B29: 00.9 | C29: 00.9 | D29: 00.9 | E29: 00.9 | F29: 00.9 | G29: 00.9 | H29: 00.9 | I29: 00.9 | J29: 00.9 | K29: 00.9 | L29: 00.9 | M29: 00.9 | N29: 00.9 | O29: 00.9 | P29: 00.9 | Q29: 00.9 | R29: 00.9 | S29: 00.9 | T29: 00.9 | U29: 00.9 | V29: 00.9 | W29: 00.9 | X29: 00.9 | Y29: 00.9 | Z29: 00.9 | AA29: 00.9 | AB29: 00.9 | AC29: 00.9 | AD29: 00.9 | AE29: 00.9 | AF29: 00.9 | AG29: 00.9 | AH29: 00.9 | AI29: 00.9 | AJ29: 00.9 | AK29: 00.9 | AL29: 00.9 | AM29: 00.9 | AN29: 00.9 | AO29: 00.9 | AP29: 00.9 | AQ29: 00.9 | AR29: 00.9
A30: Hours lost to problems | C30: 0 | D30: 0 | E30: 0 | F30: 0 | G30: 0 | H30: 0 | I30: 0 | J30: 0 | T30: 0 | U30: 0 | V30: 0 | AG30: 0 | AH30: 0 | AI30: 0
A31: Hours lost to weather | C31: 0 | D31: 0 | E31: 0 | F31: 0 | G31: 0 | H31: 0 | I31: 0 | J31: 0 | T31: 0 | U31: 0 | V31: 0 | AG31: 0 | AH31: 0 | AI31: 0
A35: Dark + Gray Time
C36: 2001 | H36: 2002 | T36: 2003 | AG36: 2004
A37: Category | B37: Baseline | C37: Aug-01 | D37: Sep-01 | E37: Oct-01 | F37: Nov-01 | G37: Dec-01 | H37: Jan-02 | I37: Feb-02 | J37: Mar-02 | K37: Apr-02 | L37: May-02 | M37: Jun-02 | N37: Jul-02 | O37: Aug-02 | P37: Sep-02 | Q37: Oct-02 | R37: Nov-02 | S37: Dec-02 | T37: Jan-03 | U37: Feb-03 | V37: Mar-03 | W37: Apr-03 | X37: May-03 | Y37: Jun-03 | Z37: Jul-03 | AA37: Aug-03 | AB37: Aug-03 | AC37: Sep-03 | AD37: Oct-03 | AE37: Nov-03 | AF37: Dec-03 | AG37: Jan-04 | AH37: Feb-04 | AI37: Mar-04 | AJ37: Apr-04 | AK37: May-04 | AL37: Jun-04 | AM37: Jul-04 | AN37: Aug-04 | AO37: Sep-04 | AP37: Oct-04 | AQ37: Nov-04 | AR37: Dec-04
A38: Total Time | C38: 5.8875000000000002 | D38: 6.7201388888888891 | E38: 5.4402777777777773 | F38: 8.9243055555555557 | G38: 9.2145833333333336 | H38: 9.5333333333333332 | I38: 8.5826388888888889 | J38: 7.9819444444444443 | K38: 6.582638888888888 | L38: 5.697916666666667 | M38: 5.0534722222222221 | N38: 2.9555555555555557 | O38: Summer Shutdown | P38: 5.6923611111111114 | Q38: 4.8569444444444443 | R38: 7.3993055555555562 | S38: 8.2423611111111104 | T38: 7.3465277777777773 | U38: 7.4854166666666666 | V38: 7.7381944444444448 | W38: 6.957638888888888 | X38: 5.5368055555555555 | Y38: 5.2388888888888889 | Z38: 5.0166666666666666 | AA38: Summer Shutdown | AB38: 4.0909722222222227 | AC38: 6.1541666666666659 | AD38: 8.4631944444444454 | AE38: 9.0222222222222221 | AF38: 9.6833333333333336 | AG38: 8.9868055555555557 | AH38: 8.406944444444445 | AI38: 7.2583333333333329 | AJ38: 6.3791666666666664 | AK38: 5.2166666666666668 | AL38: 5.2673611111111116 | AM38: Summer Shutdown | AN38: 7.6305555555555555 | AO38: 5.572222222222222
A39: Imaging fraction | B39: 00.24 | C39: 00.17 | D39: 00.31 | E39: 00.12 | F39: 00.34 | G39: 00.31 | H39: 00.28 | I39: 00.12 | J39: 00.2 | K39: 00.02 | L39: 00.16 | M39: 00.12 | N39: 0.00 | P39: 00.09 | Q39: 00.56 | R39: 00.27 | S39: 00.17 | T39: 00.08 | U39: 00.37 | V39: 00.33 | W39: 00.38 | X39: 00.42 | Y39: 00.33 | Z39: 00.36 | AB39: 00.01 | AC39: 00.46 | AD39: 00.29 | AE39: 00.17 | AF39: 00.1 | AG39: 00.17 | AH39: 00.11 | AI39: 00.23 | AJ39: 00.34 | AK39: 00.3 | AL39: 00.34 | AN39: 00.1 | AO39: 00.45
A40: Spectro fraction | B40: 00.66 | C40: 00.7 | D40: 00.59 | E40: 00.84 | F40: 00.64 | G40: 00.64 | H40: 00.65 | I40: 00.78 | J40: 00.7 | K40: 00.93 | L40: 00.78 | M40: 00.81 | N40: 00.97 | P40: 00.82 | Q40: 00.42 | R40: 00.65 | S40: 00.77 | T40: 00.79 | U40: 00.61 | V40: 00.64 | W40: 00.61 | X40: 00.58 | Y40: 00.66 | Z40: 00.58 | AB40: 00.91 | AC40: 00.44 | AD40: 00.59 | AE40: 00.57 | AF40: 00.73 | AG40: 00.4 | AH40: 00.68 | AI40: 00.65 | AJ40: 00.48 | AK40: 00.57 | AL40: 00.57 | AN40: 00.73 | AO40: 00.39
A41: Weather | B41: 0.50 | C41: 00.3 | D41: 00.59 | E41: 00.82 | F41: 00.49 | G41: 00.49 | H41: 00.47 | I41: 00.42 | J41: 00.47 | K41: 00.57 | L41: 00.59 | M41: 00.57 | N41: 00.35 | P41: 00.4 | Q41: 00.41 | R41: 00.59 | S41: 00.44 | T41: 00.58 | U41: 00.57 | V41: 00.32 | W41: 00.55 | X41: 00.78 | Y41: 00.47 | Z41: 00.64 | AB41: 00.3 | AC41: 00.63 | AD41: 00.73 | AE41: 00.54 | AF41: 00.61 | AG41: 00.34 | AH41: 00.49 | AI41: 00.46 | AJ41: 00.62 | AK41: 00.61 | AL41: 00.52 | AN41: 00.39 | AO41: 0.75
A42: System uptime | B42: 00.9 | C42: 00.9 | D42: 00.98 | E42: 00.94 | F42: 00.89 | G42: 00.92 | H42: 00.95 | I42: 00.99 | J42: 00.92 | K42: 00.99 | L42: 00.93 | M42: 00.97 | N42: 00.96 | P42: 00.99 | Q42: 1.00 | R42: 00.99 | S42: 00.98 | T42: 00.98 | U42: 00.87 | V42: 00.96 | W42: 00.99 | X42: 00.99 | Y42: 00.98 | Z42: 00.94 | AB42: 00.98 | AC42: 00.91 | AD42: 1.00 | AE42: 00.98 | AF42: 00.83 | AG42: 1.00 | AH42: 00.97 | AI42: 00.99 | AJ42: 1.00 | AK42: 00.95 | AL42: 00.96 | AN42: 00.98 | AO42: 00.96
A43: Imaging efficiency | B43: 00.86 | C43: 00.62 | D43: 00.67 | E43: 00.63 | F43: 00.82 | G43: 00.83 | H43: 00.84 | I43: 00.74 | J43: 00.87 | K43: 00.68 | L43: 00.83 | M43: 00.84 | P43: 00.88 | Q43: 00.9 | R43: 00.9 | S43: 00.85 | T43: 00.84 | U43: 00.8 | V43: 00.84 | W43: 00.9 | X43: 00.9 | Y43: 00.79 | Z43: 00.86 | AC43: 00.8 | AD43: 00.9 | AE43: 00.82 | AF43: 00.83 | AG43: 00.06 | AH43: 00.73 | AI43: 00.72 | AJ43: 00.84 | AK43: 00.85 | AL43: 00.83 | AN43: 0.75 | AO43: 00.88
A44: Spectro efficiency | B44: 00.65 | C44: 00.61 | D44: 00.63 | E44: 00.61 | F44: 00.6 | G44: 00.67 | H44: 00.61 | I44: 00.64 | J44: 00.61 | K44: 00.65 | L44: 00.64 | M44: 00.65 | N44: 00.65 | P44: 00.65 | Q44: 00.63 | R44: 00.63 | S44: 00.6 | T44: 00.63 | U44: 00.64 | V44: 00.58 | W44: 00.59 | X44: 00.56 | Y44: 00.56 | Z44: 00.61 | AB44: 00.6 | AC44: 00.59 | AD44: 00.7 | AE44: 00.69 | AF44: 00.7 | AG44: 00.65 | AH44: 00.66 | AI44: 00.64 | AJ44: 00.67 | AK44: 00.66 | AL44: 00.65 | AN44: 00.69 | AO44: 0.75
A45: Operations efficiency | B45: 00.9 | C45: 00.94 | D45: 00.94 | E45: 00.96 | F45: 00.96 | G45: 00.93 | H45: 00.92 | I45: 00.92 | J45: 00.9 | K45: 00.95 | L45: 00.95 | M45: 00.92 | N45: 00.97 | P45: 00.96 | Q45: 00.94 | R45: 00.96 | S45: 00.95 | T45: 00.95 | U45: 00.96 | V45: 00.95 | W45: 00.96 | X45: 00.97 | Y45: 00.94 | Z45: 00.96 | AB45: 00.94 | AC45: 00.95 | AD45: 00.97 | AE45: 00.95 | AF45: 00.93 | AG45: 00.57 | AH45: 00.96 | AI45: 00.96 | AJ45: 00.96 | AK45: 00.96 | AL45: 00.94 | AN45: 00.93 | AO45: 00.97
A46: Hours lost to problems | C46: 0.56180555555555556 | D46: 0.13055555555555556 | E46: 0.31527777777777777 | F46: 0.9375 | G46: 0.70763888888888893 | H46: 0.5 | I46: 9.7916666666666666E-2 | J46: 0.64166666666666672 | K46: 7.9861111111111105E-2 | L46: 0.41319444444444442 | M46: 0.17430555555555557 | N46: 0.1111111111111111 | P46: 7.1527777777777787E-2 | Q46: 0 | R46: 9.7916666666666666E-2 | S46: 0.17777777777777778 | T46: 0.12430555555555556 | U46: 0.99861111111111101 | V46: 0.16180555555555556 | W46: 5.8333333333333327E-2 | X46: 5.4166666666666669E-2 | Y46: 0.10416666666666667 | Z46: 0.3034722222222222 | AB46: 6.7361111111111108E-2 | AC46: 0.53541666666666665 | AD46: 2.7777777777777776E-2 | AE46: 0.16458333333333333 | AF46: 1.6263888888888889 | AG46: 0 | AH46: 0.25555555555555559 | AI46: 9.930555555555555E-2 | AJ46: 00.36 | AK46: 0.2673611111111111 | AL46: 0.18472222222222223 | AN46: 0.18472222222222223 | AO46: 0.20624999999999999
A47: Hours lost to weather | C47: 4.0541666666666663 | D47: 2.7666666666666671 | E47: 1.0020833333333334 | F47: 4.4569444444444448 | G47: 4.6291666666666664 | H47: 4.8916666666666666 | I47: 4.9569444444444448 | J47: 3.8624999999999998 | K47: 2.8152777777777778 | L47: 2.1229166666666668 | M47: 2.1305555555555555 | N47: 1.9076388888888889 | P47: 3.4201388888888888 | Q47: 2.8430555555555554 | R47: 3.0395833333333333 | S47: 4.603472222222222 | T47: 3.0826388888888889 | U47: 3.0319444444444446 | V47: 5.239583333333333 | W47: 3.125 | X47: 1.2347222222222223 | Y47: 2.7638888888888888 | Z47: 1.5826388888888889 | AB47: 2.8416666666666668 | AC47: 2.2638888888888888 | AD47: 2.2590277777777779 | AE47: 4.1083333333333334 | AF47: 3.1055555555555556 | AG47: 143.15 | AH47: 4.3104166666666668 | AI47: 3.9333333333333336 | AJ47: 2.3972222222222221 | AK47: 2.0194444444444444 | AL47: 2.3583333333333334 | AN47: 4.6722222222222225 | AO47: 1.4006944444444445
A51: Median Time for Spectroscopic Observing Activities
C53: 2001 | H53: 2002 | T53: 2003 | AG53: 2004
A54: Category* | B54: Baseline | C54: Aug-01 | D54: Sep-01 | E54: Oct-01 | F54: Nov-01 | G54: Dec-01 | H54: Jan-02 | I54: Feb-02 | J54: Mar-02 | K54: Apr-02 | L54: May-02 | M54: Jun-02 | N54: Jul-02 | O54: Aug-02 | P54: Sep-02 | Q54: Oct-02 | R54: Nov-02 | S54: Dec-02 | T54: Jan-03 | U54: Feb-03 | V54: Mar-03 | W54: Apr-03 | X54: May-03 | Y54: Jun-03 | Z54: Jul-03 | AA54: Aug-03 | AB54: Aug-03 | AC54: Sep-03 | AD54: Oct-03 | AE54: Nov-03 | AF54: Dec-03 | AG54: Jan-04 | AH54: Feb-04 | AI54: Mar-04 | AJ54: Apr-04 | AK54: May-04 | AL54: Jun-04 | AM54: Jul-04 | AN54: Aug-04 | AO54: Sep-04 | AP54: Oct-04 | AQ54: Nov-04 | AR54: Dec-04
O55: Summer Shutdown | AA55: Summer Shutdown | AM55: Summer Shutdown
A56: Cartridge change | B56: 10 | C56: 7 | D56: 7 | E56: 6 | F56: 6 | G56: 6 | H56: 6 | I56: 5 | J56: 5 | K56: 5 | L56: 5 | M56: 5 | N56: 5 | P56: 5 | Q56: 5 | R56: 5 | S56: 5 | T56: 5 | U56: 5 | V56: 4 | W56: 5 | X56: 4 | Y56: 4 | Z56: 5 | AB56: 7 | AC56: 4 | AD56: 4 | AE56: 4 | AF56: 4 | AG56: 8 | AH56: 4 | AI56: 4 | AJ56: 4 | AK56: 4 | AL56: 7 | AN56: 4 | AO56: 4
A57: Setup | B57: 10 | C57: 14 | D57: 14 | E57: 14 | F57: 15 | G57: 13 | H57: 12 | I57: 10 | J57: 12 | K57: 8 | L57: 10 | M57: 13 | N57: 14 | P57: 11 | Q57: 14 | R57: 15 | S57: 15 | T57: 13 | U57: 11 | V57: 15 | W57: 14 | X57: 10 | Y57: 13 | Z57: 15 | AB57: 14 | AC57: 13 | AD57: 11 | AE57: 15 | AF57: 13 | AG57: 13 | AH57: 13 | AI57: 14 | AJ57: 14 | AK57: 13 | AL57: 12 | AN57: 12 | AO57: 11
A58: Calibration | B58: 5 | C58: 12 | D58: 12 | E58: 12 | F58: 12 | G58: 12 | H58: 14 | I58: 12 | J58: 15 | K58: 12 | L58: 12 | M58: 12 | N58: 14 | P58: 14 | Q58: 14 | R58: 13 | S58: 13 | T58: 13 | U58: 13 | V58: 18 | W58: 13 | X58: 13 | Y58: 13 | Z58: 13 | AB58: 13 | AC58: 13 | AD58: 6 | AE58: 6 | AF58: 7 | AG58: 6 | AH58: 6 | AI58: 6 | AJ58: 6 | AK58: 6 | AL58: 6 | AN58: 6 | AO58: 6
A59: CCD readout (assumed) | B59: 0 | C59: 3 | D59: 3 | E59: 3 | F59: 3 | G59: 3 | H59: 3 | I59: 3 | J59: 3 | K59: 3 | L59: 3 | M59: 3 | N59: 3 | P59: 3 | Q59: 3 | R59: 3 | S59: 3 | T59: 3 | U59: 3 | V59: 3 | W59: 3 | X59: 3 | Y59: 3 | Z59: 3 | AB59: 3 | AC59: 3 | AD59: 3 | AE59: 3 | AF59: 3 | AG59: 3 | AH59: 3 | AI59: 3 | AJ59: 3 | AK59: 3 | AL59: 3 | AN59: 3 | AO59: 3
A60: Total overhead | B60: =SUM(B56:B59) -> 25 | C60: =SUM(C56:C59) -> 36 | D60: =SUM(D56:D59) -> 36 | E60: =SUM(E56:E59) -> 35 | F60: =SUM(F56:F59) -> 36 | G60: =SUM(G56:G59) -> 34 | H60: =SUM(H56:H59) -> 35 | I60: =SUM(I56:I59) -> 30 | J60: =SUM(J56:J59) -> 35 | K60: =SUM(K56:K59) -> 28 | L60: =SUM(L56:L59) -> 30 | M60: =SUM(M56:M59) -> 33 | N60: =SUM(N56:N59) -> 36 | P60: =SUM(P56:P59) -> 33 | Q60: =SUM(Q56:Q59) -> 36 | R60: =SUM(R56:R59) -> 36 | S60: =SUM(S56:S59) -> 36 | T60: =SUM(T56:T59) -> 34 | U60: =SUM(U56:U59) -> 32 | V60: =SUM(V56:V59) -> 40 | W60: =SUM(W56:W59) -> 35 | X60: =SUM(X56:X59) -> 30 | Y60: =SUM(Y56:Y59) -> 33 | Z60: =SUM(Z56:Z59) -> 36 | AB60: =SUM(AB56:AB59) -> 37 | AC60: =SUM(AC56:AC59) -> 33 | AD60: =SUM(AD56:AD59) -> 24 | AE60: =SUM(AE56:AE59) -> 28 | AF60: =SUM(AF56:AF59) -> 27 | AG60: =SUM(AG56:AG59) -> 30 | AH60: =SUM(AH56:AH59) -> 26 | AI60: =SUM(AI56:AI59) -> 27 | AJ60: =SUM(AJ56:AJ59) -> 27 | AK60: =SUM(AK56:AK59) -> 26 | AL60: =SUM(AL56:AL59) -> 28 | AN60: =SUM(AN56:AN59) -> 25 | AO60: =SUM(AO56:AO59) -> 24 | AP60: =SUM(AP56:AP59) -> 0 | AQ60: =SUM(AQ56:AQ59) -> 0 | AR60: =SUM(AR56:AR59) -> 0
A62: Science exposure (assumed) | B62: 45 | C62: 45 | D62: 45 | E62: 45 | F62: 45 | G62: 45 | H62: 45 | I62: 45 | J62: 45 | K62: 45 | L62: 45 | M62: 45 | N62: 45 | P62: 45 | Q62: 45 | R62: 45 | S62: 45 | T62: 45 | U62: 45 | V62: 45 | W62: 45 | X62: 45 | Y62: 45 | Z62: 45 | AB62: 45 | AC62: 45 | AD62: 45 | AE62: 45 | AF62: 45 | AG62: 45 | AH62: 45 | AI62: 45 | AJ62: 45 | AK62: 45 | AL62: 45 | AN62: 45 | AO62: 45
A63: Total time per plate | B63: =B60+B62 -> 70 | C63: =C60+C62 -> 81 | D63: =D60+D62 -> 81 | E63: =E60+E62 -> 80 | F63: =F60+F62 -> 81 | G63: =G60+G62 -> 79 | H63: =H60+H62 -> 80 | I63: =I60+I62 -> 75 | J63: =J60+J62 -> 80 | K63: =K60+K62 -> 73 | L63: =L60+L62 -> 75 | M63: =M60+M62 -> 78 | N63: =N60+N62 -> 81 | P63: =P60+P62 -> 78 | Q63: =Q60+Q62 -> 81 | R63: =R60+R62 -> 81 | S63: =S60+S62 -> 81 | T63: =T60+T62 -> 79 | U63: =U60+U62 -> 77 | V63: =V60+V62 -> 85 | W63: =W60+W62 -> 80 | X63: =X60+X62 -> 75 | Y63: =Y60+Y62 -> 78 | Z63: =Z60+Z62 -> 81 | AB63: =AB60+AB62 -> 82 | AC63: =AC60+AC62 -> 78 | AD63: =AD60+AD62 -> 69 | AE63: =AE60+AE62 -> 73 | AF63: =AF60+AF62 -> 72 | AG63: =AG60+AG62 -> 75 | AH63: =AH60+AH62 -> 71 | AI63: =AI60+AI62 -> 72 | AJ63: =AJ60+AJ62 -> 72 | AK63: =AK60+AK62 -> 71 | AL63: =AL60+AL62 -> 73 | AN63: =AN60+AN62 -> 70 | AO63: =AO60+AO62 -> 69 | AP63: =AP60+AP62 -> 0 | AQ63: =AQ60+AQ62 -> 0 | AR63: =AR60+AR62 -> 0
A65: Spectroscopic Efficiency | B65: 00.64 | C65: =C62/C63 -> 0.55555555555555558 | D65: =D62/D63 -> 0.55555555555555558 | E65: =E62/E63 -> 0.5625 | F65: =F62/F63 -> 0.55555555555555558 | G65: =G62/G63 -> 0.569620253164557 | H65: =H62/H63 -> 0.5625 | I65: =I62/I63 -> 00.6 | J65: =J62/J63 -> 0.5625 | K65: =K62/K63 -> 0.61643835616438358 | L65: =L62/L63 -> 00.6 | M65: =M62/M63 -> 0.57692307692307687 | N65: =N62/N63 -> 0.55555555555555558 | P65: =P62/P63 -> 0.57692307692307687 | Q65: =Q62/Q63 -> 0.55555555555555558 | R65: =R62/R63 -> 0.55555555555555558 | S65: =S62/S63 -> 0.55555555555555558 | T65: =T62/T63 -> 0.569620253164557 | U65: =U62/U63 -> 0.58441558441558439 | V65: 00.53 | W65: 00.56 | X65: 00.6 | Y65: 00.58 | Z65: 00.56 | AB65: 00.55 | AC65: 00.58 | AD65: 00.65 | AE65: 00.62 | AF65: 00.62 | AG65: 00.6 | AH65: 00.63 | AI65: 00.62 | AJ65: 00.62 | AK65: 00.63 | AL65: 00.62 | AN65: 00.64 | AO65: 00.65
A67: *Time shown in minutes
A69: Median Time Baseline Table (for plotting purposes)
C70: 2001 | H70: 2002 | T70: 2002 | AG70: 2002
A71: Category* | B71: Baseline | C71: Aug-01 | D71: Sep-01 | E71: Oct-01 | F71: Nov-01 | G71: Dec-01 | H71: Jan-02 | I71: Feb-02 | J71: Mar-02 | K71: Apr-02 | L71: May-02 | M71: Jun-02 | N71: Jul-02 | O71: Aug-02 | P71: Sep-02 | Q71: Oct-02 | R71: Nov-02 | S71: Dec-02 | T71: Jan-02 | U71: Feb-02 | V71: Mar-02 | W71: Apr-02 | X71: May-02 | Y71: Jun-02 | Z71: Jul-02 | AA71: Aug-02 | AC71: Sep-02 | AD71: Oct-02 | AE71: Nov-02 | AF71: Dec-02 | AG71: Jan-02 | AH71: Feb-02 | AI71: Mar-02 | AJ71: Apr-02 | AK71: May-02 | AL71: Jun-02 | AM71: Jul-02 | AN71: Aug-02 | AO71: Sep-02 | AP71: Oct-02 | AQ71: Nov-02 | AR71: Dec-02
A72: Cartridge change | B72: 10 | C72: 10 | D72: 10 | E72: 10 | F72: 10 | G72: 10 | H72: 10 | I72: 10 | J72: 10 | K72: 10 | L72: 10 | M72: 10 | N72: 10 | O72: 10 | P72: 10 | Q72: 10 | R72: 10 | S72: 10 | T72: 10 | U72: 10 | V72: 10 | W72: 10 | X72: 10 | Y72: 10 | Z72: 10 | AA72: 10 | AB72: 10 | AC72: 10 | AD72: 10 | AE72: 10 | AF72: 10 | AG72: 10 | AH72: 10 | AI72: 10 | AJ72: 10 | AK72: 10 | AL72: 10 | AM72: 10 | AN72: 10 | AO72: 10 | AP72: 10 | AQ72: 10 | AR72: 10
A73: Setup | B73: 10 | C73: 10 | D73: 10 | E73: 10 | F73: 10 | G73: 10 | H73: 10 | I73: 10 | J73: 10 | K73: 10 | L73: 10 | M73: 10 | N73: 10 | O73: 10 | P73: 10 | Q73: 10 | R73: 10 | S73: 10 | T73: 10 | U73: 10 | V73: 10 | W73: 10 | X73: 10 | Y73: 10 | Z73: 10 | AA73: 10 | AB73: 10 | AC73: 10 | AD73: 10 | AE73: 10 | AF73: 10 | AG73: 10 | AH73: 10 | AI73: 10 | AJ73: 10 | AK73: 10 | AL73: 10 | AM73: 10 | AN73: 10 | AO73: 10 | AP73: 10 | AQ73: 10 | AR73: 10
A74: Calibration | B74: 5 | C74: 5 | D74: 5 | E74: 5 | F74: 5 | G74: 5 | H74: 5 | I74: 5 | J74: 5 | K74: 5 | L74: 5 | M74: 5 | N74: 5 | O74: 5 | P74: 5 | Q74: 5 | R74: 5 | S74: 5 | T74: 5 | U74: 5 | V74: 5 | W74: 5 | X74: 5 | Y74: 5 | Z74: 5 | AA74: 5 | AB74: 5 | AC74: 5 | AD74: 5 | AE74: 5 | AF74: 5 | AG74: 5 | AH74: 5 | AI74: 5 | AJ74: 5 | AK74: 5 | AL74: 5 | AM74: 5 | AN74: 5 | AO74: 5 | AP74: 5 | AQ74: 5 | AR74: 5
A75: CCD readout (assumed) | B75: 0 | C75: 0 | D75: 0 | E75: 0 | F75: 0 | G75: 0 | H75: 0 | I75: 0 | J75: 0 | K75: 0 | L75: 0 | M75: 0 | N75: 0 | O75: 0 | P75: 0 | Q75: 0 | R75: 0 | S75: 0 | T75: 0 | U75: 0 | V75: 0 | W75: 0 | X75: 0 | Y75: 0 | Z75: 0 | AA75: 0 | AB75: 0 | AC75: 0 | AD75: 0 | AE75: 0 | AF75: 0 | AG75: 0 | AH75: 0 | AI75: 0 | AJ75: 0 | AK75: 0 | AL75: 0 | AM75: 0 | AN75: 0 | AO75: 0 | AP75: 0 | AQ75: 0 | AR75: 0
A76: Total overhead | B76: =SUM(B72:B75) -> 25 | C76: =SUM(C72:C75) -> 25 | D76: =SUM(D72:D75) -> 25 | E76: =SUM(E72:E75) -> 25 | F76: =SUM(F72:F75) -> 25 | G76: =SUM(G72:G75) -> 25 | H76: =SUM(H72:H75) -> 25 | I76: =SUM(I72:I75) -> 25 | J76: =SUM(J72:J75) -> 25 | K76: =SUM(K72:K75) -> 25 | L76: =SUM(L72:L75) -> 25 | M76: =SUM(M72:M75) -> 25 | N76: =SUM(N72:N75) -> 25 | O76: =SUM(O72:O75) -> 25 | P76: =SUM(P72:P75) -> 25 | Q76: =SUM(Q72:Q75) -> 25 | R76: =SUM(R72:R75) -> 25 | S76: =SUM(S72:S75) -> 25 | T76: =SUM(T72:T75) -> 25 | U76: =SUM(U72:U75) -> 25 | V76: =SUM(V72:V75) -> 25 | W76: =SUM(W72:W75) -> 25 | X76: =SUM(X72:X75) -> 25 | Y76: =SUM(Y72:Y75) -> 25 | Z76: =SUM(Z72:Z75) -> 25 | AA76: =SUM(AA72:AA75) -> 25 | AB76: =SUM(AB72:AB75) -> 25 | AC76: =SUM(AC72:AC75) -> 25 | AD76: =SUM(AD72:AD75) -> 25 | AE76: =SUM(AE72:AE75) -> 25 | AF76: =SUM(AF72:AF75) -> 25 | AG76: =SUM(AG72:AG75) -> 25 | AH76: =SUM(AH72:AH75) -> 25 | AI76: =SUM(AI72:AI75) -> 25 | AJ76: =SUM(AJ72:AJ75) -> 25 | AK76: =SUM(AK72:AK75) -> 25 | AL76: =SUM(AL72:AL75) -> 25 | AM76: =SUM(AM72:AM75) -> 25 | AN76: =SUM(AN72:AN75) -> 25 | AO76: =SUM(AO72:AO75) -> 25 | AP76: =SUM(AP72:AP75) -> 25 | AQ76: =SUM(AQ72:AQ75) -> 25 | AR76: =SUM(AR72:AR75) -> 25
A78: Science exposure (assumed) | B78: 45 | C78: 45 | D78: 45 | E78: 45 | F78: 45 | G78: 45 | H78: 45 | I78: 45 | J78: 45 | K78: 45 | L78: 45 | M78: 45 | N78: 45 | O78: 45 | P78: 45 | Q78: 45 | R78: 45 | S78: 45 | T78: 45 | U78: 45 | V78: 45 | W78: 45 | X78: 45 | Y78: 45 | Z78: 45 | AA78: 45 | AB78: 45 | AC78: 45 | AD78: 45 | AE78: 45 | AF78: 45 | AG78: 45 | AH78: 45 | AI78: 45 | AJ78: 45 | AK78: 45 | AL78: 45 | AM78: 45 | AN78: 45 | AO78: 45 | AP78: 45 | AQ78: 45 | AR78: 45
A79: Total time per plate | B79: =B76+B78 -> 70 | C79: =C76+C78 -> 70 | D79: =D76+D78 -> 70 | E79: =E76+E78 -> 70 | F79: =F76+F78 -> 70 | G79: =G76+G78 -> 70 | H79: =H76+H78 -> 70 | I79: =I76+I78 -> 70 | J79: =J76+J78 -> 70 | K79: =K76+K78 -> 70 | L79: =L76+L78 -> 70 | M79: =M76+M78 -> 70 | N79: =N76+N78 -> 70 | O79: =O76+O78 -> 70 | P79: =P76+P78 -> 70 | Q79: =Q76+Q78 -> 70 | R79: =R76+R78 -> 70 | S79: =S76+S78 -> 70 | T79: =T76+T78 -> 70 | U79: =U76+U78 -> 70 | V79: =V76+V78 -> 70 | W79: =W76+W78 -> 70 | X79: =X76+X78 -> 70 | Y79: =Y76+Y78 -> 70 | Z79: =Z76+Z78 -> 70 | AA79: =AA76+AA78 -> 70 | AB79: =AB76+AB78 -> 70 | AC79: =AC76+AC78 -> 70 | AD79: =AD76+AD78 -> 70 | AE79: =AE76+AE78 -> 70 | AF79: =AF76+AF78 -> 70 | AG79: =AG76+AG78 -> 70 | AH79: =AH76+AH78 -> 70 | AI79: =AI76+AI78 -> 70 | AJ79: =AJ76+AJ78 -> 70 | AK79: =AK76+AK78 -> 70 | AL79: =AL76+AL78 -> 70 | AM79: =AM76+AM78 -> 70 | AN79: =AN76+AN78 -> 70 | AO79: =AO76+AO78 -> 70 | AP79: =AP76+AP78 -> 70 | AQ79: =AQ76+AQ78 -> 70 | AR79: =AR76+AR78 -> 70
A81: Spectroscopic Efficiency | B81: 00.64 | C81: =C78/C79 -> 0.6428571428571429 | D81: =D78/D79 -> 0.6428571428571429 | E81: =E78/E79 -> 0.6428571428571429 | F81: =F78/F79 -> 0.6428571428571429 | G81: =G78/G79 -> 0.6428571428571429 | H81: =H78/H79 -> 0.6428571428571429 | I81: =I78/I79 -> 0.6428571428571429 | J81: =J78/J79 -> 0.6428571428571429 | K81: =K78/K79 -> 0.6428571428571429 | L81: =L78/L79 -> 0.6428571428571429 | M81: =M78/M79 -> 0.6428571428571429 | N81: =N78/N79 -> 0.6428571428571429 | O81: =O78/O79 -> 0.6428571428571429 | P81: =P78/P79 -> 0.6428571428571429 | Q81: =Q78/Q79 -> 0.6428571428571429 | R81: =R78/R79 -> 0.6428571428571429 | S81: =S78/S79 -> 0.6428571428571429 | T81: =T78/T79 -> 0.6428571428571429 | U81: =U78/U79 -> 0.6428571428571429 | V81: =V78/V79 -> 0.6428571428571429 | W81: =W78/W79 -> 0.6428571428571429 | X81: =X78/X79 -> 0.6428571428571429 | Y81: =Y78/Y79 -> 0.6428571428571429 | Z81: =Z78/Z79 -> 0.6428571428571429 | AA81: =AA78/AA79 -> 0.6428571428571429 | AB81: =AB78/AB79 -> 0.6428571428571429 | AC81: =AC78/AC79 -> 0.6428571428571429 | AD81: =AD78/AD79 -> 0.6428571428571429 | AE81: =AE78/AE79 -> 0.6428571428571429 | AF81: =AF78/AF79 -> 0.6428571428571429 | AG81: =AG78/AG79 -> 0.6428571428571429 | AH81: =AH78/AH79 -> 0.6428571428571429 | AI81: =AI78/AI79 -> 0.6428571428571429 | AJ81: =AJ78/AJ79 -> 0.6428571428571429 | AK81: =AK78/AK79 -> 0.6428571428571429 | AL81: =AL78/AL79 -> 0.6428571428571429 | AM81: =AM78/AM79 -> 0.6428571428571429 | AN81: =AN78/AN79 -> 0.6428571428571429 | AO81: =AO78/AO79 -> 0.6428571428571429 | AP81: =AP78/AP79 -> 0.6428571428571429 | AQ81: =AQ78/AQ79 -> 0.6428571428571429 | AR81: =AR78/AR79 -> 0.6428571428571429
A83: *Time shown in minutes
A84: Printable PDF version